  0.000000 10.129.34.51 -> 10.129.34.61 TCP 74 55053 > rlm-admin [SYN] Seq=0 Win=14600 Len=0 MSS=1460 SACK_PERM=1 TSval=62404231 TSecr=0 WS=512
  0.000071 10.129.34.61 -> 10.129.34.51 TCP 74 rlm-admin > 55053 [SYN, ACK] Seq=0 Ack=1 Win=14480 Len=0 MSS=1460 SACK_PERM=1 TSval=256001477 TSecr=62404231 WS=512
  0.000836 10.129.34.51 -> 10.129.34.61 TCP 66 55053 > rlm-admin [ACK] Seq=1 Ack=1 Win=14848 Len=0 TSval=62404231 TSecr=256001477
  0.007153 10.129.34.51 -> 10.129.34.61 TCP 66 38488 > rlm-admin [FIN, ACK] Seq=1 Ack=1 Win=29 Len=0 TSval=62404233 TSecr=255856179
  0.007424 10.129.34.61 -> 10.129.34.51 TCP 66 rlm-admin > 38488 [ACK] Seq=1 Ack=2 Win=29 Len=0 TSval=256001479 TSecr=62404233
  0.009889 10.129.34.61 -> 10.129.34.51 TCP 66 rlm-admin > 38488 [FIN, ACK] Seq=1 Ack=2 Win=29 Len=0 TSval=256001480 TSecr=62404233
  0.010427 10.129.34.51 -> 10.129.34.61 TCP 66 38488 > rlm-admin [ACK] Seq=2 Ack=2 Win=29 Len=0 TSval=62404234 TSecr=256001480
  3.196565 10.129.34.51 -> 10.129.34.61 SIP 870 Request: REGISTER sip:ims.hom
  3.196620 10.129.34.61 -> 10.129.34.51 TCP 66 rlm-admin > rbr-debug [ACK] Seq=1 Ack=805 Win=32 Len=0 TSval=256002277 TSecr=62405030
  3.197923 10.129.34.51 -> 10.129.34.61 SIP 871 Request: REGISTER sip:ims.hom
  3.197954 10.129.34.61 -> 10.129.34.51 TCP 66 rlm-admin > 60827 [ACK] Seq=1 Ack=806 Win=32 Len=0 TSval=256002277 TSecr=62405031
  3.198873 10.129.34.51 -> 10.129.34.61 SIP 868 Request: REGISTER sip:ims.hom
  3.198898 10.129.34.61 -> 10.129.34.51 TCP 66 rlm-admin > 58725 [ACK] Seq=1 Ack=803 Win=32 Len=0 TSval=256002277 TSecr=62405031
  3.202553 10.129.34.51 -> 10.129.34.61 SIP 868 Request: REGISTER sip:ims.hom
  3.202594 10.129.34.61 -> 10.129.34.51 TCP 66 rlm-admin > 39090 [ACK] Seq=1 Ack=803 Win=32 Len=0 TSval=256002278 TSecr=62405032
  3.203539 10.129.34.51 -> 10.129.34.61 SIP 871 Request: REGISTER sip:ims.hom
  3.203563 10.129.34.61 -> 10.129.34.51 TCP 66 rlm-admin > 50435 [ACK] Seq=1 Ack=806 Win=32 Len=0 TSval=256002278 TSecr=62405032
  3.204249 10.129.34.51 -> 10.129.34.61 SIP 868 Request: REGISTER sip:ims.hom
  3.204280 10.129.34.61 -> 10.129.34.51 TCP 66 rlm-admin > 44024 [ACK] Seq=1 Ack=803 Win=32 Len=0 TSval=256002279 TSecr=62405032
  3.205050 10.129.34.51 -> 10.129.34.61 SIP 871 Request: REGISTER sip:ims.hom
  3.205074 10.129.34.61 -> 10.129.34.51 TCP 66 rlm-admin > 48588 [ACK] Seq=1 Ack=806 Win=32 Len=0 TSval=256002279 TSecr=62405032
  3.206243 10.129.34.51 -> 10.129.34.61 SIP 869 Request: REGISTER sip:ims.hom
  3.206275 10.129.34.61 -> 10.129.34.51 TCP 66 rlm-admin > 41592 [ACK] Seq=1 Ack=804 Win=32 Len=0 TSval=256002279 TSecr=62405033
  3.206920 10.129.34.51 -> 10.129.34.61 SIP 871 Request: REGISTER sip:ims.hom
  3.206949 10.129.34.61 -> 10.129.34.51 TCP 66 rlm-admin > 42569 [ACK] Seq=1 Ack=806 Win=32 Len=0 TSval=256002279 TSecr=62405033
  3.207727 10.129.34.51 -> 10.129.34.61 SIP 873 Request: REGISTER sip:ims.hom
  3.207749 10.129.34.61 -> 10.129.34.51 TCP 66 rlm-admin > 39090 [ACK] Seq=1 Ack=1610 Win=35 Len=0 TSval=256002279 TSecr=62405033
  3.208422 10.129.34.51 -> 10.129.34.61 SIP 873 Request: REGISTER sip:ims.hom
  3.208472 10.129.34.61 -> 10.129.34.51 TCP 66 rlm-admin > 40341 [ACK] Seq=1 Ack=808 Win=32 Len=0 TSval=256002280 TSecr=62405033
  3.209198 10.129.34.51 -> 10.129.34.61 SIP 873 Request: REGISTER sip:ims.hom
  3.209227 10.129.34.61 -> 10.129.34.51 TCP 66 rlm-admin > 40023 [ACK] Seq=1 Ack=808 Win=32 Len=0 TSval=256002280 TSecr=62405033
  3.211502 10.129.34.51 -> 10.129.34.61 SIP 872 Request: REGISTER sip:ims.hom
  3.211529 10.129.34.61 -> 10.129.34.51 TCP 66 rlm-admin > 44024 [ACK] Seq=1 Ack=1609 Win=35 Len=0 TSval=256002280 TSecr=62405034
  3.212436 10.129.34.51 -> 10.129.34.61 SIP 873 Request: REGISTER sip:ims.hom
  3.212457 10.129.34.61 -> 10.129.34.51 TCP 66 rlm-admin > 58725 [ACK] Seq=1 Ack=1610 Win=35 Len=0 TSval=256002281 TSecr=62405034
  3.213144 10.129.34.51 -> 10.129.34.61 SIP 874 Request: REGISTER sip:ims.hom
  3.213173 10.129.34.61 -> 10.129.34.51 TCP 66 rlm-admin > 58931 [ACK] Seq=1 Ack=809 Win=32 Len=0 TSval=256002281 TSecr=62405034
  3.214092 10.129.34.51 -> 10.129.34.61 SIP 873 Request: REGISTER sip:ims.hom
  3.214112 10.129.34.61 -> 10.129.34.51 TCP 66 rlm-admin > 58725 [ACK] Seq=1 Ack=2417 Win=38 Len=0 TSval=256002281 TSecr=62405035
  3.214576 10.129.34.51 -> 10.129.34.61 SIP 873 Request: REGISTER sip:ims.hom
  3.214603 10.129.34.61 -> 10.129.34.51 TCP 66 rlm-admin > 55053 [ACK] Seq=1 Ack=808 Win=16384 Len=0 TSval=256002281 TSecr=62405035
  3.215347 10.129.34.51 -> 10.129.34.61 SIP 873 Request: REGISTER sip:ims.hom
  3.215366 10.129.34.61 -> 10.129.34.51 TCP 66 rlm-admin > 58725 [ACK] Seq=1 Ack=3224 Win=41 Len=0 TSval=256002281 TSecr=62405035
  3.216141 10.129.34.51 -> 10.129.34.61 SIP 873 Request: REGISTER sip:ims.hom
  3.216166 10.129.34.61 -> 10.129.34.51 TCP 66 rlm-admin > 48613 [ACK] Seq=1 Ack=808 Win=32 Len=0 TSval=256002281 TSecr=62405035
  3.216529 10.129.34.51 -> 10.129.34.61 SIP 874 Request: REGISTER sip:ims.hom
  3.216550 10.129.34.61 -> 10.129.34.51 TCP 66 rlm-admin > 48613 [ACK] Seq=1 Ack=1616 Win=35 Len=0 TSval=256002282 TSecr=62405035
  3.216977 10.129.34.51 -> 10.129.34.61 SIP 875 Request: REGISTER sip:ims.hom
  3.216997 10.129.34.61 -> 10.129.34.51 TCP 66 rlm-admin > 42405 [ACK] Seq=1 Ack=810 Win=32 Len=0 TSval=256002282 TSecr=62405035
  3.217469 10.129.34.51 -> 10.129.34.61 SIP 872 Request: REGISTER sip:ims.hom
  3.217488 10.129.34.61 -> 10.129.34.51 TCP 66 rlm-admin > 44024 [ACK] Seq=1 Ack=2415 Win=38 Len=0 TSval=256002282 TSecr=62405035
  3.218142 10.129.34.51 -> 10.129.34.61 SIP 875 Request: REGISTER sip:ims.hom
  3.218162 10.129.34.61 -> 10.129.34.51 TCP 66 rlm-admin > 51615 [ACK] Seq=1 Ack=810 Win=32 Len=0 TSval=256002282 TSecr=62405036
  3.218707 10.129.34.51 -> 10.129.34.61 SIP 872 Request: REGISTER sip:ims.hom
  3.218730 10.129.34.61 -> 10.129.34.51 TCP 66 rlm-admin > 57377 [ACK] Seq=1 Ack=807 Win=32 Len=0 TSval=256002282 TSecr=62405036
  3.219351 10.129.34.51 -> 10.129.34.61 SIP 872 Request: REGISTER sip:ims.hom
  3.219373 10.129.34.61 -> 10.129.34.51 TCP 66 rlm-admin > 36696 [ACK] Seq=1 Ack=807 Win=32 Len=0 TSval=256002282 TSecr=62405036
  3.219942 10.129.34.51 -> 10.129.34.61 SIP 872 Request: REGISTER sip:ims.hom
  3.219961 10.129.34.61 -> 10.129.34.51 TCP 66 rlm-admin > 51615 [ACK] Seq=1 Ack=1616 Win=35 Len=0 TSval=256002282 TSecr=62405036
  3.220587 10.129.34.51 -> 10.129.34.61 SIP 874 Request: REGISTER sip:ims.hom
  3.220607 10.129.34.61 -> 10.129.34.51 TCP 66 rlm-admin > 39227 [ACK] Seq=1 Ack=809 Win=32 Len=0 TSval=256002283 TSecr=62405036
  3.221260 10.129.34.51 -> 10.129.34.61 SIP 874 Request: REGISTER sip:ims.hom
  3.221274 10.129.34.61 -> 10.129.34.51 TCP 66 rlm-admin > 51615 [ACK] Seq=1 Ack=2424 Win=38 Len=0 TSval=256002283 TSecr=62405036
  3.222008 10.129.34.51 -> 10.129.34.61 SIP 874 Request: REGISTER sip:ims.hom
  3.222029 10.129.34.61 -> 10.129.34.51 TCP 66 rlm-admin > 48588 [ACK] Seq=1 Ack=1614 Win=35 Len=0 TSval=256002283 TSecr=62405037
  3.222659 10.129.34.51 -> 10.129.34.61 SIP 875 Request: REGISTER sip:ims.hom
  3.222683 10.129.34.61 -> 10.129.34.51 TCP 66 rlm-admin > 46596 [ACK] Seq=1 Ack=810 Win=32 Len=0 TSval=256002283 TSecr=62405037
  3.223316 10.129.34.51 -> 10.129.34.61 SIP 872 Request: REGISTER sip:ims.hom
  3.223335 10.129.34.61 -> 10.129.34.51 TCP 66 rlm-admin > 48613 [ACK] Seq=1 Ack=2422 Win=38 Len=0 TSval=256002283 TSecr=62405037
  3.223796 10.129.34.51 -> 10.129.34.61 SIP 874 Request: REGISTER sip:ims.hom
  3.223816 10.129.34.61 -> 10.129.34.51 TCP 66 rlm-admin > 51615 [ACK] Seq=1 Ack=3232 Win=41 Len=0 TSval=256002283 TSecr=62405037
  3.224384 10.129.34.51 -> 10.129.34.61 SIP 873 Request: REGISTER sip:ims.hom
  3.224429 10.129.34.61 -> 10.129.34.51 TCP 66 rlm-admin > 38953 [ACK] Seq=1 Ack=808 Win=32 Len=0 TSval=256002284 TSecr=62405037
  3.224964 10.129.34.51 -> 10.129.34.61 SIP 874 Request: REGISTER sip:ims.hom
  3.224989 10.129.34.61 -> 10.129.34.51 TCP 66 rlm-admin > 39782 [ACK] Seq=1 Ack=809 Win=32 Len=0 TSval=256002284 TSecr=62405037
  3.225649 10.129.34.51 -> 10.129.34.61 SIP 872 Request: REGISTER sip:ims.hom
  3.225685 10.129.34.61 -> 10.129.34.51 TCP 66 rlm-admin > 39782 [ACK] Seq=1 Ack=1615 Win=35 Len=0 TSval=256002284 TSecr=62405037
  3.226233 10.129.34.51 -> 10.129.34.61 SIP 874 Request: REGISTER sip:ims.hom
  3.226254 10.129.34.61 -> 10.129.34.51 TCP 66 rlm-admin > 36696 [ACK] Seq=1 Ack=1615 Win=35 Len=0 TSval=256002284 TSecr=62405038
  3.227043 10.129.34.51 -> 10.129.34.61 SIP 875 Request: REGISTER sip:ims.hom
  3.227083 10.129.34.61 -> 10.129.34.51 TCP 66 rlm-admin > 40226 [ACK] Seq=1 Ack=810 Win=32 Len=0 TSval=256002284 TSecr=62405038
  3.227308 10.129.34.51 -> 10.129.34.61 SIP 874 Request: REGISTER sip:ims.hom
  3.227324 10.129.34.61 -> 10.129.34.51 TCP 66 rlm-admin > 39782 [ACK] Seq=1 Ack=2423 Win=38 Len=0 TSval=256002284 TSecr=62405038
  3.227866 10.129.34.51 -> 10.129.34.61 SIP 874 Request: REGISTER sip:ims.hom
  3.227885 10.129.34.61 -> 10.129.34.51 TCP 66 rlm-admin > 56273 [ACK] Seq=1 Ack=809 Win=32 Len=0 TSval=256002284 TSecr=62405038
  3.228580 10.129.34.51 -> 10.129.34.61 SIP 873 Request: REGISTER sip:ims.hom
  3.228607 10.129.34.61 -> 10.129.34.51 TCP 66 rlm-admin > 49053 [ACK] Seq=1 Ack=808 Win=32 Len=0 TSval=256002285 TSecr=62405038
  3.317763 10.129.34.61 -> 10.129.34.51 SIP 507 Status: 503 Service Unavailable    (0 bindings)
  3.318233 10.129.34.51 -> 10.129.34.61 TCP 66 51615 > rlm-admin [ACK] Seq=3232 Ack=442 Win=31 Len=0 TSval=62405061 TSecr=256002307
  3.319112 10.129.34.61 -> 10.129.34.51 SIP 504 Status: 503 Service Unavailable    (0 bindings)
  3.319436 10.129.34.51 -> 10.129.34.61 TCP 66 51615 > rlm-admin [ACK] Seq=3232 Ack=880 Win=33 Len=0 TSval=62405061 TSecr=256002307
  3.319563 10.129.34.61 -> 10.129.34.51 SIP 506 Status: 503 Service Unavailable    (0 bindings)
  3.319941 10.129.34.51 -> 10.129.34.61 TCP 66 51615 > rlm-admin [ACK] Seq=3232 Ack=1320 Win=35 Len=0 TSval=62405061 TSecr=256002307
  3.321281 10.129.34.61 -> 10.129.34.51 SIP 504 Status: 503 Service Unavailable    (0 bindings)
  3.321894 10.129.34.51 -> 10.129.34.61 TCP 66 57377 > rlm-admin [ACK] Seq=807 Ack=439 Win=31 Len=0 TSval=62405062 TSecr=256002308
  3.322043 10.129.34.61 -> 10.129.34.51 SIP 504 Status: 503 Service Unavailable    (0 bindings)
  3.322516 10.129.34.51 -> 10.129.34.61 TCP 66 36696 > rlm-admin [ACK] Seq=1615 Ack=439 Win=31 Len=0 TSval=62405062 TSecr=256002308
  3.322542 10.129.34.61 -> 10.129.34.51 SIP 506 Status: 503 Service Unavailable    (0 bindings)
  3.322832 10.129.34.61 -> 10.129.34.51 SIP 506 Status: 503 Service Unavailable    (0 bindings)
  3.323152 10.129.34.51 -> 10.129.34.61 TCP 66 36696 > rlm-admin [ACK] Seq=1615 Ack=879 Win=33 Len=0 TSval=62405062 TSecr=256002308
  3.323282 10.129.34.61 -> 10.129.34.51 SIP 507 Status: 503 Service Unavailable    (0 bindings)
  3.323346 10.129.34.51 -> 10.129.34.61 TCP 66 39227 > rlm-admin [ACK] Seq=809 Ack=441 Win=31 Len=0 TSval=62405062 TSecr=256002308
  3.323535 10.129.34.51 -> 10.129.34.61 TCP 66 46596 > rlm-admin [ACK] Seq=810 Ack=442 Win=31 Len=0 TSval=62405062 TSecr=256002308
  3.323750 10.129.34.61 -> 10.129.34.51 SIP 505 Status: 503 Service Unavailable    (0 bindings)
  3.324018 10.129.34.51 -> 10.129.34.61 TCP 66 38953 > rlm-admin [ACK] Seq=808 Ack=440 Win=31 Len=0 TSval=62405062 TSecr=256002308
  3.324567 10.129.34.61 -> 10.129.34.51 SIP 506 Status: 503 Service Unavailable    (0 bindings)
  3.324813 10.129.34.51 -> 10.129.34.61 TCP 66 39782 > rlm-admin [ACK] Seq=2423 Ack=441 Win=31 Len=0 TSval=62405062 TSecr=256002309
  3.324936 10.129.34.61 -> 10.129.34.51 SIP 504 Status: 503 Service Unavailable    (0 bindings)
  3.325105 10.129.34.51 -> 10.129.34.61 TCP 66 39782 > rlm-admin [ACK] Seq=2423 Ack=879 Win=33 Len=0 TSval=62405062 TSecr=256002309
  3.385933 10.129.34.61 -> 10.129.34.51 SIP 506 Status: 503 Service Unavailable    (0 bindings)
  3.386703 10.129.34.51 -> 10.129.34.61 TCP 66 39782 > rlm-admin [ACK] Seq=2423 Ack=1319 Win=35 Len=0 TSval=62405078 TSecr=256002324
  3.680099 10.129.34.61 -> 10.129.34.51 SIP 598 Status: 401 Unauthorized    (0 bindings)
  3.680384 10.129.34.61 -> 10.129.34.51 SIP 600 Status: 401 Unauthorized    (0 bindings)
  3.681132 10.129.34.61 -> 10.129.34.51 SIP 598 Status: 401 Unauthorized    (0 bindings)
  3.681285 10.129.34.61 -> 10.129.34.51 SIP 601 Status: 401 Unauthorized    (0 bindings)
  3.682993 10.129.34.51 -> 10.129.34.61 TCP 66 44024 > rlm-admin [ACK] Seq=2415 Ack=533 Win=31 Len=0 TSval=62405152 TSecr=256002397
  3.683007 10.129.34.51 -> 10.129.34.61 TCP 66 rbr-debug > rlm-admin [ACK] Seq=805 Ack=535 Win=31 Len=0 TSval=62405152 TSecr=256002398
  3.683014 10.129.34.51 -> 10.129.34.61 TCP 66 39090 > rlm-admin [ACK] Seq=1610 Ack=533 Win=31 Len=0 TSval=62405152 TSecr=256002398
  3.683020 10.129.34.51 -> 10.129.34.61 TCP 66 60827 > rlm-admin [ACK] Seq=806 Ack=536 Win=31 Len=0 TSval=62405152 TSecr=256002398
  3.685986 10.129.34.61 -> 10.129.34.51 SIP 598 Status: 401 Unauthorized    (0 bindings)
  3.686362 10.129.34.51 -> 10.129.34.61 TCP 66 58725 > rlm-admin [ACK] Seq=3224 Ack=533 Win=31 Len=0 TSval=62405153 TSecr=256002399
  3.687239 10.129.34.61 -> 10.129.34.51 SIP 601 Status: 401 Unauthorized    (0 bindings)
  3.687662 10.129.34.51 -> 10.129.34.61 TCP 66 58725 > rlm-admin [ACK] Seq=3224 Ack=1068 Win=33 Len=0 TSval=62405153 TSecr=256002399
  3.690368 10.129.34.61 -> 10.129.34.51 SIP 601 Status: 401 Unauthorized    (0 bindings)
  3.690828 10.129.34.51 -> 10.129.34.61 TCP 66 39090 > rlm-admin [ACK] Seq=1610 Ack=1068 Win=33 Len=0 TSval=62405154 TSecr=256002400
  3.695730 10.129.34.51 -> 10.129.34.61 SIP 844 Request: REGISTER sip:ims.hom
  3.695756 10.129.34.61 -> 10.129.34.51 TCP 66 rlm-admin > 60827 [ACK] Seq=536 Ack=1584 Win=35 Len=0 TSval=256002401 TSecr=62405155
  3.696287 10.129.34.51 -> 10.129.34.61 SIP 842 Request: REGISTER sip:ims.hom
  3.696306 10.129.34.61 -> 10.129.34.51 TCP 66 rlm-admin > 42405 [ACK] Seq=1 Ack=1586 Win=35 Len=0 TSval=256002402 TSecr=62405155
  3.696873 10.129.34.51 -> 10.129.34.61 SIP 839 Request: REGISTER sip:ims.hom
  3.696893 10.129.34.61 -> 10.129.34.51 TCP 66 rlm-admin > 41551 [ACK] Seq=1 Ack=774 Win=32 Len=0 TSval=256002402 TSecr=62405155
  3.697431 10.129.34.51 -> 10.129.34.61 SIP 843 Request: REGISTER sip:ims.hom
  3.697450 10.129.34.61 -> 10.129.34.51 TCP 66 rlm-admin > 42569 [ACK] Seq=1 Ack=1583 Win=35 Len=0 TSval=256002402 TSecr=62405155
  3.707101 10.129.34.51 -> 10.129.34.61 SIP 845 Request: REGISTER sip:ims.hom
  3.707145 10.129.34.61 -> 10.129.34.51 TCP 66 rlm-admin > 49318 [ACK] Seq=1 Ack=780 Win=32 Len=0 TSval=256002404 TSecr=62405158
  3.707979 10.129.34.51 -> 10.129.34.61 SIP 847 Request: REGISTER sip:ims.hom
  3.707991 10.129.34.61 -> 10.129.34.51 TCP 66 rlm-admin > 53581 [ACK] Seq=1 Ack=782 Win=32 Len=0 TSval=256002404 TSecr=62405158
  3.708652 10.129.34.51 -> 10.129.34.61 SIP 847 Request: REGISTER sip:ims.hom
  3.708678 10.129.34.61 -> 10.129.34.51 TCP 66 rlm-admin > 39227 [ACK] Seq=441 Ack=1590 Win=35 Len=0 TSval=256002405 TSecr=62405158
  3.957575 10.129.34.61 -> 10.129.34.51 SIP 602 Status: 401 Unauthorized    (0 bindings)
  3.958112 10.129.34.51 -> 10.129.34.61 TCP 66 58931 > rlm-admin [ACK] Seq=809 Ack=537 Win=31 Len=0 TSval=62405221 TSecr=256002467
  3.969867 10.129.34.61 -> 10.129.34.51 SIP 600 Status: 401 Unauthorized    (0 bindings)
  3.970418 10.129.34.51 -> 10.129.34.61 TCP 66 44024 > rlm-admin [ACK] Seq=2415 Ack=1067 Win=33 Len=0 TSval=62405224 TSecr=256002470
  3.972895 10.129.34.51 -> 10.129.34.61 SIP 846 Request: REGISTER sip:ims.hom
  3.972923 10.129.34.61 -> 10.129.34.51 TCP 66 rlm-admin > 56273 [ACK] Seq=1 Ack=1589 Win=35 Len=0 TSval=256002471 TSecr=62405224
  3.984244 10.129.34.51 -> 10.129.34.61 SIP 848 Request: REGISTER sip:ims.hom
  3.984291 10.129.34.61 -> 10.129.34.51 TCP 66 rlm-admin > 53581 [ACK] Seq=1 Ack=1564 Win=35 Len=0 TSval=256002474 TSecr=62405227
  3.984400 10.129.34.61 -> 10.129.34.51 SIP 599 Status: 401 Unauthorized    (0 bindings)
  3.984755 10.129.34.51 -> 10.129.34.61 TCP 66 41592 > rlm-admin [ACK] Seq=804 Ack=534 Win=31 Len=0 TSval=62405227 TSecr=256002474
  3.986352 10.129.34.61 -> 10.129.34.51 SIP 601 Status: 401 Unauthorized    (0 bindings)
  3.986977 10.129.34.51 -> 10.129.34.61 TCP 66 48588 > rlm-admin [ACK] Seq=1614 Ack=536 Win=31 Len=0 TSval=62405228 TSecr=256002474
  4.004454 10.129.34.51 -> 10.129.34.61 SIP 843 Request: REGISTER sip:ims.hom
  4.004481 10.129.34.61 -> 10.129.34.51 TCP 66 rlm-admin > 42985 [ACK] Seq=1 Ack=778 Win=32 Len=0 TSval=256002479 TSecr=62405232
  4.004731 10.129.34.61 -> 10.129.34.51 SIP 601 Status: 401 Unauthorized    (0 bindings)
  4.005381 10.129.34.51 -> 10.129.34.61 SIP 843 Request: REGISTER sip:ims.hom
  4.005399 10.129.34.61 -> 10.129.34.51 TCP 66 rlm-admin > 48613 [ACK] Seq=1 Ack=3199 Win=41 Len=0 TSval=256002479 TSecr=62405232
  4.005764 10.129.34.61 -> 10.129.34.51 SIP 600 Status: 401 Unauthorized    (0 bindings)
  4.005865 10.129.34.51 -> 10.129.34.61 TCP 66 55053 > rlm-admin [ACK] Seq=808 Ack=536 Win=15872 Len=0 TSval=62405233 TSecr=256002479
  4.006270 10.129.34.51 -> 10.129.34.61 TCP 66 44024 > rlm-admin [ACK] Seq=2415 Ack=1601 Win=35 Len=0 TSval=62405233 TSecr=256002479
  4.011308 10.129.34.61 -> 10.129.34.51 SIP 601 Status: 401 Unauthorized    (0 bindings)
  4.011902 10.129.34.51 -> 10.129.34.61 TCP 66 48613 > rlm-admin [ACK] Seq=3199 Ack=536 Win=31 Len=0 TSval=62405234 TSecr=256002480
  4.020336 10.129.34.61 -> 10.129.34.51 SIP 601 Status: 401 Unauthorized    (0 bindings)
  4.020717 10.129.34.61 -> 10.129.34.51 SIP 603 Status: 401 Unauthorized    (0 bindings)
  4.020884 10.129.34.51 -> 10.129.34.61 TCP 66 50435 > rlm-admin [ACK] Seq=806 Ack=536 Win=31 Len=0 TSval=62405236 TSecr=256002483
  4.021336 10.129.34.51 -> 10.129.34.61 TCP 66 40226 > rlm-admin [ACK] Seq=810 Ack=538 Win=31 Len=0 TSval=62405236 TSecr=256002483
  4.023491 10.129.34.61 -> 10.129.34.51 SIP 601 Status: 401 Unauthorized    (0 bindings)
  4.023742 10.129.34.61 -> 10.129.34.51 SIP 601 Status: 401 Unauthorized    (0 bindings)
  4.024195 10.129.34.51 -> 10.129.34.61 TCP 66 40341 > rlm-admin [ACK] Seq=808 Ack=536 Win=31 Len=0 TSval=62405237 TSecr=256002483
  4.024213 10.129.34.51 -> 10.129.34.61 TCP 66 58725 > rlm-admin [ACK] Seq=3224 Ack=1603 Win=35 Len=0 TSval=62405237 TSecr=256002483
  4.026567 10.129.34.51 -> 10.129.34.61 SIP 847 Request: REGISTER sip:ims.hom
  4.026591 10.129.34.61 -> 10.129.34.51 TCP 66 rlm-admin > 52944 [ACK] Seq=1 Ack=782 Win=32 Len=0 TSval=256002484 TSecr=62405238
  4.027342 10.129.34.51 -> 10.129.34.61 SIP 847 Request: REGISTER sip:ims.hom
  4.027366 10.129.34.61 -> 10.129.34.51 TCP 66 rlm-admin > 56273 [ACK] Seq=1 Ack=2370 Win=38 Len=0 TSval=256002484 TSecr=62405238
  4.027912 10.129.34.51 -> 10.129.34.61 SIP 849 Request: REGISTER sip:ims.hom
  4.027932 10.129.34.61 -> 10.129.34.51 TCP 66 rlm-admin > 40226 [ACK] Seq=538 Ack=1593 Win=35 Len=0 TSval=256002484 TSecr=62405238
  4.030769 10.129.34.61 -> 10.129.34.51 SIP 602 Status: 401 Unauthorized    (0 bindings)
  4.031363 10.129.34.51 -> 10.129.34.61 TCP 66 56273 > rlm-admin [ACK] Seq=2370 Ack=537 Win=31 Len=0 TSval=62405239 TSecr=256002485
  4.033411 10.129.34.61 -> 10.129.34.51 SIP 600 Status: 401 Unauthorized    (0 bindings)
  4.033843 10.129.34.51 -> 10.129.34.61 TCP 66 48613 > rlm-admin [ACK] Seq=3199 Ack=1070 Win=33 Len=0 TSval=62405240 TSecr=256002486
  4.036819 10.129.34.61 -> 10.129.34.51 SIP 601 Status: 401 Unauthorized    (0 bindings)
  4.037018 10.129.34.61 -> 10.129.34.51 SIP 601 Status: 401 Unauthorized    (0 bindings)
  4.037180 10.129.34.51 -> 10.129.34.61 TCP 66 49053 > rlm-admin [ACK] Seq=808 Ack=536 Win=31 Len=0 TSval=62405240 TSecr=256002487
  4.037196 10.129.34.51 -> 10.129.34.61 TCP 66 42569 > rlm-admin [ACK] Seq=1583 Ack=536 Win=31 Len=0 TSval=62405240 TSecr=256002487
  4.038109 10.129.34.51 -> 10.129.34.61 SIP 845 Request: REGISTER sip:ims.hom
  4.038134 10.129.34.61 -> 10.129.34.51 TCP 66 rlm-admin > 43547 [ACK] Seq=1 Ack=780 Win=32 Len=0 TSval=256002487 TSecr=62405241
  4.038371 10.129.34.51 -> 10.129.34.61 SIP 847 Request: REGISTER sip:ims.hom
  4.038391 10.129.34.61 -> 10.129.34.51 TCP 66 rlm-admin > 51815 [ACK] Seq=1 Ack=782 Win=32 Len=0 TSval=256002487 TSecr=62405241
  4.039002 10.129.34.51 -> 10.129.34.61 SIP 847 Request: REGISTER sip:ims.hom
  4.039024 10.129.34.61 -> 10.129.34.51 TCP 66 rlm-admin > 38953 [ACK] Seq=440 Ack=1589 Win=35 Len=0 TSval=256002487 TSecr=62405241
  4.039713 10.129.34.51 -> 10.129.34.61 SIP 847 Request: REGISTER sip:ims.hom
  4.039733 10.129.34.61 -> 10.129.34.51 TCP 66 rlm-admin > 42569 [ACK] Seq=536 Ack=2364 Win=38 Len=0 TSval=256002487 TSecr=62405241
  4.040102 10.129.34.61 -> 10.129.34.51 SIP 602 Status: 401 Unauthorized    (0 bindings)
  4.040418 10.129.34.51 -> 10.129.34.61 TCP 66 48613 > rlm-admin [ACK] Seq=3199 Ack=1606 Win=35 Len=0 TSval=62405241 TSecr=256002487
  4.043166 10.129.34.61 -> 10.129.34.51 SIP 601 Status: 401 Unauthorized    (0 bindings)
  4.044522 10.129.34.61 -> 10.129.34.51 SIP 602 Status: 401 Unauthorized    (0 bindings)
  4.044853 10.129.34.61 -> 10.129.34.51 SIP 603 Status: 401 Unauthorized    (0 bindings)
  4.045085 10.129.34.61 -> 10.129.34.51 SIP 602 Status: 401 Unauthorized    (0 bindings)
  4.048144 10.129.34.61 -> 10.129.34.51 SIP 601 Status: 401 Unauthorized    (0 bindings)
  4.049906 10.129.34.51 -> 10.129.34.61 SIP 848 Request: REGISTER sip:ims.hom
  4.049931 10.129.34.61 -> 10.129.34.51 TCP 66 rlm-admin > 55596 [ACK] Seq=1 Ack=783 Win=32 Len=0 TSval=256002490 TSecr=62405243
  4.050524 10.129.34.51 -> 10.129.34.61 SIP 847 Request: REGISTER sip:ims.hom
  4.050543 10.129.34.61 -> 10.129.34.51 TCP 66 rlm-admin > 50435 [ACK] Seq=536 Ack=1587 Win=35 Len=0 TSval=256002490 TSecr=62405244
  4.059531 10.129.34.51 -> 10.129.34.61 SIP 846 Request: REGISTER sip:ims.hom
  4.059554 10.129.34.61 -> 10.129.34.51 TCP 66 rlm-admin > rbr-debug [ACK] Seq=535 Ack=1585 Win=35 Len=0 TSval=256002492 TSecr=62405246
  4.059987 10.129.34.51 -> 10.129.34.61 SIP 844 Request: REGISTER sip:ims.hom
  4.060002 10.129.34.61 -> 10.129.34.51 TCP 66 rlm-admin > 40341 [ACK] Seq=536 Ack=1586 Win=35 Len=0 TSval=256002492 TSecr=62405246
  4.060527 10.129.34.51 -> 10.129.34.61 SIP 845 Request: REGISTER sip:ims.hom
  4.060547 10.129.34.61 -> 10.129.34.51 TCP 66 rlm-admin > 53581 [ACK] Seq=1 Ack=2343 Win=38 Len=0 TSval=256002493 TSecr=62405246
  4.071783 10.129.34.61 -> 10.129.34.51 SIP 504 Status: 503 Service Unavailable    (0 bindings)
  4.196745 10.129.34.51 -> 10.129.34.61 SIP 873 Request: REGISTER sip:ims.hom
  4.196805 10.129.34.61 -> 10.129.34.51 TCP 66 rlm-admin > 39227 [ACK] Seq=441 Ack=2397 Win=38 Len=0 TSval=256002527 TSecr=62405280
  4.198271 10.129.34.51 -> 10.129.34.61 SIP 873 Request: REGISTER sip:ims.hom
  4.198294 10.129.34.61 -> 10.129.34.51 TCP 66 rlm-admin > 51815 [ACK] Seq=1 Ack=1589 Win=35 Len=0 TSval=256002527 TSecr=62405281
  4.198915 10.129.34.51 -> 10.129.34.61 SIP 875 Request: REGISTER sip:ims.hom
  4.198938 10.129.34.61 -> 10.129.34.51 TCP 66 rlm-admin > 43547 [ACK] Seq=1 Ack=1589 Win=35 Len=0 TSval=256002527 TSecr=62405281
  4.199452 10.129.34.51 -> 10.129.34.61 SIP 875 Request: REGISTER sip:ims.hom
  4.199478 10.129.34.61 -> 10.129.34.51 TCP 66 rlm-admin > 56770 [ACK] Seq=1 Ack=810 Win=32 Len=0 TSval=256002527 TSecr=62405281
  4.200182 10.129.34.51 -> 10.129.34.61 SIP 872 Request: REGISTER sip:ims.hom
  4.200205 10.129.34.61 -> 10.129.34.51 TCP 66 rlm-admin > 42405 [ACK] Seq=538 Ack=2392 Win=38 Len=0 TSval=256002528 TSecr=62405281
  4.200889 10.129.34.51 -> 10.129.34.61 SIP 873 Request: REGISTER sip:ims.hom
  4.200911 10.129.34.61 -> 10.129.34.51 TCP 66 rlm-admin > 51815 [ACK] Seq=1 Ack=2396 Win=38 Len=0 TSval=256002528 TSecr=62405281
  4.201397 10.129.34.51 -> 10.129.34.61 SIP 873 Request: REGISTER sip:ims.hom
  4.203214 10.129.34.61 -> 10.129.34.51 SIP 601 Status: 401 Unauthorized    (0 bindings)
  4.203312 10.129.34.51 -> 10.129.34.61 SIP 873 Request: REGISTER sip:ims.hom
  4.203338 10.129.34.61 -> 10.129.34.51 TCP 66 rlm-admin > 58280 [ACK] Seq=1 Ack=808 Win=32 Len=0 TSval=256002528 TSecr=62405282
  4.203506 10.129.34.51 -> 10.129.34.61 TCP 66 39227 > rlm-admin [ACK] Seq=2397 Ack=976 Win=33 Len=0 TSval=62405282 TSecr=256002528
  4.204139 10.129.34.51 -> 10.129.34.61 SIP 874 Request: REGISTER sip:ims.hom
  4.204197 10.129.34.61 -> 10.129.34.51 TCP 66 rlm-admin > 59885 [ACK] Seq=1 Ack=809 Win=32 Len=0 TSval=256002529 TSecr=62405282
  4.204962 10.129.34.51 -> 10.129.34.61 SIP 874 Request: REGISTER sip:ims.hom
  4.204988 10.129.34.61 -> 10.129.34.51 TCP 66 rlm-admin > 58725 [ACK] Seq=2138 Ack=4032 Win=45 Len=0 TSval=256002529 TSecr=62405282
  4.205505 10.129.34.51 -> 10.129.34.61 SIP 875 Request: REGISTER sip:ims.hom
  4.205528 10.129.34.61 -> 10.129.34.51 TCP 66 rlm-admin > 41551 [ACK] Seq=1 Ack=1583 Win=35 Len=0 TSval=256002529 TSecr=62405282
  4.206135 10.129.34.51 -> 10.129.34.61 SIP 874 Request: REGISTER sip:ims.hom
  4.206157 10.129.34.61 -> 10.129.34.51 TCP 66 rlm-admin > 49271 [ACK] Seq=1 Ack=809 Win=32 Len=0 TSval=256002529 TSecr=62405283
  4.206760 10.129.34.51 -> 10.129.34.61 SIP 874 Request: REGISTER sip:ims.hom
  4.206783 10.129.34.61 -> 10.129.34.51 TCP 66 rlm-admin > 58280 [ACK] Seq=1 Ack=1616 Win=35 Len=0 TSval=256002529 TSecr=62405283
  4.207345 10.129.34.51 -> 10.129.34.61 SIP 873 Request: REGISTER sip:ims.hom
  4.207623 10.129.34.61 -> 10.129.34.51 SIP 601 Status: 401 Unauthorized    (0 bindings)
  4.207906 10.129.34.61 -> 10.129.34.51 SIP 603 Status: 401 Unauthorized    (0 bindings)
  4.207946 10.129.34.51 -> 10.129.34.61 SIP 873 Request: REGISTER sip:ims.hom
  4.207966 10.129.34.61 -> 10.129.34.51 TCP 66 rlm-admin > 46596 [ACK] Seq=442 Ack=1617 Win=35 Len=0 TSval=256002529 TSecr=62405283
  4.208556 10.129.34.51 -> 10.129.34.61 SIP 874 Request: REGISTER sip:ims.hom
  4.208580 10.129.34.61 -> 10.129.34.51 TCP 66 rlm-admin > 51615 [ACK] Seq=1856 Ack=4040 Win=45 Len=0 TSval=256002530 TSecr=62405283
  4.209070 10.129.34.51 -> 10.129.34.61 SIP 872 Request: REGISTER sip:ims.hom
  4.209093 10.129.34.61 -> 10.129.34.51 TCP 66 rlm-admin > 40226 [ACK] Seq=538 Ack=2399 Win=38 Len=0 TSval=256002530 TSecr=62405283
  4.210712 10.129.34.51 -> 10.129.34.61 SIP 873 Request: REGISTER sip:ims.hom
  4.211357 10.129.34.51 -> 10.129.34.61 SIP 873 Request: REGISTER sip:ims.hom
  4.211375 10.129.34.61 -> 10.129.34.51 TCP 66 rlm-admin > 52944 [ACK] Seq=1 Ack=1589 Win=35 Len=0 TSval=256002530 TSecr=62405284
  4.211994 10.129.34.51 -> 10.129.34.61 SIP 873 Request: REGISTER sip:ims.hom
  4.212013 10.129.34.61 -> 10.129.34.51 TCP 66 rlm-admin > 56770 [ACK] Seq=1 Ack=1617 Win=35 Len=0 TSval=256002530 TSecr=62405284
  4.212678 10.129.34.51 -> 10.129.34.61 SIP 874 Request: REGISTER sip:ims.hom
  4.212701 10.129.34.61 -> 10.129.34.51 TCP 66 rlm-admin > 36696 [ACK] Seq=879 Ack=2423 Win=38 Len=0 TSval=256002531 TSecr=62405284
  4.213391 10.129.34.51 -> 10.129.34.61 SIP 873 Request: REGISTER sip:ims.hom
  4.213414 10.129.34.61 -> 10.129.34.51 TCP 66 rlm-admin > 39090 [ACK] Seq=1068 Ack=2417 Win=38 Len=0 TSval=256002531 TSecr=62405284
  4.214045 10.129.34.51 -> 10.129.34.61 SIP 875 Request: REGISTER sip:ims.hom
  4.214065 10.129.34.61 -> 10.129.34.51 TCP 66 rlm-admin > 42569 [ACK] Seq=536 Ack=3173 Win=41 Len=0 TSval=256002531 TSecr=62405285
  4.214633 10.129.34.61 -> 10.129.34.51 SIP 603 Status: 401 Unauthorized    (0 bindings)
  4.215110 10.129.34.51 -> 10.129.34.61 SIP 874 Request: REGISTER sip:ims.hom
  4.216272 10.129.34.51 -> 10.129.34.61 SIP 874 Request: REGISTER sip:ims.hom
  4.216295 10.129.34.61 -> 10.129.34.51 TCP 66 rlm-admin > 49400 [ACK] Seq=1 Ack=809 Win=32 Len=0 TSval=256002532 TSecr=62405285
  4.216840 10.129.34.51 -> 10.129.34.61 SIP 874 Request: REGISTER sip:ims.hom
  4.216862 10.129.34.61 -> 10.129.34.51 TCP 66 rlm-admin > 40023 [ACK] Seq=536 Ack=1616 Win=35 Len=0 TSval=256002532 TSecr=62405285
  4.217947 10.129.34.51 -> 10.129.34.61 SIP 874 Request: REGISTER sip:ims.hom
  4.217969 10.129.34.61 -> 10.129.34.51 TCP 66 rlm-admin > 39005 [ACK] Seq=1 Ack=809 Win=32 Len=0 TSval=256002532 TSecr=62405286
  4.218569 10.129.34.51 -> 10.129.34.61 SIP 874 Request: REGISTER sip:ims.hom
  4.218588 10.129.34.61 -> 10.129.34.51 TCP 66 rlm-admin > 44024 [ACK] Seq=1601 Ack=3223 Win=41 Len=0 TSval=256002532 TSecr=62405286
  4.219174 10.129.34.51 -> 10.129.34.61 SIP 874 Request: REGISTER sip:ims.hom
  4.219195 10.129.34.61 -> 10.129.34.51 TCP 66 rlm-admin > 59413 [ACK] Seq=1 Ack=809 Win=32 Len=0 TSval=256002532 TSecr=62405286
  4.220280 10.129.34.51 -> 10.129.34.61 SIP 874 Request: REGISTER sip:ims.hom
  4.220855 10.129.34.51 -> 10.129.34.61 SIP 873 Request: REGISTER sip:ims.hom
  4.220878 10.129.34.61 -> 10.129.34.51 TCP 66 rlm-admin > 60827 [ACK] Seq=536 Ack=2391 Win=38 Len=0 TSval=256002533 TSecr=62405286
  4.221473 10.129.34.51 -> 10.129.34.61 SIP 873 Request: REGISTER sip:ims.hom
  4.221496 10.129.34.61 -> 10.129.34.51 TCP 66 rlm-admin > 59587 [ACK] Seq=1 Ack=808 Win=32 Len=0 TSval=256002533 TSecr=62405286
  4.222159 10.129.34.51 -> 10.129.34.61 SIP 1514 Request: REGISTER sip:ims.hom
  4.222177 10.129.34.61 -> 10.129.34.51 TCP 66 rlm-admin > 58280 [ACK] Seq=1 Ack=3064 Win=41 Len=0 TSval=256002533 TSecr=62405287
  4.222773 10.129.34.51 -> 10.129.34.61 SIP 871 Request: REGISTER sip:ims.hom
  4.222797 10.129.34.61 -> 10.129.34.51 TCP 66 rlm-admin > 55912 [ACK] Seq=1 Ack=806 Win=32 Len=0 TSval=256002533 TSecr=62405287
  4.223291 10.129.34.61 -> 10.129.34.51 SIP 505 Status: 503 Service Unavailable    (0 bindings)
  4.224183 10.129.34.61 -> 10.129.34.51 SIP 505 Status: 503 Service Unavailable    (0 bindings)
  4.224766 10.129.34.61 -> 10.129.34.51 SIP 506 Status: 503 Service Unavailable    (0 bindings)
  4.225196 10.129.34.61 -> 10.129.34.51 SIP 507 Status: 503 Service Unavailable    (0 bindings)
  4.225483 10.129.34.61 -> 10.129.34.51 SIP 506 Status: 503 Service Unavailable    (0 bindings)
  4.225866 10.129.34.61 -> 10.129.34.51 SIP 505 Status: 503 Service Unavailable    (0 bindings)
  4.226137 10.129.34.61 -> 10.129.34.51 SIP 505 Status: 503 Service Unavailable    (0 bindings)
  4.226558 10.129.34.61 -> 10.129.34.51 SIP 504 Status: 503 Service Unavailable    (0 bindings)
  4.226816 10.129.34.61 -> 10.129.34.51 SIP 505 Status: 503 Service Unavailable    (0 bindings)
  4.227146 10.129.34.61 -> 10.129.34.51 SIP 506 Status: 503 Service Unavailable    (0 bindings)
  4.227406 10.129.34.61 -> 10.129.34.51 SIP 505 Status: 503 Service Unavailable    (0 bindings)
  4.227718 10.129.34.61 -> 10.129.34.51 SIP 507 Status: 503 Service Unavailable    (0 bindings)
  4.227980 10.129.34.61 -> 10.129.34.51 SIP 506 Status: 503 Service Unavailable    (0 bindings)
  4.228312 10.129.34.61 -> 10.129.34.51 SIP 506 Status: 503 Service Unavailable    (0 bindings)
  4.228743 10.129.34.61 -> 10.129.34.51 SIP 506 Status: 503 Service Unavailable    (0 bindings)
  4.229014 10.129.34.61 -> 10.129.34.51 SIP 506 Status: 503 Service Unavailable    (0 bindings)
  4.229287 10.129.34.61 -> 10.129.34.51 SIP 506 Status: 503 Service Unavailable    (0 bindings)
  4.229717 10.129.34.61 -> 10.129.34.51 SIP 505 Status: 503 Service Unavailable    (0 bindings)
  4.230012 10.129.34.61 -> 10.129.34.51 SIP 505 Status: 503 Service Unavailable    (0 bindings)
  4.230297 10.129.34.61 -> 10.129.34.51 SIP 503 Status: 503 Service Unavailable    (0 bindings)
  4.234454 10.129.34.51 -> 10.129.34.61 SIP 1514 Request: REGISTER sip:ims.hom
  4.248446 10.129.34.61 -> 10.129.34.51 SIP 601 [TCP Retransmission] Status: 401 Unauthorized    (0 bindings)
  4.248459 10.129.34.61 -> 10.129.34.51 TCP 66 rlm-admin > 51815 [ACK] Seq=536 Ack=3203 Win=41 Len=0 TSval=256002540 TSecr=62405284
  4.256256 10.129.34.61 -> 10.129.34.51 SIP 602 [TCP Retransmission] Status: 401 Unauthorized    (0 bindings)
  4.256339 10.129.34.61 -> 10.129.34.51 SIP 603 [TCP Retransmission] Status: 401 Unauthorized    (0 bindings)
  4.256347 10.129.34.61 -> 10.129.34.51 SIP 602 [TCP Retransmission] Status: 401 Unauthorized    (0 bindings)
  4.260329 10.129.34.61 -> 10.129.34.51 SIP 601 [TCP Retransmission] Status: 401 Unauthorized    (0 bindings)
  4.260419 10.129.34.61 -> 10.129.34.51 TCP 66 rlm-admin > 43547 [ACK] Seq=538 Ack=2397 Win=38 Len=0 TSval=256002543 TSecr=62405286
  4.260944 10.129.34.51 -> 10.129.34.61 SIP 874 Request: REGISTER sip:ims.hom
  4.260978 10.129.34.61 -> 10.129.34.51 SIP 506 Status: 503 Service Unavailable    (0 bindings)
  4.269979 10.129.34.51 -> 10.129.34.61 TCP 66 39227 > rlm-admin [ACK] Seq=3204 Ack=1415 Win=35 Len=0 TSval=62405299 TSecr=256002534
  4.272195 10.129.34.61 -> 10.129.34.51 TCP 66 rlm-admin > 56273 [ACK] Seq=977 Ack=4626 Win=47 Len=0 TSval=256002546 TSecr=62405290
  4.272898 10.129.34.51 -> 10.129.34.61 SIP 207 Request: REGISTER sip:ims.hom
  4.272929 10.129.34.61 -> 10.129.34.51 TCP 66 rlm-admin > 56273 [ACK] Seq=977 Ack=4767 Win=53 Len=0 TSval=256002546 TSecr=62405299
  4.276560 10.129.34.51 -> 10.129.34.61 SIP 848 Request: REGISTER sip:ims.hom
  4.276593 10.129.34.61 -> 10.129.34.51 TCP 66 rlm-admin > 42405 [ACK] Seq=538 Ack=3174 Win=41 Len=0 TSval=256002547 TSecr=62405300
  4.280406 10.129.34.61 -> 10.129.34.51 SIP 504 [TCP Retransmission] Status: 503 Service Unavailable    (0 bindings)
  4.325393 10.129.34.61 -> 10.129.34.51 SIP 754 Status: 200 OK    (1 bindings)
  4.326090 10.129.34.51 -> 10.129.34.61 TCP 66 55596 > rlm-admin [ACK] Seq=783 Ack=689 Win=32 Len=0 TSval=62405313 TSecr=256002559
  4.342385 10.129.34.61 -> 10.129.34.51 SIP 753 Status: 200 OK    (1 bindings)
  4.416267 10.129.34.61 -> 10.129.34.51 SIP 601 [TCP Retransmission] Status: 401 Unauthorized    (0 bindings)
  4.416383 10.129.34.61 -> 10.129.34.51 SIP 603 [TCP Retransmission] Status: 401 Unauthorized    (0 bindings)
  4.417064 10.129.34.51 -> 10.129.34.61 SIP 874 Request: REGISTER sip:ims.hom
  4.417102 10.129.34.61 -> 10.129.34.51 SIP 944 Status: 503 Service Unavailable    (0 bindings)
  4.417175 10.129.34.51 -> 10.129.34.61 TCP 66 43547 > rlm-admin [ACK] Seq=2397 Ack=538 Win=31 Len=0 TSval=62405335 TSecr=256002582
  4.417191 10.129.34.61 -> 10.129.34.51 SIP 506 Status: 503 Service Unavailable    (0 bindings)
  4.417521 10.129.34.51 -> 10.129.34.61 TCP 66 43547 > rlm-admin [ACK] Seq=2397 Ack=978 Win=33 Len=0 TSval=62405335 TSecr=256002582
  4.428259 10.129.34.61 -> 10.129.34.51 SIP 603 [TCP Retransmission] Status: 401 Unauthorized    (0 bindings)
  4.428370 10.129.34.61 -> 10.129.34.51 SIP 505 [TCP Retransmission] Status: 503 Service Unavailable    (0 bindings)
  4.428921 10.129.34.51 -> 10.129.34.61 TCP 66 56770 > rlm-admin [ACK] Seq=1617 Ack=538 Win=31 Len=0 TSval=62405338 TSecr=256002585
  4.432559 10.129.34.51 -> 10.129.34.61 SIP 846 Request: REGISTER sip:ims.hom
  4.432594 10.129.34.61 -> 10.129.34.51 TCP 66 rlm-admin > 41592 [ACK] Seq=534 Ack=1584 Win=35 Len=0 TSval=256002586 TSecr=62405339
  4.436327 10.129.34.61 -> 10.129.34.51 SIP 505 [TCP Retransmission] Status: 503 Service Unavailable    (0 bindings)
  4.436412 10.129.34.61 -> 10.129.34.51 SIP 506 [TCP Retransmission] Status: 503 Service Unavailable    (0 bindings)
  4.436421 10.129.34.61 -> 10.129.34.51 SIP 507 [TCP Retransmission] Status: 503 Service Unavailable    (0 bindings)
  4.436427 10.129.34.61 -> 10.129.34.51 SIP 506 [TCP Retransmission] Status: 503 Service Unavailable    (0 bindings)
  4.436433 10.129.34.61 -> 10.129.34.51 SIP 505 [TCP Retransmission] Status: 503 Service Unavailable    (0 bindings)
  4.436440 10.129.34.61 -> 10.129.34.51 SIP 504 [TCP Retransmission] Status: 503 Service Unavailable    (0 bindings)
  4.436446 10.129.34.61 -> 10.129.34.51 SIP 505 [TCP Retransmission] Status: 503 Service Unavailable    (0 bindings)
  4.436452 10.129.34.61 -> 10.129.34.51 SIP 506 [TCP Retransmission] Status: 503 Service Unavailable    (0 bindings)
  4.436458 10.129.34.61 -> 10.129.34.51 SIP 505 [TCP Retransmission] Status: 503 Service Unavailable    (0 bindings)
  4.436464 10.129.34.61 -> 10.129.34.51 SIP 507 [TCP Retransmission] Status: 503 Service Unavailable    (0 bindings)
  4.436471 10.129.34.61 -> 10.129.34.51 SIP 506 [TCP Retransmission] Status: 503 Service Unavailable    (0 bindings)
  4.436974 10.129.34.51 -> 10.129.34.61 SIP 233 Request: REGISTER sip:ims.hom
  4.437007 10.129.34.61 -> 10.129.34.51 SIP 945 Status: 503 Service Unavailable    (0 bindings)
  4.440233 10.129.34.61 -> 10.129.34.51 SIP 506 [TCP Retransmission] Status: 503 Service Unavailable    (0 bindings)
  4.440291 10.129.34.61 -> 10.129.34.51 SIP 506 [TCP Retransmission] Status: 503 Service Unavailable    (0 bindings)
  4.440298 10.129.34.61 -> 10.129.34.51 SIP 505 [TCP Retransmission] Status: 503 Service Unavailable    (0 bindings)
  4.440305 10.129.34.61 -> 10.129.34.51 SIP 505 [TCP Retransmission] Status: 503 Service Unavailable    (0 bindings)
  4.440373 10.129.34.61 -> 10.129.34.51 SIP 503 [TCP Retransmission] Status: 503 Service Unavailable    (0 bindings)
  4.441725 10.129.34.51 -> 10.129.34.61 SIP 874 [TCP Retransmission] Request: REGISTER sip:ims.hom
  4.441756 10.129.34.61 -> 10.129.34.51 TCP 78 [TCP Dup ACK 337#1] rlm-admin > 36696 [ACK] Seq=1319 Ack=2423 Win=38 Len=0 TSval=256002588 TSecr=62405342 SLE=1615 SRE=2423
  4.444310 10.129.34.61 -> 10.129.34.51 SIP 506 [TCP Retransmission] Status: 503 Service Unavailable    (0 bindings)
  4.444418 10.129.34.61 -> 10.129.34.51 SIP 506 [TCP Retransmission] Status: 503 Service Unavailable    (0 bindings)
  4.453865 10.129.34.51 -> 10.129.34.61 TCP 66 51815 > rlm-admin [ACK] Seq=4011 Ack=1414 Win=35 Len=0 TSval=62405345 TSecr=256002582
  4.453901 10.129.34.61 -> 10.129.34.51 SIP 602 Status: 401 Unauthorized    (0 bindings)
  4.472244 10.129.34.61 -> 10.129.34.51 SIP 506 [TCP Retransmission] Status: 503 Service Unavailable    (0 bindings)
  4.509960 10.129.34.51 -> 10.129.34.61 SIP 848 [TCP Retransmission] Request: REGISTER sip:ims.hom
  4.510011 10.129.34.61 -> 10.129.34.51 TCP 78 [TCP Dup ACK 313#1] rlm-admin > 42405 [ACK] Seq=538 Ack=3174 Win=41 Len=0 TSval=256002605 TSecr=62405359 SLE=2392 SRE=3174
  4.510112 10.129.34.51 -> 10.129.34.61 TCP 66 40023 > rlm-admin [ACK] Seq=2424 Ack=976 Win=33 Len=0 TSval=62405359 TSecr=256002596
  4.510134 10.129.34.61 -> 10.129.34.51 SIP 602 Status: 401 Unauthorized    (0 bindings)
  4.510670 10.129.34.51 -> 10.129.34.61 TCP 66 40023 > rlm-admin [ACK] Seq=2424 Ack=1512 Win=35 Len=0 TSval=62405359 TSecr=256002605
  4.527074 10.129.34.51 -> 10.129.34.61 SIP 846 Request: REGISTER sip:ims.hom
  4.556333 10.129.34.61 -> 10.129.34.51 SIP 753 [TCP Retransmission] Status: 200 OK    (1 bindings)
  4.557071 10.129.34.51 -> 10.129.34.61 TCP 66 39227 > rlm-admin [ACK] Seq=3204 Ack=2102 Win=38 Len=0 TSval=62405370 TSecr=256002617
  4.564429 10.129.34.61 -> 10.129.34.51 TCP 66 rlm-admin > 41551 [ACK] Seq=442 Ack=2363 Win=38 Len=0 TSval=256002619 TSecr=62405363
  4.605869 10.129.34.51 -> 10.129.34.61 SIP 874 [TCP Retransmission] Request: REGISTER sip:ims.hom
  4.605905 10.129.34.61 -> 10.129.34.51 TCP 78 [TCP Dup ACK 333#1] rlm-admin > 49271 [ACK] Seq=441 Ack=809 Win=32 Len=0 TSval=256002629 TSecr=62405383 SLE=1 SRE=809
  4.645853 10.129.34.51 -> 10.129.34.61 SIP 871 [TCP Retransmission] Request: REGISTER sip:ims.hom
  4.645889 10.129.34.61 -> 10.129.34.51 TCP 78 [TCP Dup ACK 347#1] rlm-admin > 55912 [ACK] Seq=438 Ack=806 Win=32 Len=0 TSval=256002639 TSecr=62405393 SLE=1 SRE=806
  4.648230 10.129.34.61 -> 10.129.34.51 SIP 945 [TCP Retransmission] Status: 503 Service Unavailable    (0 bindings)
  4.649938 10.129.34.61 -> 10.129.34.51 SIP 752 Status: 200 OK    (1 bindings)
  4.650448 10.129.34.51 -> 10.129.34.61 TCP 66 41592 > rlm-admin [ACK] Seq=1584 Ack=1220 Win=34 Len=0 TSval=62405394 TSecr=256002640
  4.664431 10.129.34.61 -> 10.129.34.51 SIP 601 [TCP Retransmission] Status: 401 Unauthorized    (0 bindings)
  4.664898 10.129.34.51 -> 10.129.34.61 TCP 66 58725 > rlm-admin [ACK] Seq=4032 Ack=2138 Win=37 Len=0 TSval=62405397 TSecr=256002644
  4.664933 10.129.34.61 -> 10.129.34.51 SIP 506 Status: 503 Service Unavailable    (0 bindings)
