  0.000000 10.129.34.51 -> 10.129.34.61 SIP 903 Request: REGISTER sip:ims.hom
  0.001821 10.129.34.51 -> 10.129.34.61 SIP 903 Request: REGISTER sip:ims.hom
  0.002385 10.129.34.51 -> 10.129.34.61 SIP 903 Request: REGISTER sip:ims.hom
  0.002416 10.129.34.61 -> 10.129.34.51 TCP 66 rlm-admin > 33748 [ACK] Seq=1 Ack=838 Win=32 Len=0 TSval=255803946 TSecr=62206700
  0.008919 10.129.34.51 -> 10.129.34.61 SIP 903 Request: REGISTER sip:ims.hom
  0.008961 10.129.34.61 -> 10.129.34.51 TCP 66 rlm-admin > 35180 [ACK] Seq=1 Ack=838 Win=82 Len=0 TSval=255803948 TSecr=62206702
  0.009400 10.129.34.51 -> 10.129.34.61 SIP 1514 Request: REGISTER sip:ims.hom
  0.010005 10.129.34.51 -> 10.129.34.61 SIP 902 Request: REGISTER sip:ims.hom
  0.010478 10.129.34.61 -> 10.129.34.51 TCP 66 rlm-admin > 44657 [ACK] Seq=1 Ack=2286 Win=83 Len=0 TSval=255803948 TSecr=62206699
  0.010647 10.129.34.51 -> 10.129.34.61 SIP 903 Request: REGISTER sip:ims.hom
  0.010671 10.129.34.61 -> 10.129.34.51 TCP 66 rlm-admin > 44352 [ACK] Seq=1 Ack=838 Win=32 Len=0 TSval=255803948 TSecr=62206702
  0.011069 10.129.34.51 -> 10.129.34.61 SIP 292 Request: REGISTER sip:ims.hom
  0.011245 10.129.34.51 -> 10.129.34.61 SIP 870 Request: REGISTER sip:ims.hom
  0.011271 10.129.34.61 -> 10.129.34.51 TCP 66 rlm-admin > 56476 [ACK] Seq=1 Ack=805 Win=82 Len=0 TSval=255803949 TSecr=62206702
  0.011986 10.129.34.51 -> 10.129.34.61 SIP 907 Request: REGISTER sip:ims.hom
  0.012860 10.129.34.51 -> 10.129.34.61 SIP 874 Request: REGISTER sip:ims.hom
  0.012882 10.129.34.61 -> 10.129.34.51 TCP 66 rlm-admin > 35180 [ACK] Seq=1 Ack=1646 Win=81 Len=0 TSval=255803949 TSecr=62206703
  0.013123 10.129.34.51 -> 10.129.34.61 SIP 907 Request: REGISTER sip:ims.hom
  0.013809 10.129.34.51 -> 10.129.34.61 SIP 907 Request: REGISTER sip:ims.hom
  0.013832 10.129.34.61 -> 10.129.34.51 TCP 66 rlm-admin > 48569 [ACK] Seq=1 Ack=842 Win=82 Len=0 TSval=255803949 TSecr=62206703
  0.014626 10.129.34.51 -> 10.129.34.61 SIP 905 Request: REGISTER sip:ims.hom
  0.015182 10.129.34.51 -> 10.129.34.61 SIP 905 Request: REGISTER sip:ims.hom
  0.015858 10.129.34.51 -> 10.129.34.61 SIP 907 Request: REGISTER sip:ims.hom
  0.016367 10.129.34.51 -> 10.129.34.61 SIP 873 Request: REGISTER sip:ims.hom
  0.016399 10.129.34.61 -> 10.129.34.51 TCP 66 rlm-admin > 57095 [ACK] Seq=1 Ack=808 Win=32 Len=0 TSval=255803950 TSecr=62206703
  0.017103 10.129.34.51 -> 10.129.34.61 SIP 907 Request: REGISTER sip:ims.hom
  0.017133 10.129.34.61 -> 10.129.34.51 TCP 66 rlm-admin > 48569 [ACK] Seq=1 Ack=1683 Win=81 Len=0 TSval=255803950 TSecr=62206704
  0.017748 10.129.34.51 -> 10.129.34.61 SIP 906 Request: REGISTER sip:ims.hom
  0.018203 10.129.34.51 -> 10.129.34.61 SIP 874 Request: REGISTER sip:ims.hom
  0.018233 10.129.34.61 -> 10.129.34.51 TCP 66 rlm-admin > 46056 [ACK] Seq=1 Ack=809 Win=32 Len=0 TSval=255803950 TSecr=62206704
  0.018961 10.129.34.51 -> 10.129.34.61 SIP 873 Request: REGISTER sip:ims.hom
  0.020104 10.129.34.51 -> 10.129.34.61 SIP 906 Request: REGISTER sip:ims.hom
  0.020737 10.129.34.51 -> 10.129.34.61 SIP 906 Request: REGISTER sip:ims.hom
  0.020761 10.129.34.61 -> 10.129.34.51 TCP 66 rlm-admin > 35822 [ACK] Seq=1 Ack=841 Win=82 Len=0 TSval=255803951 TSecr=62206705
  0.021365 10.129.34.51 -> 10.129.34.61 SIP 872 Request: REGISTER sip:ims.hom
  0.021390 10.129.34.61 -> 10.129.34.51 TCP 66 rlm-admin > 43346 [ACK] Seq=1 Ack=807 Win=32 Len=0 TSval=255803951 TSecr=62206705
  0.021938 10.129.34.51 -> 10.129.34.61 SIP 906 Request: REGISTER sip:ims.hom
  0.022428 10.129.34.51 -> 10.129.34.61 SIP 907 Request: REGISTER sip:ims.hom
  0.022452 10.129.34.61 -> 10.129.34.51 TCP 66 rlm-admin > 48324 [ACK] Seq=1 Ack=842 Win=82 Len=0 TSval=255803951 TSecr=62206705
  0.023058 10.129.34.51 -> 10.129.34.61 SIP 873 Request: REGISTER sip:ims.hom
  0.023749 10.129.34.51 -> 10.129.34.61 SIP 906 Request: REGISTER sip:ims.hom
  0.024764 10.129.34.51 -> 10.129.34.61 SIP 904 Request: REGISTER sip:ims.hom
  0.025241 10.129.34.51 -> 10.129.34.61 SIP 872 Request: REGISTER sip:ims.hom
  0.025269 10.129.34.61 -> 10.129.34.51 TCP 66 rlm-admin > 35881 [ACK] Seq=1 Ack=807 Win=82 Len=0 TSval=255803952 TSecr=62206706
  0.025798 10.129.34.51 -> 10.129.34.61 SIP 1514 Request: REGISTER sip:ims.hom
  0.026417 10.129.34.51 -> 10.129.34.61 SIP 875 Request: REGISTER sip:ims.hom
  0.026919 10.129.34.51 -> 10.129.34.61 SIP 874 Request: REGISTER sip:ims.hom
  0.026942 10.129.34.61 -> 10.129.34.51 TCP 66 rlm-admin > 57095 [ACK] Seq=1 Ack=1616 Win=35 Len=0 TSval=255803952 TSecr=62206706
  0.029186 10.129.34.51 -> 10.129.34.61 SIP 906 Request: REGISTER sip:ims.hom
  0.029755 10.129.34.51 -> 10.129.34.61 SIP 907 Request: REGISTER sip:ims.hom
  0.029785 10.129.34.61 -> 10.129.34.51 TCP 66 rlm-admin > 44352 [ACK] Seq=1 Ack=1679 Win=35 Len=0 TSval=255803953 TSecr=62206707
  0.030433 10.129.34.51 -> 10.129.34.61 SIP 875 Request: REGISTER sip:ims.hom
  0.030783 10.129.34.51 -> 10.129.34.61 SIP 874 Request: REGISTER sip:ims.hom
  0.030810 10.129.34.61 -> 10.129.34.51 TCP 66 rlm-admin > 48569 [ACK] Seq=1 Ack=2491 Win=80 Len=0 TSval=255803953 TSecr=62206707
  0.031514 10.129.34.51 -> 10.129.34.61 SIP 1514 Request: REGISTER sip:ims.hom
  0.031999 10.129.34.51 -> 10.129.34.61 SIP 875 Request: REGISTER sip:ims.hom
  0.039054 10.129.34.61 -> 10.129.34.51 TCP 66 rlm-admin > 49736 [ACK] Seq=1 Ack=838 Win=83 Len=0 TSval=255803956 TSecr=62206700
  0.039529 10.129.34.51 -> 10.129.34.61 SIP 873 Request: REGISTER sip:ims.hom
  0.039553 10.129.34.61 -> 10.129.34.51 TCP 66 rlm-admin > 49736 [ACK] Seq=1 Ack=1645 Win=82 Len=0 TSval=255803956 TSecr=62206709
  0.047056 10.129.34.61 -> 10.129.34.51 TCP 66 rlm-admin > 38351 [ACK] Seq=1 Ack=837 Win=83 Len=0 TSval=255803958 TSecr=62206702
  0.051052 10.129.34.61 -> 10.129.34.51 TCP 66 rlm-admin > 44657 [ACK] Seq=1 Ack=2512 Win=83 Len=0 TSval=255803959 TSecr=62206702
  0.051121 10.129.34.61 -> 10.129.34.51 TCP 66 rlm-admin > 36308 [ACK] Seq=1 Ack=842 Win=81 Len=0 TSval=255803959 TSecr=62206702
  0.051128 10.129.34.61 -> 10.129.34.51 TCP 66 rlm-admin > 40502 [ACK] Seq=1 Ack=2290 Win=79 Len=0 TSval=255803959 TSecr=62206703
  0.051135 10.129.34.61 -> 10.129.34.51 TCP 66 rlm-admin > 48540 [ACK] Seq=1 Ack=840 Win=82 Len=0 TSval=255803959 TSecr=62206703
  0.051930 10.129.34.51 -> 10.129.34.61 SIP 229 Request: REGISTER sip:ims.hom
  0.051956 10.129.34.61 -> 10.129.34.51 TCP 66 rlm-admin > 40502 [ACK] Seq=1 Ack=2453 Win=79 Len=0 TSval=255803959 TSecr=62206712
  0.051993 10.129.34.51 -> 10.129.34.61 SIP 907 Request: REGISTER sip:ims.hom
  0.052008 10.129.34.61 -> 10.129.34.51 TCP 66 rlm-admin > 48540 [ACK] Seq=1 Ack=1681 Win=81 Len=0 TSval=255803959 TSecr=62206712
  0.055123 10.129.34.61 -> 10.129.34.51 TCP 66 rlm-admin > 47494 [ACK] Seq=1 Ack=2288 Win=79 Len=0 TSval=255803960 TSecr=62206703
  0.055160 10.129.34.61 -> 10.129.34.51 TCP 66 rlm-admin > 52015 [ACK] Seq=1 Ack=842 Win=82 Len=0 TSval=255803960 TSecr=62206703
  0.055167 10.129.34.61 -> 10.129.34.51 TCP 66 rlm-admin > 38927 [ACK] Seq=1 Ack=841 Win=82 Len=0 TSval=255803960 TSecr=62206704
  0.055174 10.129.34.61 -> 10.129.34.51 TCP 66 rlm-admin > 54812 [ACK] Seq=1 Ack=808 Win=82 Len=0 TSval=255803960 TSecr=62206704
  0.055500 10.129.34.51 -> 10.129.34.61 SIP 234 Request: REGISTER sip:ims.hom
  0.055521 10.129.34.61 -> 10.129.34.51 TCP 66 rlm-admin > 47494 [ACK] Seq=1 Ack=2456 Win=79 Len=0 TSval=255803960 TSecr=62206713
  0.059053 10.129.34.61 -> 10.129.34.51 TCP 66 rlm-admin > 35505 [ACK] Seq=1 Ack=841 Win=81 Len=0 TSval=255803961 TSecr=62206704
  0.059139 10.129.34.61 -> 10.129.34.51 TCP 66 rlm-admin > 39746 [ACK] Seq=1 Ack=841 Win=82 Len=0 TSval=255803961 TSecr=62206705
  0.059544 10.129.34.51 -> 10.129.34.61 SIP 906 Request: REGISTER sip:ims.hom
  0.059570 10.129.34.61 -> 10.129.34.51 TCP 66 rlm-admin > 39746 [ACK] Seq=1 Ack=1681 Win=81 Len=0 TSval=255803961 TSecr=62206714
  0.063059 10.129.34.61 -> 10.129.34.51 TCP 66 rlm-admin > 46843 [ACK] Seq=1 Ack=808 Win=82 Len=0 TSval=255803962 TSecr=62206705
  0.063075 10.129.34.61 -> 10.129.34.51 TCP 66 rlm-admin > 37243 [ACK] Seq=1 Ack=841 Win=82 Len=0 TSval=255803962 TSecr=62206705
  0.063081 10.129.34.61 -> 10.129.34.51 TCP 66 rlm-admin > 41836 [ACK] Seq=1 Ack=839 Win=82 Len=0 TSval=255803962 TSecr=62206706
  0.063088 10.129.34.61 -> 10.129.34.51 TCP 66 rlm-admin > 48727 [ACK] Seq=1 Ack=810 Win=82 Len=0 TSval=255803962 TSecr=62206706
  0.067087 10.129.34.61 -> 10.129.34.51 TCP 66 rlm-admin > 48725 [ACK] Seq=1 Ack=841 Win=82 Len=0 TSval=255803963 TSecr=62206707
  0.067119 10.129.34.61 -> 10.129.34.51 TCP 66 rlm-admin > 54707 [ACK] Seq=1 Ack=810 Win=82 Len=0 TSval=255803963 TSecr=62206707
  0.067987 10.129.34.51 -> 10.129.34.61 SIP 873 Request: REGISTER sip:ims.hom
  0.068011 10.129.34.61 -> 10.129.34.51 TCP 66 rlm-admin > 48725 [ACK] Seq=1 Ack=1648 Win=81 Len=0 TSval=255803963 TSecr=62206716
  0.071050 10.129.34.61 -> 10.129.34.51 TCP 66 rlm-admin > 53063 [ACK] Seq=1 Ack=810 Win=82 Len=0 TSval=255803964 TSecr=62206707
  0.081352 10.129.34.61 -> 10.129.34.51 SIP 506 Status: 503 Service Unavailable    (0 bindings)
  0.081897 10.129.34.51 -> 10.129.34.61 TCP 66 48540 > rlm-admin [ACK] Seq=1681 Ack=441 Win=83 Len=0 TSval=62206720 TSecr=255803966
  0.082264 10.129.34.61 -> 10.129.34.51 SIP 504 Status: 503 Service Unavailable    (0 bindings)
  0.082770 10.129.34.51 -> 10.129.34.61 TCP 66 47494 > rlm-admin [ACK] Seq=2456 Ack=439 Win=83 Len=0 TSval=62206720 TSecr=255803966
  0.082795 10.129.34.61 -> 10.129.34.51 SIP 507 Status: 503 Service Unavailable    (0 bindings)
  0.083168 10.129.34.61 -> 10.129.34.51 SIP 506 Status: 503 Service Unavailable    (0 bindings)
  0.083265 10.129.34.51 -> 10.129.34.61 TCP 66 47494 > rlm-admin [ACK] Seq=2456 Ack=880 Win=83 Len=0 TSval=62206720 TSecr=255803966
  0.083287 10.129.34.61 -> 10.129.34.51 SIP 505 Status: 503 Service Unavailable    (0 bindings)
  0.083462 10.129.34.51 -> 10.129.34.61 TCP 66 52015 > rlm-admin [ACK] Seq=842 Ack=441 Win=83 Len=0 TSval=62206720 TSecr=255803967
  0.083611 10.129.34.51 -> 10.129.34.61 TCP 66 47494 > rlm-admin [ACK] Seq=2456 Ack=1319 Win=83 Len=0 TSval=62206720 TSecr=255803967
  0.083702 10.129.34.61 -> 10.129.34.51 SIP 505 Status: 503 Service Unavailable    (0 bindings)
  0.084275 10.129.34.61 -> 10.129.34.51 SIP 505 Status: 503 Service Unavailable    (0 bindings)
  0.084546 10.129.34.61 -> 10.129.34.51 SIP 506 Status: 503 Service Unavailable    (0 bindings)
  0.084739 10.129.34.51 -> 10.129.34.61 TCP 66 57095 > rlm-admin [ACK] Seq=1616 Ack=440 Win=31 Len=0 TSval=62206721 TSecr=255803967
  0.084763 10.129.34.61 -> 10.129.34.51 SIP 506 Status: 503 Service Unavailable    (0 bindings)
  0.084788 10.129.34.51 -> 10.129.34.61 TCP 66 38927 > rlm-admin [ACK] Seq=841 Ack=440 Win=83 Len=0 TSval=62206721 TSecr=255803967
  0.084944 10.129.34.51 -> 10.129.34.61 TCP 66 46056 > rlm-admin [ACK] Seq=809 Ack=441 Win=31 Len=0 TSval=62206721 TSecr=255803967
  0.085057 10.129.34.51 -> 10.129.34.61 TCP 66 57095 > rlm-admin [ACK] Seq=1616 Ack=880 Win=33 Len=0 TSval=62206721 TSecr=255803967
  0.085192 10.129.34.61 -> 10.129.34.51 SIP 505 Status: 503 Service Unavailable    (0 bindings)
  0.085494 10.129.34.61 -> 10.129.34.51 SIP 505 Status: 503 Service Unavailable    (0 bindings)
  0.085615 10.129.34.51 -> 10.129.34.61 TCP 66 54812 > rlm-admin [ACK] Seq=808 Ack=440 Win=79 Len=0 TSval=62206721 TSecr=255803967
  0.085828 10.129.34.51 -> 10.129.34.61 TCP 66 35505 > rlm-admin [ACK] Seq=841 Ack=440 Win=83 Len=0 TSval=62206721 TSecr=255803967
  0.085930 10.129.34.61 -> 10.129.34.51 SIP 505 Status: 503 Service Unavailable    (0 bindings)
  0.086228 10.129.34.61 -> 10.129.34.51 SIP 504 Status: 503 Service Unavailable    (0 bindings)
  0.086581 10.129.34.51 -> 10.129.34.61 TCP 66 35822 > rlm-admin [ACK] Seq=841 Ack=440 Win=83 Len=0 TSval=62206721 TSecr=255803967
  0.086652 10.129.34.61 -> 10.129.34.51 SIP 505 Status: 503 Service Unavailable    (0 bindings)
  0.086680 10.129.34.51 -> 10.129.34.61 TCP 66 43346 > rlm-admin [ACK] Seq=807 Ack=439 Win=31 Len=0 TSval=62206721 TSecr=255803967
  0.087133 10.129.34.51 -> 10.129.34.61 TCP 66 39746 > rlm-admin [ACK] Seq=1681 Ack=440 Win=83 Len=0 TSval=62206721 TSecr=255803967
  0.087158 10.129.34.61 -> 10.129.34.51 SIP 505 Status: 503 Service Unavailable    (0 bindings)
  0.087414 10.129.34.61 -> 10.129.34.51 SIP 506 Status: 503 Service Unavailable    (0 bindings)
  0.087660 10.129.34.51 -> 10.129.34.61 TCP 66 39746 > rlm-admin [ACK] Seq=1681 Ack=879 Win=83 Len=0 TSval=62206721 TSecr=255803968
  0.087739 10.129.34.51 -> 10.129.34.61 TCP 66 48324 > rlm-admin [ACK] Seq=842 Ack=441 Win=83 Len=0 TSval=62206721 TSecr=255803968
  0.087900 10.129.34.61 -> 10.129.34.51 SIP 505 Status: 503 Service Unavailable    (0 bindings)
  0.088264 10.129.34.61 -> 10.129.34.51 SIP 505 Status: 503 Service Unavailable    (0 bindings)
  0.088405 10.129.34.51 -> 10.129.34.61 TCP 66 46843 > rlm-admin [ACK] Seq=808 Ack=440 Win=83 Len=0 TSval=62206721 TSecr=255803968
  0.088626 10.129.34.51 -> 10.129.34.61 TCP 66 37243 > rlm-admin [ACK] Seq=841 Ack=440 Win=83 Len=0 TSval=62206722 TSecr=255803968
  0.088796 10.129.34.61 -> 10.129.34.51 SIP 503 Status: 503 Service Unavailable    (0 bindings)
  0.089126 10.129.34.61 -> 10.129.34.51 SIP 504 Status: 503 Service Unavailable    (0 bindings)
  0.089272 10.129.34.51 -> 10.129.34.61 TCP 66 41836 > rlm-admin [ACK] Seq=839 Ack=438 Win=83 Len=0 TSval=62206722 TSecr=255803968
  0.089520 10.129.34.61 -> 10.129.34.51 SIP 507 Status: 503 Service Unavailable    (0 bindings)
  0.089619 10.129.34.51 -> 10.129.34.61 TCP 66 35881 > rlm-admin [ACK] Seq=807 Ack=439 Win=83 Len=0 TSval=62206722 TSecr=255803968
  0.089874 10.129.34.51 -> 10.129.34.61 TCP 66 48727 > rlm-admin [ACK] Seq=810 Ack=442 Win=83 Len=0 TSval=62206722 TSecr=255803968
  0.089936 10.129.34.61 -> 10.129.34.51 SIP 505 Status: 503 Service Unavailable    (0 bindings)
  0.090329 10.129.34.51 -> 10.129.34.61 TCP 66 48725 > rlm-admin [ACK] Seq=1648 Ack=440 Win=83 Len=0 TSval=62206722 TSecr=255803968
  0.090352 10.129.34.61 -> 10.129.34.51 SIP 505 Status: 503 Service Unavailable    (0 bindings)
  0.090604 10.129.34.61 -> 10.129.34.51 SIP 507 Status: 503 Service Unavailable    (0 bindings)
  0.090693 10.129.34.51 -> 10.129.34.61 TCP 66 48725 > rlm-admin [ACK] Seq=1648 Ack=879 Win=83 Len=0 TSval=62206722 TSecr=255803968
  0.090948 10.129.34.61 -> 10.129.34.51 SIP 507 Status: 503 Service Unavailable    (0 bindings)
  0.091045 10.129.34.51 -> 10.129.34.61 TCP 66 54707 > rlm-admin [ACK] Seq=810 Ack=442 Win=83 Len=0 TSval=62206722 TSecr=255803968
  0.091323 10.129.34.51 -> 10.129.34.61 TCP 66 53063 > rlm-admin [ACK] Seq=810 Ack=442 Win=83 Len=0 TSval=62206722 TSecr=255803968
  0.787890 10.129.34.61 -> 10.129.34.51 SIP 600 Status: 401 Unauthorized    (0 bindings)
  0.788227 10.129.34.61 -> 10.129.34.51 SIP 600 Status: 401 Unauthorized    (0 bindings)
  0.788422 10.129.34.51 -> 10.129.34.61 TCP 66 44352 > rlm-admin [ACK] Seq=1679 Ack=535 Win=31 Len=0 TSval=62206896 TSecr=255804143
  0.788444 10.129.34.51 -> 10.129.34.61 TCP 66 44657 > rlm-admin [ACK] Seq=2512 Ack=535 Win=82 Len=0 TSval=62206897 TSecr=255804143
  0.800433 10.129.34.61 -> 10.129.34.51 SIP 602 Status: 401 Unauthorized    (0 bindings)
  0.801171 10.129.34.51 -> 10.129.34.61 TCP 66 48569 > rlm-admin [ACK] Seq=2491 Ack=537 Win=82 Len=0 TSval=62206900 TSecr=255804146
  0.802875 10.129.34.61 -> 10.129.34.51 SIP 600 Status: 401 Unauthorized    (0 bindings)
  0.803264 10.129.34.61 -> 10.129.34.51 SIP 600 Status: 401 Unauthorized    (0 bindings)
  0.803774 10.129.34.51 -> 10.129.34.61 TCP 66 44657 > rlm-admin [ACK] Seq=2512 Ack=1069 Win=81 Len=0 TSval=62206900 TSecr=255804146
  0.803792 10.129.34.51 -> 10.129.34.61 TCP 66 40502 > rlm-admin [ACK] Seq=2453 Ack=535 Win=82 Len=0 TSval=62206900 TSecr=255804147
  0.807489 10.129.34.61 -> 10.129.34.51 SIP 599 Status: 401 Unauthorized    (0 bindings)
  0.808546 10.129.34.51 -> 10.129.34.61 TCP 66 40502 > rlm-admin [ACK] Seq=2453 Ack=1068 Win=81 Len=0 TSval=62206901 TSecr=255804148
  0.809075 10.129.34.51 -> 10.129.34.61 SIP 876 Request: REGISTER sip:ims.hom
  0.809093 10.129.34.61 -> 10.129.34.51 TCP 66 rlm-admin > 46844 [ACK] Seq=1 Ack=811 Win=32 Len=0 TSval=255804148 TSecr=62206902
  0.810066 10.129.34.51 -> 10.129.34.61 SIP 876 Request: REGISTER sip:ims.hom
  0.810088 10.129.34.61 -> 10.129.34.51 TCP 66 rlm-admin > 43346 [ACK] Seq=439 Ack=1617 Win=35 Len=0 TSval=255804148 TSecr=62206902
  0.813072 10.129.34.61 -> 10.129.34.51 SIP 600 Status: 401 Unauthorized    (0 bindings)
  0.813398 10.129.34.51 -> 10.129.34.61 TCP 66 44657 > rlm-admin [ACK] Seq=2512 Ack=1603 Win=81 Len=0 TSval=62206903 TSecr=255804149
  0.814057 10.129.34.51 -> 10.129.34.61 SIP 881 Request: REGISTER sip:ims.hom
  0.814075 10.129.34.61 -> 10.129.34.51 TCP 66 rlm-admin > 52015 [ACK] Seq=441 Ack=1657 Win=82 Len=0 TSval=255804149 TSecr=62206903
  0.814462 10.129.34.61 -> 10.129.34.51 SIP 602 Status: 401 Unauthorized    (0 bindings)
  0.814585 10.129.34.61 -> 10.129.34.51 SIP 600 Status: 401 Unauthorized    (0 bindings)
  0.814707 10.129.34.51 -> 10.129.34.61 SIP 878 Request: REGISTER sip:ims.hom
  0.814723 10.129.34.61 -> 10.129.34.51 TCP 66 rlm-admin > 48727 [ACK] Seq=442 Ack=1622 Win=82 Len=0 TSval=255804149 TSecr=62206903
  0.814915 10.129.34.51 -> 10.129.34.61 TCP 66 48569 > rlm-admin [ACK] Seq=2491 Ack=1073 Win=81 Len=0 TSval=62206903 TSecr=255804149
  0.814925 10.129.34.51 -> 10.129.34.61 TCP 66 35180 > rlm-admin [ACK] Seq=1646 Ack=535 Win=82 Len=0 TSval=62206903 TSecr=255804149
  0.815249 10.129.34.51 -> 10.129.34.61 SIP 848 Request: REGISTER sip:ims.hom
  0.815269 10.129.34.61 -> 10.129.34.51 TCP 66 rlm-admin > 54707 [ACK] Seq=442 Ack=1592 Win=82 Len=0 TSval=255804150 TSecr=62206903
  0.815862 10.129.34.61 -> 10.129.34.51 SIP 600 Status: 401 Unauthorized    (0 bindings)
  0.816007 10.129.34.61 -> 10.129.34.51 SIP 602 Status: 401 Unauthorized    (0 bindings)
  0.816163 10.129.34.61 -> 10.129.34.51 SIP 601 Status: 401 Unauthorized    (0 bindings)
  0.816269 10.129.34.51 -> 10.129.34.61 TCP 66 48540 > rlm-admin [ACK] Seq=1681 Ack=975 Win=82 Len=0 TSval=62206903 TSecr=255804150
  0.816433 10.129.34.61 -> 10.129.34.51 SIP 600 Status: 401 Unauthorized    (0 bindings)
  0.816534 10.129.34.51 -> 10.129.34.61 TCP 66 48569 > rlm-admin [ACK] Seq=2491 Ack=1609 Win=81 Len=0 TSval=62206903 TSecr=255804150
  0.816552 10.129.34.51 -> 10.129.34.61 TCP 66 49736 > rlm-admin [ACK] Seq=1645 Ack=536 Win=82 Len=0 TSval=62206904 TSecr=255804150
  0.816750 10.129.34.51 -> 10.129.34.61 SIP 847 Request: REGISTER sip:ims.hom
  0.816771 10.129.34.61 -> 10.129.34.51 TCP 66 rlm-admin > 37243 [ACK] Seq=440 Ack=1622 Win=82 Len=0 TSval=255804150 TSecr=62206904
  0.816808 10.129.34.51 -> 10.129.34.61 TCP 66 33748 > rlm-admin [ACK] Seq=838 Ack=535 Win=31 Len=0 TSval=62206904 TSecr=255804150
  0.817022 10.129.34.61 -> 10.129.34.51 SIP 602 Status: 401 Unauthorized    (0 bindings)
  0.817338 10.129.34.51 -> 10.129.34.61 TCP 66 35180 > rlm-admin [ACK] Seq=1646 Ack=1071 Win=81 Len=0 TSval=62206904 TSecr=255804150
  0.819496 10.129.34.61 -> 10.129.34.51 SIP 600 Status: 401 Unauthorized    (0 bindings)
  0.821075 10.129.34.61 -> 10.129.34.51 SIP 602 Status: 401 Unauthorized    (0 bindings)
  0.822195 10.129.34.51 -> 10.129.34.61 TCP 66 56476 > rlm-admin [ACK] Seq=805 Ack=535 Win=82 Len=0 TSval=62206905 TSecr=255804151
  0.822393 10.129.34.51 -> 10.129.34.61 TCP 66 44352 > rlm-admin [ACK] Seq=1679 Ack=1071 Win=33 Len=0 TSval=62206905 TSecr=255804151
  0.825483 10.129.34.61 -> 10.129.34.51 SIP 602 Status: 401 Unauthorized    (0 bindings)
  0.825862 10.129.34.51 -> 10.129.34.61 TCP 66 40502 > rlm-admin [ACK] Seq=2453 Ack=1604 Win=81 Len=0 TSval=62206906 TSecr=255804152
  0.826225 10.129.34.61 -> 10.129.34.51 SIP 602 Status: 401 Unauthorized    (0 bindings)
  0.826518 10.129.34.61 -> 10.129.34.51 SIP 599 Status: 401 Unauthorized    (0 bindings)
  0.829526 10.129.34.61 -> 10.129.34.51 SIP 600 Status: 401 Unauthorized    (0 bindings)
  0.834465 10.129.34.51 -> 10.129.34.61 TCP 66 36308 > rlm-admin [ACK] Seq=842 Ack=537 Win=82 Len=0 TSval=62206907 TSecr=255804152
  0.834492 10.129.34.51 -> 10.129.34.61 TCP 66 38351 > rlm-admin [ACK] Seq=837 Ack=534 Win=82 Len=0 TSval=62206907 TSecr=255804152
  0.834501 10.129.34.51 -> 10.129.34.61 SIP 876 Request: REGISTER sip:ims.hom
  0.834518 10.129.34.61 -> 10.129.34.51 TCP 66 rlm-admin > 51496 [ACK] Seq=1 Ack=811 Win=82 Len=0 TSval=255804154 TSecr=62206907
  0.834530 10.129.34.51 -> 10.129.34.61 SIP 847 Request: REGISTER sip:ims.hom
  0.834540 10.129.34.51 -> 10.129.34.61 SIP 876 Request: REGISTER sip:ims.hom
  0.836324 10.129.34.51 -> 10.129.34.61 TCP 66 49736 > rlm-admin [ACK] Seq=1645 Ack=1070 Win=81 Len=0 TSval=62206908 TSecr=255804153
  0.841914 10.129.34.51 -> 10.129.34.61 SIP 879 Request: REGISTER sip:ims.hom
  0.841963 10.129.34.61 -> 10.129.34.51 TCP 66 rlm-admin > 53063 [ACK] Seq=442 Ack=1623 Win=82 Len=0 TSval=255804156 TSecr=62206910
  0.842701 10.129.34.51 -> 10.129.34.61 SIP 880 Request: REGISTER sip:ims.hom
  0.842732 10.129.34.61 -> 10.129.34.51 TCP 66 rlm-admin > 35822 [ACK] Seq=440 Ack=1655 Win=82 Len=0 TSval=255804156 TSecr=62206910
  0.843311 10.129.34.51 -> 10.129.34.61 SIP 848 Request: REGISTER sip:ims.hom
  0.843338 10.129.34.61 -> 10.129.34.51 TCP 66 rlm-admin > 38927 [ACK] Seq=440 Ack=1623 Win=82 Len=0 TSval=255804157 TSecr=62206910
  0.844749 10.129.34.51 -> 10.129.34.61 SIP 848 Request: REGISTER sip:ims.hom
  0.844778 10.129.34.61 -> 10.129.34.51 TCP 66 rlm-admin > 44352 [ACK] Seq=1071 Ack=2461 Win=39 Len=0 TSval=255804157 TSecr=62206911
  0.845510 10.129.34.51 -> 10.129.34.61 SIP 1514 Request: REGISTER sip:ims.hom
  0.845538 10.129.34.61 -> 10.129.34.51 TCP 66 rlm-admin > 53063 [ACK] Seq=442 Ack=3071 Win=80 Len=0 TSval=255804157 TSecr=62206911
  0.846955 10.129.34.51 -> 10.129.34.61 SIP 880 Request: REGISTER sip:ims.hom
  0.851582 10.129.34.51 -> 10.129.34.61 SIP 880 Request: REGISTER sip:ims.hom
  0.851604 10.129.34.61 -> 10.129.34.51 TCP 66 rlm-admin > 53085 [ACK] Seq=1 Ack=815 Win=82 Len=0 TSval=255804159 TSecr=62206912
  0.852548 10.129.34.51 -> 10.129.34.61 SIP 877 Request: REGISTER sip:ims.hom
  0.852571 10.129.34.61 -> 10.129.34.51 TCP 66 rlm-admin > 43346 [ACK] Seq=439 Ack=2428 Win=38 Len=0 TSval=255804159 TSecr=62206912
  0.858164 10.129.34.61 -> 10.129.34.51 SIP 503 Status: 503 Service Unavailable    (0 bindings)
  0.862784 10.129.34.61 -> 10.129.34.51 SIP 504 Status: 503 Service Unavailable    (0 bindings)
  0.863578 10.129.34.61 -> 10.129.34.51 SIP 505 Status: 503 Service Unavailable    (0 bindings)
  0.863844 10.129.34.61 -> 10.129.34.51 SIP 506 Status: 503 Service Unavailable    (0 bindings)
  0.864116 10.129.34.61 -> 10.129.34.51 SIP 506 Status: 503 Service Unavailable    (0 bindings)
  0.864524 10.129.34.61 -> 10.129.34.51 SIP 505 Status: 503 Service Unavailable    (0 bindings)
  0.864875 10.129.34.61 -> 10.129.34.51 SIP 505 Status: 503 Service Unavailable    (0 bindings)
  0.865182 10.129.34.61 -> 10.129.34.51 SIP 504 Status: 503 Service Unavailable    (0 bindings)
  0.871061 10.129.34.61 -> 10.129.34.51 TCP 66 rlm-admin > 49048 [ACK] Seq=1 Ack=782 Win=83 Len=0 TSval=255804164 TSecr=62206907
  0.937003 10.129.34.51 -> 10.129.34.61 TCP 66 44352 > rlm-admin [ACK] Seq=2461 Ack=1511 Win=35 Len=0 TSval=62206934 TSecr=255804162
  0.999537 10.129.34.51 -> 10.129.34.61 SIP 874 Request: REGISTER sip:ims.hom
  0.999602 10.129.34.61 -> 10.129.34.51 TCP 66 rlm-admin > 33296 [ACK] Seq=1 Ack=809 Win=32 Len=0 TSval=255804196 TSecr=62206949
  1.001399 10.129.34.51 -> 10.129.34.61 SIP 907 Request: REGISTER sip:ims.hom
  1.001438 10.129.34.61 -> 10.129.34.51 TCP 66 rlm-admin > 51496 [ACK] Seq=1 Ack=1652 Win=81 Len=0 TSval=255804196 TSecr=62206950
  1.001903 10.129.34.61 -> 10.129.34.51 SIP 506 Status: 503 Service Unavailable    (0 bindings)
  1.002663 10.129.34.51 -> 10.129.34.61 TCP 66 51496 > rlm-admin [ACK] Seq=1652 Ack=441 Win=83 Len=0 TSval=62206950 TSecr=255804196
  1.003733 10.129.34.51 -> 10.129.34.61 SIP 1514 Request: REGISTER sip:ims.hom
  1.005895 10.129.34.51 -> 10.129.34.61 SIP 874 Request: REGISTER sip:ims.hom
  1.005925 10.129.34.61 -> 10.129.34.51 TCP 66 rlm-admin > 46056 [ACK] Seq=441 Ack=1617 Win=35 Len=0 TSval=255804197 TSecr=62206951
  1.006304 10.129.34.61 -> 10.129.34.51 SIP 506 Status: 503 Service Unavailable    (0 bindings)
  1.006853 10.129.34.51 -> 10.129.34.61 TCP 66 46056 > rlm-admin [ACK] Seq=1617 Ack=881 Win=33 Len=0 TSval=62206951 TSecr=255804197
  1.008064 10.129.34.51 -> 10.129.34.61 SIP 874 Request: REGISTER sip:ims.hom
  1.008098 10.129.34.61 -> 10.129.34.51 TCP 66 rlm-admin > 46843 [ACK] Seq=440 Ack=1616 Win=82 Len=0 TSval=255804198 TSecr=62206951
  1.008460 10.129.34.61 -> 10.129.34.51 SIP 506 Status: 503 Service Unavailable    (0 bindings)
  1.008733 10.129.34.51 -> 10.129.34.61 SIP 873 Request: REGISTER sip:ims.hom
  1.008762 10.129.34.61 -> 10.129.34.51 TCP 66 rlm-admin > 33442 [ACK] Seq=1 Ack=808 Win=82 Len=0 TSval=255804198 TSecr=62206952
  1.008914 10.129.34.51 -> 10.129.34.61 TCP 66 46843 > rlm-admin [ACK] Seq=1616 Ack=880 Win=83 Len=0 TSval=62206952 TSecr=255804198
  1.009182 10.129.34.61 -> 10.129.34.51 SIP 505 Status: 503 Service Unavailable    (0 bindings)
  1.009602 10.129.34.51 -> 10.129.34.61 TCP 66 33442 > rlm-admin [ACK] Seq=808 Ack=440 Win=83 Len=0 TSval=62206952 TSecr=255804198
  1.009622 10.129.34.51 -> 10.129.34.61 SIP 908 Request: REGISTER sip:ims.hom
  1.009981 10.129.34.61 -> 10.129.34.51 SIP 507 Status: 503 Service Unavailable    (0 bindings)
  1.011387 10.129.34.51 -> 10.129.34.61 SIP 874 Request: REGISTER sip:ims.hom
  1.012040 10.129.34.51 -> 10.129.34.61 SIP 1514 Request: REGISTER sip:ims.hom
  1.014525 10.129.34.51 -> 10.129.34.61 SIP 907 Request: REGISTER sip:ims.hom
  1.014551 10.129.34.61 -> 10.129.34.51 TCP 66 rlm-admin > 35881 [ACK] Seq=439 Ack=1648 Win=82 Len=0 TSval=255804199 TSecr=62206953
  1.015340 10.129.34.51 -> 10.129.34.61 SIP 872 Request: REGISTER sip:ims.hom
  1.015358 10.129.34.61 -> 10.129.34.51 TCP 66 rlm-admin > 33296 [ACK] Seq=1 Ack=1615 Win=35 Len=0 TSval=255804200 TSecr=62206953
  1.016154 10.129.34.51 -> 10.129.34.61 SIP 905 Request: REGISTER sip:ims.hom
  1.016179 10.129.34.61 -> 10.129.34.51 TCP 66 rlm-admin > 48569 [ACK] Seq=1609 Ack=3330 Win=82 Len=0 TSval=255804200 TSecr=62206953
  1.017083 10.129.34.61 -> 10.129.34.51 SIP 602 Status: 401 Unauthorized    (0 bindings)
  1.017160 10.129.34.51 -> 10.129.34.61 SIP 1514 Request: REGISTER sip:ims.hom
  1.017533 10.129.34.51 -> 10.129.34.61 TCP 66 33296 > rlm-admin [ACK] Seq=1615 Ack=537 Win=31 Len=0 TSval=62206954 TSecr=255804200
  1.018321 10.129.34.61 -> 10.129.34.51 SIP 506 Status: 503 Service Unavailable    (0 bindings)
  1.018841 10.129.34.51 -> 10.129.34.61 TCP 66 35881 > rlm-admin [ACK] Seq=1648 Ack=879 Win=83 Len=0 TSval=62206954 TSecr=255804200
  1.018862 10.129.34.51 -> 10.129.34.61 SIP 908 Request: REGISTER sip:ims.hom
  1.019116 10.129.34.61 -> 10.129.34.51 SIP 504 Status: 503 Service Unavailable    (0 bindings)
  1.019658 10.129.34.51 -> 10.129.34.61 SIP 905 Request: REGISTER sip:ims.hom
  1.019683 10.129.34.61 -> 10.129.34.51 TCP 66 rlm-admin > 35505 [ACK] Seq=440 Ack=1680 Win=81 Len=0 TSval=255804201 TSecr=62206954
  1.019689 10.129.34.51 -> 10.129.34.61 TCP 66 33296 > rlm-admin [ACK] Seq=1615 Ack=975 Win=33 Len=0 TSval=62206954 TSecr=255804201
  1.020140 10.129.34.61 -> 10.129.34.51 SIP 504 Status: 503 Service Unavailable    (0 bindings)
  1.020396 10.129.34.51 -> 10.129.34.61 SIP 906 Request: REGISTER sip:ims.hom
  1.020884 10.129.34.61 -> 10.129.34.51 SIP 507 Status: 503 Service Unavailable    (0 bindings)
  1.021200 10.129.34.51 -> 10.129.34.61 SIP 873 Request: REGISTER sip:ims.hom
  1.021227 10.129.34.61 -> 10.129.34.51 TCP 66 rlm-admin > 44657 [ACK] Seq=1603 Ack=3319 Win=82 Len=0 TSval=255804201 TSecr=62206955
  1.021356 10.129.34.61 -> 10.129.34.51 SIP 504 Status: 503 Service Unavailable    (0 bindings)
  1.021709 10.129.34.61 -> 10.129.34.51 SIP 505 Status: 503 Service Unavailable    (0 bindings)
  1.022064 10.129.34.61 -> 10.129.34.51 SIP 505 Status: 503 Service Unavailable    (0 bindings)
  1.022776 10.129.34.51 -> 10.129.34.61 SIP 873 Request: REGISTER sip:ims.hom
  1.022807 10.129.34.61 -> 10.129.34.51 TCP 66 rlm-admin > 36308 [ACK] Seq=537 Ack=1649 Win=81 Len=0 TSval=255804201 TSecr=62206955
  1.023047 10.129.34.51 -> 10.129.34.61 SIP 874 Request: REGISTER sip:ims.hom
  1.023066 10.129.34.61 -> 10.129.34.51 TCP 66 rlm-admin > 38351 [ACK] Seq=534 Ack=1645 Win=82 Len=0 TSval=255804202 TSecr=62206955
  1.023740 10.129.34.51 -> 10.129.34.61 SIP 906 Request: REGISTER sip:ims.hom
  1.023760 10.129.34.61 -> 10.129.34.51 TCP 66 rlm-admin > 49048 [ACK] Seq=1 Ack=1622 Win=82 Len=0 TSval=255804202 TSecr=62206955
  1.024585 10.129.34.61 -> 10.129.34.51 SIP 505 Status: 503 Service Unavailable    (0 bindings)
  1.024647 10.129.34.51 -> 10.129.34.61 SIP 874 Request: REGISTER sip:ims.hom
  1.024679 10.129.34.61 -> 10.129.34.51 TCP 66 rlm-admin > 52015 [ACK] Seq=441 Ack=2465 Win=81 Len=0 TSval=255804202 TSecr=62206956
  1.025421 10.129.34.51 -> 10.129.34.61 SIP 905 Request: REGISTER sip:ims.hom
  1.025447 10.129.34.61 -> 10.129.34.51 TCP 66 rlm-admin > 59051 [ACK] Seq=1 Ack=840 Win=82 Len=0 TSval=255804202 TSecr=62206956
  1.025869 10.129.34.61 -> 10.129.34.51 SIP 602 Status: 401 Unauthorized    (0 bindings)
  1.025983 10.129.34.51 -> 10.129.34.61 SIP 873 Request: REGISTER sip:ims.hom
  1.026004 10.129.34.61 -> 10.129.34.51 TCP 66 rlm-admin > 41836 [ACK] Seq=438 Ack=1646 Win=82 Len=0 TSval=255804202 TSecr=62206956
  1.026617 10.129.34.51 -> 10.129.34.61 SIP 908 Request: REGISTER sip:ims.hom
  1.026646 10.129.34.61 -> 10.129.34.51 TCP 66 rlm-admin > 56476 [ACK] Seq=535 Ack=1647 Win=82 Len=0 TSval=255804202 TSecr=62206956
  1.027293 10.129.34.51 -> 10.129.34.61 SIP 874 Request: REGISTER sip:ims.hom
  1.027321 10.129.34.61 -> 10.129.34.51 TCP 66 rlm-admin > 41179 [ACK] Seq=1 Ack=809 Win=51 Len=0 TSval=255804203 TSecr=62206956
  1.027408 10.129.34.61 -> 10.129.34.51 SIP 506 Status: 503 Service Unavailable    (0 bindings)
  1.027722 10.129.34.61 -> 10.129.34.51 SIP 505 Status: 503 Service Unavailable    (0 bindings)
  1.027818 10.129.34.51 -> 10.129.34.61 SIP 907 Request: REGISTER sip:ims.hom
  1.028093 10.129.34.61 -> 10.129.34.51 SIP 506 Status: 503 Service Unavailable    (0 bindings)
  1.028389 10.129.34.61 -> 10.129.34.51 SIP 504 Status: 503 Service Unavailable    (0 bindings)
  1.028519 10.129.34.51 -> 10.129.34.61 SIP 874 Request: REGISTER sip:ims.hom
  1.028545 10.129.34.61 -> 10.129.34.51 TCP 66 rlm-admin > 46413 [ACK] Seq=1 Ack=809 Win=32 Len=0 TSval=255804203 TSecr=62206956
  1.028593 10.129.34.51 -> 10.129.34.61 TCP 66 52015 > rlm-admin [ACK] Seq=2465 Ack=881 Win=83 Len=0 TSval=62206957 TSecr=255804203
  1.028868 10.129.34.61 -> 10.129.34.51 SIP 505 Status: 503 Service Unavailable    (0 bindings)
  1.029136 10.129.34.51 -> 10.129.34.61 SIP 873 Request: REGISTER sip:ims.hom
  1.029162 10.129.34.61 -> 10.129.34.51 TCP 66 rlm-admin > 48324 [ACK] Seq=441 Ack=1649 Win=82 Len=0 TSval=255804203 TSecr=62206957
  1.029336 10.129.34.61 -> 10.129.34.51 SIP 507 Status: 503 Service Unavailable    (0 bindings)
  1.029694 10.129.34.61 -> 10.129.34.51 SIP 506 Status: 503 Service Unavailable    (0 bindings)
  1.029745 10.129.34.51 -> 10.129.34.61 SIP 874 Request: REGISTER sip:ims.hom
  1.030034 10.129.34.61 -> 10.129.34.51 SIP 506 Status: 503 Service Unavailable    (0 bindings)
  1.030296 10.129.34.51 -> 10.129.34.61 SIP 905 Request: REGISTER sip:ims.hom
  1.030462 10.129.34.61 -> 10.129.34.51 SIP 506 Status: 503 Service Unavailable    (0 bindings)
  1.030813 10.129.34.61 -> 10.129.34.51 SIP 505 Status: 503 Service Unavailable    (0 bindings)
  1.031040 10.129.34.51 -> 10.129.34.61 SIP 872 Request: REGISTER sip:ims.hom
  1.031459 10.129.34.61 -> 10.129.34.51 SIP 504 Status: 503 Service Unavailable    (0 bindings)
  1.031520 10.129.34.51 -> 10.129.34.61 SIP 906 Request: REGISTER sip:ims.hom
  1.031543 10.129.34.61 -> 10.129.34.51 TCP 66 rlm-admin > 35180 [ACK] Seq=1071 Ack=2486 Win=82 Len=0 TSval=255804204 TSecr=62206957
  1.031872 10.129.34.61 -> 10.129.34.51 SIP 504 Status: 503 Service Unavailable    (0 bindings)
  1.032349 10.129.34.61 -> 10.129.34.51 SIP 505 Status: 503 Service Unavailable    (0 bindings)
  1.032485 10.129.34.51 -> 10.129.34.61 SIP 905 Request: REGISTER sip:ims.hom
  1.032510 10.129.34.61 -> 10.129.34.51 TCP 66 rlm-admin > 54707 [ACK] Seq=442 Ack=2431 Win=81 Len=0 TSval=255804204 TSecr=62206957
  1.032810 10.129.34.61 -> 10.129.34.51 SIP 504 Status: 503 Service Unavailable    (0 bindings)
  1.033367 10.129.34.51 -> 10.129.34.61 SIP 906 Request: REGISTER sip:ims.hom
  1.033682 10.129.34.61 -> 10.129.34.51 SIP 505 Status: 503 Service Unavailable    (0 bindings)
  1.033808 10.129.34.51 -> 10.129.34.61 SIP 908 Request: REGISTER sip:ims.hom
  1.033835 10.129.34.61 -> 10.129.34.51 TCP 66 rlm-admin > 40502 [ACK] Seq=1604 Ack=3295 Win=82 Len=0 TSval=255804204 TSecr=62206958
  1.034141 10.129.34.51 -> 10.129.34.61 TCP 66 41912 > rlm-admin [ACK] Seq=841 Ack=440 Win=83 Len=0 TSval=62206958 TSecr=255804204
  1.034341 10.129.34.61 -> 10.129.34.51 SIP 507 Status: 503 Service Unavailable    (0 bindings)
  1.034443 10.129.34.51 -> 10.129.34.61 SIP 875 Request: REGISTER sip:ims.hom
  1.034697 10.129.34.61 -> 10.129.34.51 SIP 507 Status: 503 Service Unavailable    (0 bindings)
  1.035523 10.129.34.51 -> 10.129.34.61 SIP 905 Request: REGISTER sip:ims.hom
  1.036119 10.129.34.51 -> 10.129.34.61 SIP 875 Request: REGISTER sip:ims.hom
  1.036382 10.129.34.61 -> 10.129.34.51 SIP 507 Status: 503 Service Unavailable    (0 bindings)
  1.037336 10.129.34.51 -> 10.129.34.61 SIP 906 Request: REGISTER sip:ims.hom
  1.037620 10.129.34.61 -> 10.129.34.51 SIP 505 Status: 503 Service Unavailable    (0 bindings)
  1.038466 10.129.34.51 -> 10.129.34.61 SIP 907 Request: REGISTER sip:ims.hom
  1.038497 10.129.34.61 -> 10.129.34.51 TCP 66 rlm-admin > 54274 [ACK] Seq=1 Ack=842 Win=82 Len=0 TSval=255804205 TSecr=62206959
  1.038822 10.129.34.61 -> 10.129.34.51 SIP 506 Status: 503 Service Unavailable    (0 bindings)
  1.040631 10.129.34.51 -> 10.129.34.61 SIP 878 Request: REGISTER sip:ims.hom
  1.040662 10.129.34.61 -> 10.129.34.51 TCP 66 rlm-admin > 37243 [ACK] Seq=440 Ack=2434 Win=81 Len=0 TSval=255804206 TSecr=62206959
  1.041206 10.129.34.61 -> 10.129.34.51 SIP 508 Status: 503 Service Unavailable    (0 bindings)
  1.043068 10.129.34.61 -> 10.129.34.51 TCP 66 rlm-admin > 38927 [ACK] Seq=880 Ack=3071 Win=83 Len=0 TSval=255804207 TSecr=62206950
  1.048833 10.129.34.51 -> 10.129.34.61 TCP 66 46843 > rlm-admin [ACK] Seq=2458 Ack=1321 Win=83 Len=0 TSval=62206962 TSecr=255804198
  1.051100 10.129.34.61 -> 10.129.34.51 TCP 66 rlm-admin > 53085 [ACK] Seq=440 Ack=2263 Win=83 Len=0 TSval=255804209 TSecr=62206952
  1.051817 10.129.34.51 -> 10.129.34.61 SIP 266 Request: REGISTER sip:ims.hom
  1.051846 10.129.34.61 -> 10.129.34.51 TCP 66 rlm-admin > 53085 [ACK] Seq=440 Ack=2463 Win=83 Len=0 TSval=255804209 TSecr=62206962
  1.055155 10.129.34.61 -> 10.129.34.51 TCP 66 rlm-admin > 43346 [ACK] Seq=877 Ack=3876 Win=44 Len=0 TSval=255804210 TSecr=62206954
  1.055852 10.129.34.51 -> 10.129.34.61 SIP 1106 Request: REGISTER sip:ims.hom
  1.055881 10.129.34.61 -> 10.129.34.51 TCP 66 rlm-admin > 43346 [ACK] Seq=877 Ack=4916 Win=50 Len=0 TSval=255804210 TSecr=62206963
  1.067125 10.129.34.61 -> 10.129.34.51 SIP 503 [TCP Retransmission] Status: 503 Service Unavailable    (0 bindings)
  1.067209 10.129.34.61 -> 10.129.34.51 SIP 504 [TCP Retransmission] Status: 503 Service Unavailable    (0 bindings)
  1.067218 10.129.34.61 -> 10.129.34.51 TCP 66 rlm-admin > 48569 [ACK] Seq=2047 Ack=4138 Win=83 Len=0 TSval=255804213 TSecr=62206957
  1.067814 10.129.34.51 -> 10.129.34.61 TCP 66 48725 > rlm-admin [ACK] Seq=2458 Ack=1316 Win=83 Len=0 TSval=62206966 TSecr=255804213
  1.068753 10.129.34.51 -> 10.129.34.61 SIP 880 [TCP Retransmission] Request: REGISTER sip:ims.hom
  1.068782 10.129.34.61 -> 10.129.34.51 TCP 78 [TCP Dup ACK 211#1] rlm-admin > 35822 [ACK] Seq=879 Ack=1655 Win=83 Len=0 TSval=255804213 TSecr=62206967 SLE=841 SRE=1655
  1.069519 10.129.34.51 -> 10.129.34.61 SIP 882 Request: REGISTER sip:ims.hom
  1.069540 10.129.34.61 -> 10.129.34.51 TCP 66 rlm-admin > 35822 [ACK] Seq=879 Ack=2471 Win=82 Len=0 TSval=255804213 TSecr=62206967
  1.071207 10.129.34.61 -> 10.129.34.51 SIP 505 [TCP Retransmission] Status: 503 Service Unavailable    (0 bindings)
  1.071232 10.129.34.61 -> 10.129.34.51 SIP 505 [TCP Retransmission] Status: 503 Service Unavailable    (0 bindings)
  1.071275 10.129.34.61 -> 10.129.34.51 SIP 505 [TCP Retransmission] Status: 503 Service Unavailable    (0 bindings)
  1.075166 10.129.34.61 -> 10.129.34.51 SIP 506 [TCP Retransmission] Status: 503 Service Unavailable    (0 bindings)
  1.075341 10.129.34.61 -> 10.129.34.51 SIP 504 [TCP Retransmission] Status: 503 Service Unavailable    (0 bindings)
  1.075350 10.129.34.61 -> 10.129.34.51 TCP 66 rlm-admin > 35505 [ACK] Seq=878 Ack=2519 Win=81 Len=0 TSval=255804215 TSecr=62206958
  1.075797 10.129.34.51 -> 10.129.34.61 SIP 1014 Request: REGISTER sip:ims.hom
  1.075827 10.129.34.61 -> 10.129.34.51 SIP 503 Status: 503 Service Unavailable    (0 bindings)
  1.118443 10.129.34.61 -> 10.129.34.51 SIP 749 Status: 200 OK    (1 bindings)
  1.119080 10.129.34.51 -> 10.129.34.61 TCP 66 46844 > rlm-admin [ACK] Seq=811 Ack=684 Win=32 Len=0 TSval=62206979 TSecr=255804225
  1.227199 10.129.34.61 -> 10.129.34.51 SIP 504 [TCP Retransmission] Status: 503 Service Unavailable    (0 bindings)
  1.227214 10.129.34.61 -> 10.129.34.51 SIP 505 [TCP Retransmission] Status: 503 Service Unavailable    (0 bindings)
  1.228007 10.129.34.51 -> 10.129.34.61 TCP 66 48569 > rlm-admin [ACK] Seq=4138 Ack=2047 Win=83 Len=0 TSval=62207006 TSecr=255804253
  1.228039 10.129.34.61 -> 10.129.34.51 SIP 506 Status: 503 Service Unavailable    (0 bindings)
  1.228107 10.129.34.51 -> 10.129.34.61 TCP 66 44657 > rlm-admin [ACK] Seq=3319 Ack=2042 Win=83 Len=0 TSval=62207006 TSecr=255804253
  1.228709 10.129.34.51 -> 10.129.34.61 TCP 66 48569 > rlm-admin [ACK] Seq=4138 Ack=2487 Win=83 Len=0 TSval=62207007 TSecr=255804253
  1.231119 10.129.34.61 -> 10.129.34.51 SIP 504 [TCP Retransmission] Status: 503 Service Unavailable    (0 bindings)
  1.231200 10.129.34.61 -> 10.129.34.51 SIP 505 [TCP Retransmission] Status: 503 Service Unavailable    (0 bindings)
  1.231217 10.129.34.61 -> 10.129.34.51 SIP 505 [TCP Retransmission] Status: 503 Service Unavailable    (0 bindings)
  1.231805 10.129.34.51 -> 10.129.34.61 TCP 66 35505 > rlm-admin [ACK] Seq=2519 Ack=878 Win=83 Len=0 TSval=62207007 TSecr=255804254
  1.231834 10.129.34.61 -> 10.129.34.51 SIP 504 Status: 503 Service Unavailable    (0 bindings)
  1.231910 10.129.34.51 -> 10.129.34.61 TCP 66 54454 > rlm-admin [ACK] Seq=841 Ack=440 Win=83 Len=0 TSval=62207007 TSecr=255804254
  1.231922 10.129.34.51 -> 10.129.34.61 TCP 66 36308 > rlm-admin [ACK] Seq=1649 Ack=976 Win=83 Len=0 TSval=62207007 TSecr=255804254
  1.232496 10.129.34.51 -> 10.129.34.61 TCP 66 35505 > rlm-admin [ACK] Seq=2519 Ack=1316 Win=83 Len=0 TSval=62207007 TSecr=255804254
  1.235187 10.129.34.61 -> 10.129.34.51 SIP 507 [TCP Retransmission] Status: 503 Service Unavailable    (0 bindings)
  1.235317 10.129.34.61 -> 10.129.34.51 SIP 602 [TCP Retransmission] Status: 401 Unauthorized    (0 bindings)
  1.235327 10.129.34.61 -> 10.129.34.51 SIP 506 [TCP Retransmission] Status: 503 Service Unavailable    (0 bindings)
  1.235334 10.129.34.61 -> 10.129.34.51 SIP 505 [TCP Retransmission] Status: 503 Service Unavailable    (0 bindings)
  1.235342 10.129.34.61 -> 10.129.34.51 SIP 505 [TCP Retransmission] Status: 503 Service Unavailable    (0 bindings)
  1.235349 10.129.34.61 -> 10.129.34.51 SIP 507 [TCP Retransmission] Status: 503 Service Unavailable    (0 bindings)
  1.235356 10.129.34.61 -> 10.129.34.51 SIP 505 [TCP Retransmission] Status: 503 Service Unavailable    (0 bindings)
