  0.000000 10.129.34.51 -> 10.129.34.61 TCP 74 49048 > rlm-admin [SYN] Seq=0 Win=14600 Len=0 MSS=1460 SACK_PERM=1 TSval=62102639 TSecr=0 WS=512
  0.000067 10.129.34.61 -> 10.129.34.51 TCP 74 rlm-admin > 49048 [SYN, ACK] Seq=0 Ack=1 Win=14480 Len=0 MSS=1460 SACK_PERM=1 TSval=255699885 TSecr=62102639 WS=512
  0.000565 10.129.34.51 -> 10.129.34.61 TCP 66 49694 > rlm-admin [FIN, ACK] Seq=1 Ack=1 Win=83 Len=0 TSval=62102639 TSecr=255673988
  0.000595 10.129.34.51 -> 10.129.34.61 TCP 66 49048 > rlm-admin [ACK] Seq=1 Ack=1 Win=14848 Len=0 TSval=62102639 TSecr=255699885
  0.000789 10.129.34.61 -> 10.129.34.51 TCP 66 rlm-admin > 49694 [FIN, ACK] Seq=1 Ack=2 Win=83 Len=0 TSval=255699886 TSecr=62102639
  0.001475 10.129.34.51 -> 10.129.34.61 TCP 66 49694 > rlm-admin [ACK] Seq=2 Ack=2 Win=83 Len=0 TSval=62102639 TSecr=255699886
  1.000867 10.129.34.51 -> 10.129.34.61 TCP 74 59051 > rlm-admin [SYN] Seq=0 Win=14600 Len=0 MSS=1460 SACK_PERM=1 TSval=62102889 TSecr=0 WS=512
  1.000933 10.129.34.61 -> 10.129.34.51 TCP 74 rlm-admin > 59051 [SYN, ACK] Seq=0 Ack=1 Win=14480 Len=0 MSS=1460 SACK_PERM=1 TSval=255700136 TSecr=62102889 WS=512
  1.001694 10.129.34.51 -> 10.129.34.61 TCP 66 59051 > rlm-admin [ACK] Seq=1 Ack=1 Win=14848 Len=0 TSval=62102889 TSecr=255700136
  1.006475 10.129.34.51 -> 10.129.34.61 TCP 66 54093 > rlm-admin [FIN, ACK] Seq=1 Ack=1 Win=83 Len=0 TSval=62102891 TSecr=255673475
  1.006634 10.129.34.61 -> 10.129.34.51 TCP 66 rlm-admin > 54093 [FIN, ACK] Seq=1 Ack=2 Win=81 Len=0 TSval=255700137 TSecr=62102891
  1.007413 10.129.34.51 -> 10.129.34.61 TCP 66 54093 > rlm-admin [ACK] Seq=2 Ack=2 Win=83 Len=0 TSval=62102891 TSecr=255700137
  3.001996 10.129.34.51 -> 10.129.34.61 TCP 74 48667 > rlm-admin [SYN] Seq=0 Win=14600 Len=0 MSS=1460 SACK_PERM=1 TSval=62103390 TSecr=0 WS=512
  3.002075 10.129.34.61 -> 10.129.34.51 TCP 74 rlm-admin > 48667 [SYN, ACK] Seq=0 Ack=1 Win=14480 Len=0 MSS=1460 SACK_PERM=1 TSval=255700636 TSecr=62103390 WS=512
  3.002799 10.129.34.51 -> 10.129.34.61 TCP 66 48667 > rlm-admin [ACK] Seq=1 Ack=1 Win=14848 Len=0 TSval=62103390 TSecr=255700636
  3.010989 10.129.34.51 -> 10.129.34.61 TCP 66 34133 > rlm-admin [FIN, ACK] Seq=1 Ack=1 Win=53 Len=0 TSval=62103392 TSecr=255674238
  3.011979 10.129.34.61 -> 10.129.34.51 TCP 66 rlm-admin > 34133 [FIN, ACK] Seq=1 Ack=2 Win=57 Len=0 TSval=255700638 TSecr=62103392
  3.012989 10.129.34.51 -> 10.129.34.61 TCP 66 34133 > rlm-admin [ACK] Seq=2 Ack=2 Win=53 Len=0 TSval=62103392 TSecr=255700638
  7.544712 10.129.34.51 -> 10.129.34.61 SIP 902 Request: REGISTER sip:ims.hom
  7.546070 10.129.34.51 -> 10.129.34.61 SIP 902 Request: REGISTER sip:ims.hom
  7.546920 10.129.34.51 -> 10.129.34.61 SIP 903 Request: REGISTER sip:ims.hom
  7.546951 10.129.34.61 -> 10.129.34.51 TCP 66 rlm-admin > 48569 [ACK] Seq=1 Ack=838 Win=32 Len=0 TSval=255701772 TSecr=62104526
  7.549741 10.129.34.51 -> 10.129.34.61 SIP 902 Request: REGISTER sip:ims.hom
  7.550583 10.129.34.51 -> 10.129.34.61 SIP 904 Request: REGISTER sip:ims.hom
  7.551507 10.129.34.51 -> 10.129.34.61 SIP 904 Request: REGISTER sip:ims.hom
  7.552241 10.129.34.51 -> 10.129.34.61 SIP 903 Request: REGISTER sip:ims.hom
  7.552887 10.129.34.51 -> 10.129.34.61 SIP 903 Request: REGISTER sip:ims.hom
  7.552920 10.129.34.61 -> 10.129.34.51 TCP 66 rlm-admin > 51496 [ACK] Seq=1 Ack=838 Win=32 Len=0 TSval=255701774 TSecr=62104527
  7.553892 10.129.34.51 -> 10.129.34.61 SIP 903 Request: REGISTER sip:ims.hom
  7.554661 10.129.34.51 -> 10.129.34.61 SIP 906 Request: REGISTER sip:ims.hom
  7.555175 10.129.34.51 -> 10.129.34.61 SIP 906 Request: REGISTER sip:ims.hom
  7.555759 10.129.34.51 -> 10.129.34.61 SIP 905 Request: REGISTER sip:ims.hom
  7.556256 10.129.34.51 -> 10.129.34.61 SIP 874 Request: REGISTER sip:ims.hom
  7.556917 10.129.34.51 -> 10.129.34.61 SIP 908 Request: REGISTER sip:ims.hom
  7.556941 10.129.34.61 -> 10.129.34.51 TCP 66 rlm-admin > 49048 [ACK] Seq=1 Ack=843 Win=16384 Len=0 TSval=255701775 TSecr=62104528
  7.558037 10.129.34.51 -> 10.129.34.61 SIP 873 Request: REGISTER sip:ims.hom
  7.558058 10.129.34.61 -> 10.129.34.51 TCP 66 rlm-admin > 48667 [ACK] Seq=1 Ack=808 Win=16384 Len=0 TSval=255701775 TSecr=62104529
  7.558624 10.129.34.51 -> 10.129.34.61 SIP 904 Request: REGISTER sip:ims.hom
  7.558647 10.129.34.61 -> 10.129.34.51 TCP 66 rlm-admin > 51496 [ACK] Seq=1 Ack=1676 Win=35 Len=0 TSval=255701775 TSecr=62104529
  7.559794 10.129.34.51 -> 10.129.34.61 SIP 906 Request: REGISTER sip:ims.hom
  7.559818 10.129.34.61 -> 10.129.34.51 TCP 66 rlm-admin > 38927 [ACK] Seq=1 Ack=841 Win=32 Len=0 TSval=255701775 TSecr=62104529
  7.560457 10.129.34.51 -> 10.129.34.61 SIP 873 Request: REGISTER sip:ims.hom
  7.584147 10.129.34.61 -> 10.129.34.51 TCP 66 rlm-admin > 45187 [ACK] Seq=1 Ack=837 Win=83 Len=0 TSval=255701782 TSecr=62104525
  7.585603 10.129.34.61 -> 10.129.34.51 TCP 66 rlm-admin > 35823 [ACK] Seq=1 Ack=837 Win=64 Len=0 TSval=255701782 TSecr=62104526
  7.586079 10.129.34.51 -> 10.129.34.61 SIP 905 Request: REGISTER sip:ims.hom
  7.588156 10.129.34.61 -> 10.129.34.51 TCP 66 rlm-admin > 34258 [ACK] Seq=1 Ack=837 Win=48 Len=0 TSval=255701783 TSecr=62104527
  7.588250 10.129.34.61 -> 10.129.34.51 TCP 66 rlm-admin > 34491 [ACK] Seq=1 Ack=839 Win=54 Len=0 TSval=255701783 TSecr=62104527
  7.588257 10.129.34.61 -> 10.129.34.51 TCP 66 rlm-admin > 53168 [ACK] Seq=1 Ack=839 Win=57 Len=0 TSval=255701783 TSecr=62104527
  7.592152 10.129.34.61 -> 10.129.34.51 TCP 66 rlm-admin > 45641 [ACK] Seq=1 Ack=838 Win=45 Len=0 TSval=255701784 TSecr=62104527
  7.592227 10.129.34.61 -> 10.129.34.51 TCP 66 rlm-admin > 57618 [ACK] Seq=1 Ack=838 Win=54 Len=0 TSval=255701784 TSecr=62104528
  7.592235 10.129.34.61 -> 10.129.34.51 TCP 66 rlm-admin > 47675 [ACK] Seq=1 Ack=841 Win=57 Len=0 TSval=255701784 TSecr=62104528
  7.592242 10.129.34.61 -> 10.129.34.51 TCP 66 rlm-admin > 36349 [ACK] Seq=1 Ack=841 Win=57 Len=0 TSval=255701784 TSecr=62104528
  7.592247 10.129.34.61 -> 10.129.34.51 TCP 66 rlm-admin > 40727 [ACK] Seq=1 Ack=840 Win=81 Len=0 TSval=255701784 TSecr=62104528
  7.592801 10.129.34.51 -> 10.129.34.61 SIP 872 Request: REGISTER sip:ims.hom
  7.592820 10.129.34.61 -> 10.129.34.51 TCP 66 rlm-admin > 57618 [ACK] Seq=1 Ack=1644 Win=57 Len=0 TSval=255701784 TSecr=62104537
  7.596209 10.129.34.61 -> 10.129.34.51 TCP 66 rlm-admin > 59472 [ACK] Seq=1 Ack=809 Win=54 Len=0 TSval=255701785 TSecr=62104528
  7.600149 10.129.34.61 -> 10.129.34.51 TCP 66 rlm-admin > 34021 [ACK] Seq=1 Ack=808 Win=60 Len=0 TSval=255701786 TSecr=62104529
  7.624144 10.129.34.61 -> 10.129.34.51 TCP 66 rlm-admin > 35823 [ACK] Seq=1 Ack=1676 Win=67 Len=0 TSval=255701792 TSecr=62104536
  7.903332 10.129.34.61 -> 10.129.34.51 SIP 601 Status: 401 Unauthorized    (0 bindings)
  7.904061 10.129.34.51 -> 10.129.34.61 TCP 66 34021 > rlm-admin [ACK] Seq=808 Ack=536 Win=55 Len=0 TSval=62104615 TSecr=255701861
  7.917113 10.129.34.51 -> 10.129.34.61 SIP 849 Request: REGISTER sip:ims.hom
  7.917160 10.129.34.61 -> 10.129.34.51 TCP 66 rlm-admin > 59051 [ACK] Seq=1 Ack=784 Win=16384 Len=0 TSval=255701865 TSecr=62104618
  7.953541 10.129.34.61 -> 10.129.34.51 SIP 601 Status: 401 Unauthorized    (0 bindings)
  7.954246 10.129.34.51 -> 10.129.34.61 TCP 66 48667 > rlm-admin [ACK] Seq=808 Ack=536 Win=15872 Len=0 TSval=62104628 TSecr=255701874
  7.962883 10.129.34.61 -> 10.129.34.51 SIP 600 Status: 401 Unauthorized    (0 bindings)
  7.963940 10.129.34.51 -> 10.129.34.61 TCP 66 48569 > rlm-admin [ACK] Seq=838 Ack=535 Win=31 Len=0 TSval=62104630 TSecr=255701876
  7.969159 10.129.34.51 -> 10.129.34.61 SIP 848 Request: REGISTER sip:ims.hom
  7.979680 10.129.34.51 -> 10.129.34.61 SIP 876 Request: REGISTER sip:ims.hom
  7.993662 10.129.34.61 -> 10.129.34.51 SIP 599 Status: 401 Unauthorized    (0 bindings)
  7.994450 10.129.34.51 -> 10.129.34.61 TCP 66 35823 > rlm-admin [ACK] Seq=1676 Ack=534 Win=59 Len=0 TSval=62104638 TSecr=255701884
  8.008303 10.129.34.61 -> 10.129.34.51 TCP 66 rlm-admin > 60181 [ACK] Seq=1 Ack=783 Win=54 Len=0 TSval=255701888 TSecr=62104631
  8.010784 10.129.34.51 -> 10.129.34.61 SIP 878 Request: REGISTER sip:ims.hom
  8.010811 10.129.34.61 -> 10.129.34.51 TCP 66 rlm-admin > 53168 [ACK] Seq=1 Ack=1651 Win=61 Len=0 TSval=255701888 TSecr=62104642
  8.016266 10.129.34.61 -> 10.129.34.51 TCP 66 rlm-admin > 35180 [ACK] Seq=1 Ack=811 Win=54 Len=0 TSval=255701890 TSecr=62104634
  8.032933 10.129.34.61 -> 10.129.34.51 SIP 600 Status: 401 Unauthorized    (0 bindings)
  8.033528 10.129.34.51 -> 10.129.34.61 TCP 66 51496 > rlm-admin [ACK] Seq=1676 Ack=535 Win=31 Len=0 TSval=62104647 TSecr=255701894
  8.041351 10.129.34.61 -> 10.129.34.51 SIP 601 Status: 401 Unauthorized    (0 bindings)
  8.041575 10.129.34.61 -> 10.129.34.51 SIP 600 Status: 401 Unauthorized    (0 bindings)
  8.041996 10.129.34.61 -> 10.129.34.51 SIP 601 Status: 401 Unauthorized    (0 bindings)
  8.042137 10.129.34.51 -> 10.129.34.61 TCP 66 38927 > rlm-admin [ACK] Seq=841 Ack=536 Win=31 Len=0 TSval=62104650 TSecr=255701896
  8.042168 10.129.34.51 -> 10.129.34.61 TCP 66 35823 > rlm-admin [ACK] Seq=1676 Ack=1068 Win=61 Len=0 TSval=62104650 TSecr=255701896
  8.042534 10.129.34.51 -> 10.129.34.61 TCP 66 53168 > rlm-admin [ACK] Seq=1651 Ack=536 Win=50 Len=0 TSval=62104650 TSecr=255701896
  8.045106 10.129.34.61 -> 10.129.34.51 SIP 599 Status: 401 Unauthorized    (0 bindings)
  8.046078 10.129.34.51 -> 10.129.34.61 TCP 66 45187 > rlm-admin [ACK] Seq=837 Ack=534 Win=78 Len=0 TSval=62104651 TSecr=255701897
  8.054188 10.129.34.51 -> 10.129.34.61 SIP 877 Request: REGISTER sip:ims.hom
  8.063855 10.129.34.51 -> 10.129.34.61 SIP 881 Request: REGISTER sip:ims.hom
  8.064770 10.129.34.51 -> 10.129.34.61 SIP 881 Request: REGISTER sip:ims.hom
  8.065381 10.129.34.51 -> 10.129.34.61 SIP 876 Request: REGISTER sip:ims.hom
  8.066246 10.129.34.51 -> 10.129.34.61 SIP 876 Request: REGISTER sip:ims.hom
  8.092238 10.129.34.61 -> 10.129.34.51 TCP 66 rlm-admin > 36624 [ACK] Seq=1 Ack=812 Win=60 Len=0 TSval=255701909 TSecr=62104653
  8.100164 10.129.34.61 -> 10.129.34.51 TCP 66 rlm-admin > 39746 [ACK] Seq=1 Ack=816 Win=60 Len=0 TSval=255701911 TSecr=62104655
  8.104142 10.129.34.61 -> 10.129.34.51 TCP 66 rlm-admin > 54707 [ACK] Seq=1 Ack=816 Win=63 Len=0 TSval=255701912 TSecr=62104655
  8.104218 10.129.34.61 -> 10.129.34.51 TCP 66 rlm-admin > 34967 [ACK] Seq=1 Ack=811 Win=54 Len=0 TSval=255701912 TSecr=62104655
  8.104225 10.129.34.61 -> 10.129.34.51 TCP 66 rlm-admin > 55862 [ACK] Seq=1 Ack=811 Win=60 Len=0 TSval=255701912 TSecr=62104656
  8.130452 10.129.34.61 -> 10.129.34.51 SIP 599 Status: 401 Unauthorized    (0 bindings)
  8.131177 10.129.34.51 -> 10.129.34.61 TCP 66 51496 > rlm-admin [ACK] Seq=1676 Ack=1068 Win=33 Len=0 TSval=62104672 TSecr=255701918
  8.132849 10.129.34.61 -> 10.129.34.51 SIP 603 Status: 401 Unauthorized    (0 bindings)
  8.133351 10.129.34.51 -> 10.129.34.61 TCP 66 49048 > rlm-admin [ACK] Seq=843 Ack=538 Win=15872 Len=0 TSval=62104672 TSecr=255701919
  8.134075 10.129.34.61 -> 10.129.34.51 SIP 600 Status: 401 Unauthorized    (0 bindings)
  8.136759 10.129.34.51 -> 10.129.34.61 TCP 66 57618 > rlm-admin [ACK] Seq=1644 Ack=535 Win=51 Len=0 TSval=62104673 TSecr=255701919
  8.147035 10.129.34.51 -> 10.129.34.61 SIP 881 Request: REGISTER sip:ims.hom
  8.147070 10.129.34.61 -> 10.129.34.51 TCP 66 rlm-admin > 36624 [ACK] Seq=1 Ack=1627 Win=63 Len=0 TSval=255701922 TSecr=62104676
  8.147863 10.129.34.51 -> 10.129.34.61 SIP 880 Request: REGISTER sip:ims.hom
  8.147890 10.129.34.61 -> 10.129.34.51 TCP 66 rlm-admin > 59472 [ACK] Seq=1 Ack=1623 Win=57 Len=0 TSval=255701922 TSecr=62104676
  8.148607 10.129.34.51 -> 10.129.34.61 SIP 876 Request: REGISTER sip:ims.hom
  8.159249 10.129.34.61 -> 10.129.34.51 SIP 599 Status: 401 Unauthorized    (0 bindings)
  8.159648 10.129.34.51 -> 10.129.34.61 TCP 66 34258 > rlm-admin [ACK] Seq=837 Ack=534 Win=43 Len=0 TSval=62104679 TSecr=255701925
  8.178169 10.129.34.51 -> 10.129.34.61 SIP 876 Request: REGISTER sip:ims.hom
  8.178205 10.129.34.61 -> 10.129.34.51 TCP 66 rlm-admin > 39746 [ACK] Seq=1 Ack=1626 Win=63 Len=0 TSval=255701930 TSecr=62104684
  8.188245 10.129.34.61 -> 10.129.34.51 TCP 66 rlm-admin > 55525 [ACK] Seq=1 Ack=811 Win=82 Len=0 TSval=255701933 TSecr=62104676
  8.291667 10.129.34.61 -> 10.129.34.51 SIP 751 Status: 200 OK    (1 bindings)
  8.292305 10.129.34.61 -> 10.129.34.51 SIP 755 Status: 200 OK    (1 bindings)
  8.292460 10.129.34.51 -> 10.129.34.61 TCP 66 53168 > rlm-admin [ACK] Seq=1651 Ack=1221 Win=53 Len=0 TSval=62104712 TSecr=255701958
  8.292830 10.129.34.51 -> 10.129.34.61 TCP 66 59051 > rlm-admin [ACK] Seq=784 Ack=690 Win=16384 Len=0 TSval=62104712 TSecr=255701959
  8.323210 10.129.34.61 -> 10.129.34.51 SIP 754 Status: 200 OK    (1 bindings)
  8.323957 10.129.34.51 -> 10.129.34.61 TCP 66 60181 > rlm-admin [ACK] Seq=783 Ack=689 Win=50 Len=0 TSval=62104720 TSecr=255701966
  8.328700 10.129.34.61 -> 10.129.34.51 SIP 601 Status: 401 Unauthorized    (0 bindings)
  8.329239 10.129.34.51 -> 10.129.34.61 TCP 66 36349 > rlm-admin [ACK] Seq=841 Ack=536 Win=51 Len=0 TSval=62104721 TSecr=255701968
  8.346603 10.129.34.61 -> 10.129.34.51 SIP 601 Status: 401 Unauthorized    (0 bindings)
  8.347124 10.129.34.51 -> 10.129.34.61 TCP 66 34491 > rlm-admin [ACK] Seq=839 Ack=536 Win=50 Len=0 TSval=62104726 TSecr=255701972
  8.348015 10.129.34.61 -> 10.129.34.51 SIP 600 Status: 401 Unauthorized    (0 bindings)
  8.348353 10.129.34.51 -> 10.129.34.61 SIP 880 Request: REGISTER sip:ims.hom
  8.348374 10.129.34.51 -> 10.129.34.61 TCP 66 40727 > rlm-admin [ACK] Seq=840 Ack=535 Win=72 Len=0 TSval=62104726 TSecr=255701972
  8.353025 10.129.34.61 -> 10.129.34.51 SIP 749 Status: 200 OK    (1 bindings)
  8.353551 10.129.34.51 -> 10.129.34.61 TCP 66 55862 > rlm-admin [ACK] Seq=811 Ack=684 Win=53 Len=0 TSval=62104727 TSecr=255701974
  8.354908 10.129.34.61 -> 10.129.34.51 SIP 754 Status: 200 OK    (1 bindings)
  8.355400 10.129.34.61 -> 10.129.34.51 SIP 749 Status: 200 OK    (1 bindings)
  8.355560 10.129.34.51 -> 10.129.34.61 TCP 66 39746 > rlm-admin [ACK] Seq=1626 Ack=689 Win=55 Len=0 TSval=62104728 TSecr=255701974
  8.355676 10.129.34.61 -> 10.129.34.51 SIP 750 Status: 200 OK    (1 bindings)
  8.355895 10.129.34.51 -> 10.129.34.61 TCP 66 34967 > rlm-admin [ACK] Seq=811 Ack=684 Win=51 Len=0 TSval=62104728 TSecr=255701974
  8.355911 10.129.34.51 -> 10.129.34.61 TCP 66 36624 > rlm-admin [ACK] Seq=1627 Ack=685 Win=56 Len=0 TSval=62104728 TSecr=255701974
  8.355969 10.129.34.61 -> 10.129.34.51 SIP 754 Status: 200 OK    (1 bindings)
  8.356295 10.129.34.51 -> 10.129.34.61 TCP 66 36624 > rlm-admin [ACK] Seq=1627 Ack=1373 Win=59 Len=0 TSval=62104728 TSecr=255701974
  8.358821 10.129.34.61 -> 10.129.34.51 SIP 753 Status: 200 OK    (1 bindings)
  8.359332 10.129.34.51 -> 10.129.34.61 TCP 66 59472 > rlm-admin [ACK] Seq=1623 Ack=688 Win=51 Len=0 TSval=62104729 TSecr=255701975
  8.359910 10.129.34.51 -> 10.129.34.61 SIP 877 Request: REGISTER sip:ims.hom
  8.365537 10.129.34.61 -> 10.129.34.51 SIP 602 Status: 401 Unauthorized    (0 bindings)
  8.366133 10.129.34.51 -> 10.129.34.61 TCP 66 59472 > rlm-admin [ACK] Seq=1623 Ack=1224 Win=53 Len=0 TSval=62104731 TSecr=255701977
  8.372065 10.129.34.51 -> 10.129.34.61 SIP 881 Request: REGISTER sip:ims.hom
  8.372149 10.129.34.61 -> 10.129.34.51 TCP 66 rlm-admin > 59472 [ACK] Seq=1224 Ack=2438 Win=60 Len=0 TSval=255701979 TSecr=62104732
  8.380516 10.129.34.61 -> 10.129.34.51 SIP 600 Status: 401 Unauthorized    (0 bindings)
  8.380893 10.129.34.61 -> 10.129.34.51 SIP 754 Status: 200 OK    (1 bindings)
  8.381179 10.129.34.51 -> 10.129.34.61 SIP 847 Request: REGISTER sip:ims.hom
  8.381202 10.129.34.61 -> 10.129.34.51 TCP 66 rlm-admin > 57618 [ACK] Seq=1069 Ack=2425 Win=61 Len=0 TSval=255701981 TSecr=62104734
  8.381392 10.129.34.61 -> 10.129.34.51 SIP 749 Status: 200 OK    (1 bindings)
  8.383616 10.129.34.61 -> 10.129.34.51 SIP 749 Status: 200 OK    (1 bindings)
  8.383944 10.129.34.51 -> 10.129.34.61 TCP 66 35180 > rlm-admin [ACK] Seq=811 Ack=684 Win=49 Len=0 TSval=62104735 TSecr=255701981
  8.384860 10.129.34.61 -> 10.129.34.51 SIP 749 Status: 200 OK    (1 bindings)
  8.388152 10.129.34.61 -> 10.129.34.51 TCP 66 rlm-admin > 53168 [ACK] Seq=1221 Ack=2465 Win=64 Len=0 TSval=255701983 TSecr=62104726
  8.388426 10.129.34.61 -> 10.129.34.51 SIP 600 Status: 401 Unauthorized    (0 bindings)
  8.396137 10.129.34.61 -> 10.129.34.51 TCP 66 rlm-admin > 54167 [ACK] Seq=1 Ack=812 Win=60 Len=0 TSval=255701985 TSecr=62104729
  8.535562 10.129.34.51 -> 10.129.34.61 SIP 905 Request: REGISTER sip:ims.hom
  8.535607 10.129.34.61 -> 10.129.34.51 TCP 66 rlm-admin > 59051 [ACK] Seq=690 Ack=1623 Win=17920 Len=0 TSval=255702019 TSecr=62104773
  8.536465 10.129.34.51 -> 10.129.34.61 SIP 906 Request: REGISTER sip:ims.hom
  8.537478 10.129.34.51 -> 10.129.34.61 SIP 907 Request: REGISTER sip:ims.hom
  8.538606 10.129.34.51 -> 10.129.34.61 SIP 907 Request: REGISTER sip:ims.hom
  8.538631 10.129.34.61 -> 10.129.34.51 TCP 66 rlm-admin > 48667 [ACK] Seq=536 Ack=1649 Win=17920 Len=0 TSval=255702020 TSecr=62104774
  8.539263 10.129.34.51 -> 10.129.34.61 SIP 908 Request: REGISTER sip:ims.hom
  8.539288 10.129.34.61 -> 10.129.34.51 TCP 66 rlm-admin > 35180 [ACK] Seq=684 Ack=1653 Win=57 Len=0 TSval=255702020 TSecr=62104774
  8.547125 10.129.34.51 -> 10.129.34.61 SIP 906 Request: REGISTER sip:ims.hom
  8.547771 10.129.34.51 -> 10.129.34.61 SIP 905 Request: REGISTER sip:ims.hom
  8.549099 10.129.34.51 -> 10.129.34.61 SIP 907 Request: REGISTER sip:ims.hom
  8.549125 10.129.34.61 -> 10.129.34.51 TCP 66 rlm-admin > 40502 [ACK] Seq=1 Ack=842 Win=32 Len=0 TSval=255702023 TSecr=62104776
  8.549455 10.129.34.51 -> 10.129.34.61 SIP 906 Request: REGISTER sip:ims.hom
  8.549478 10.129.34.61 -> 10.129.34.51 TCP 66 rlm-admin > 35505 [ACK] Seq=1 Ack=841 Win=32 Len=0 TSval=255702023 TSecr=62104776
  8.550239 10.129.34.51 -> 10.129.34.61 SIP 874 Request: REGISTER sip:ims.hom
  8.550260 10.129.34.61 -> 10.129.34.51 TCP 66 rlm-admin > 55525 [ACK] Seq=684 Ack=1619 Win=81 Len=0 TSval=255702023 TSecr=62104777
  8.550935 10.129.34.51 -> 10.129.34.61 SIP 907 Request: REGISTER sip:ims.hom
  8.551660 10.129.34.51 -> 10.129.34.61 SIP 904 Request: REGISTER sip:ims.hom
  8.551673 10.129.34.61 -> 10.129.34.51 TCP 66 rlm-admin > 35180 [ACK] Seq=684 Ack=2491 Win=61 Len=0 TSval=255702023 TSecr=62104777
  8.552581 10.129.34.51 -> 10.129.34.61 SIP 906 Request: REGISTER sip:ims.hom
  8.552595 10.129.34.61 -> 10.129.34.51 TCP 66 rlm-admin > 45641 [ACK] Seq=535 Ack=1678 Win=48 Len=0 TSval=255702024 TSecr=62104777
  8.553326 10.129.34.61 -> 10.129.34.51 SIP 600 Status: 401 Unauthorized    (0 bindings)
  8.553492 10.129.34.51 -> 10.129.34.61 SIP 907 Request: REGISTER sip:ims.hom
  8.553509 10.129.34.61 -> 10.129.34.51 TCP 66 rlm-admin > 36349 [ACK] Seq=536 Ack=1682 Win=61 Len=0 TSval=255702024 TSecr=62104777
  8.554473 10.129.34.51 -> 10.129.34.61 SIP 904 Request: REGISTER sip:ims.hom
  8.554493 10.129.34.61 -> 10.129.34.51 TCP 66 rlm-admin > 48569 [ACK] Seq=535 Ack=1676 Win=35 Len=0 TSval=255702024 TSecr=62104778
  8.555004 10.129.34.61 -> 10.129.34.51 SIP 602 Status: 401 Unauthorized    (0 bindings)
  8.555283 10.129.34.51 -> 10.129.34.61 SIP 907 Request: REGISTER sip:ims.hom
  8.556142 10.129.34.51 -> 10.129.34.61 SIP 905 Request: REGISTER sip:ims.hom
  8.576223 10.129.34.61 -> 10.129.34.51 TCP 66 rlm-admin > 43239 [ACK] Seq=1 Ack=841 Win=57 Len=0 TSval=255702030 TSecr=62104773
  8.577019 10.129.34.61 -> 10.129.34.51 SIP 601 Status: 401 Unauthorized    (0 bindings)
  8.579810 10.129.34.61 -> 10.129.34.51 SIP 602 Status: 401 Unauthorized    (0 bindings)
  8.580096 10.129.34.61 -> 10.129.34.51 SIP 601 Status: 401 Unauthorized    (0 bindings)
  8.580424 10.129.34.51 -> 10.129.34.61 TCP 66 48667 > rlm-admin [ACK] Seq=1649 Ack=1072 Win=16896 Len=0 TSval=62104784 TSecr=255702030
  8.580949 10.129.34.61 -> 10.129.34.51 SIP 600 Status: 401 Unauthorized    (0 bindings)
  8.583382 10.129.34.61 -> 10.129.34.51 SIP 603 Status: 401 Unauthorized    (0 bindings)
  8.584615 10.129.34.51 -> 10.129.34.61 TCP 66 35180 > rlm-admin [ACK] Seq=2491 Ack=1221 Win=52 Len=0 TSval=62104785 TSecr=255702031
  8.585798 10.129.34.51 -> 10.129.34.61 SIP 880 [TCP Retransmission] Request: REGISTER sip:ims.hom
  8.585822 10.129.34.61 -> 10.129.34.51 TCP 78 [TCP Dup ACK 149#1] rlm-admin > 53168 [ACK] Seq=1221 Ack=2465 Win=64 Len=0 TSval=255702032 TSecr=62104786 SLE=1651 SRE=2465
  8.588287 10.129.34.61 -> 10.129.34.51 SIP 600 [TCP Retransmission] Status: 401 Unauthorized    (0 bindings)
  8.588388 10.129.34.61 -> 10.129.34.51 SIP 749 [TCP Retransmission] Status: 200 OK    (1 bindings)
  8.588408 10.129.34.61 -> 10.129.34.51 TCP 66 rlm-admin > 41541 [ACK] Seq=1 Ack=842 Win=81 Len=0 TSval=255702033 TSecr=62104777
  8.588912 10.129.34.51 -> 10.129.34.61 TCP 66 57618 > rlm-admin [ACK] Seq=2425 Ack=1069 Win=53 Len=0 TSval=62104786 TSecr=255702033
  8.592193 10.129.34.61 -> 10.129.34.51 SIP 754 [TCP Retransmission] Status: 200 OK    (1 bindings)
  8.592307 10.129.34.61 -> 10.129.34.51 SIP 749 [TCP Retransmission] Status: 200 OK    (1 bindings)
  8.592322 10.129.34.61 -> 10.129.34.51 TCP 66 rlm-admin > 53085 [ACK] Seq=1 Ack=842 Win=63 Len=0 TSval=255702034 TSecr=62104778
  8.596279 10.129.34.61 -> 10.129.34.51 SIP 600 [TCP Retransmission] Status: 401 Unauthorized    (0 bindings)
  8.596391 10.129.34.61 -> 10.129.34.51 TCP 66 rlm-admin > 59051 [ACK] Seq=1224 Ack=2462 Win=19456 Len=0 TSval=255702035 TSecr=62104778
  8.596825 10.129.34.51 -> 10.129.34.61 TCP 66 45641 > rlm-admin [ACK] Seq=1678 Ack=535 Win=40 Len=0 TSval=62104788 TSecr=255702035
  8.598715 10.129.34.51 -> 10.129.34.61 SIP 880 Request: REGISTER sip:ims.hom
  8.598744 10.129.34.61 -> 10.129.34.51 TCP 66 rlm-admin > 45187 [ACK] Seq=534 Ack=1651 Win=82 Len=0 TSval=255702035 TSecr=62104789
  8.599458 10.129.34.51 -> 10.129.34.61 SIP 881 Request: REGISTER sip:ims.hom
  8.599481 10.129.34.61 -> 10.129.34.51 TCP 66 rlm-admin > 48667 [ACK] Seq=1072 Ack=2464 Win=19968 Len=0 TSval=255702035 TSecr=62104789
  8.610485 10.129.34.51 -> 10.129.34.61 SIP 874 Request: REGISTER sip:ims.hom
  8.610515 10.129.34.61 -> 10.129.34.51 TCP 66 rlm-admin > 45641 [ACK] Seq=535 Ack=2486 Win=51 Len=0 TSval=255702038 TSecr=62104792
  8.612306 10.129.34.61 -> 10.129.34.51 SIP 753 Status: 200 OK    (1 bindings)
  8.623919 10.129.34.61 -> 10.129.34.51 SIP 747 Status: 200 OK    (1 bindings)
  8.625840 10.129.34.51 -> 10.129.34.61 SIP 877 [TCP Retransmission] Request: REGISTER sip:ims.hom
  8.625860 10.129.34.61 -> 10.129.34.51 TCP 78 [TCP Dup ACK 151#1] rlm-admin > 54167 [ACK] Seq=1 Ack=812 Win=60 Len=0 TSval=255702042 TSecr=62104796 SLE=1 SRE=812
  8.764309 10.129.34.61 -> 10.129.34.51 SIP 602 [TCP Retransmission] Status: 401 Unauthorized    (0 bindings)
  8.765042 10.129.34.51 -> 10.129.34.61 TCP 66 44657 > rlm-admin [ACK] Seq=842 Ack=537 Win=64 Len=0 TSval=62104830 TSecr=255702077
  8.768139 10.129.34.61 -> 10.129.34.51 SIP 600 [TCP Retransmission] Status: 401 Unauthorized    (0 bindings)
  8.768917 10.129.34.51 -> 10.129.34.61 TCP 66 59051 > rlm-admin [ACK] Seq=2462 Ack=1224 Win=17408 Len=0 TSval=62104831 TSecr=255702078
  8.771372 10.129.34.61 -> 10.129.34.51 SIP 602 Status: 401 Unauthorized    (0 bindings)
  8.771966 10.129.34.51 -> 10.129.34.61 TCP 66 40502 > rlm-admin [ACK] Seq=842 Ack=537 Win=31 Len=0 TSval=62104832 TSecr=255702078
  8.778022 10.129.34.51 -> 10.129.34.61 SIP 906 [TCP Retransmission] Request: REGISTER sip:ims.hom
  8.778049 10.129.34.61 -> 10.129.34.51 TCP 78 [TCP Dup ACK 182#1] rlm-admin > 47494 [ACK] Seq=536 Ack=841 Win=83 Len=0 TSval=255702080 TSecr=62104834 SLE=1 SRE=841
  8.784329 10.129.34.61 -> 10.129.34.51 SIP 601 [TCP Retransmission] Status: 401 Unauthorized    (0 bindings)
  8.784791 10.129.34.51 -> 10.129.34.61 SIP 880 Request: REGISTER sip:ims.hom
  8.784817 10.129.34.61 -> 10.129.34.51 TCP 66 rlm-admin > 34258 [ACK] Seq=534 Ack=1651 Win=51 Len=0 TSval=255702082 TSecr=62104835
  8.784865 10.129.34.51 -> 10.129.34.61 TCP 66 47494 > rlm-admin [ACK] Seq=841 Ack=536 Win=74 Len=0 TSval=62104835 TSecr=255702082
  8.785816 10.129.34.51 -> 10.129.34.61 SIP 881 Request: REGISTER sip:ims.hom
  8.786484 10.129.34.51 -> 10.129.34.61 SIP 882 Request: REGISTER sip:ims.hom
  8.786511 10.129.34.61 -> 10.129.34.51 TCP 66 rlm-admin > 40727 [ACK] Seq=535 Ack=1656 Win=82 Len=0 TSval=255702082 TSecr=62104836
  8.788178 10.129.34.61 -> 10.129.34.51 SIP 601 [TCP Retransmission] Status: 401 Unauthorized    (0 bindings)
  8.788194 10.129.34.61 -> 10.129.34.51 SIP 600 [TCP Retransmission] Status: 401 Unauthorized    (0 bindings)
  8.789032 10.129.34.51 -> 10.129.34.61 SIP 906 Request: REGISTER sip:ims.hom
  8.789059 10.129.34.61 -> 10.129.34.51 TCP 66 rlm-admin > 43239 [ACK] Seq=536 Ack=1681 Win=61 Len=0 TSval=255702083 TSecr=62104836
  8.789082 10.129.34.51 -> 10.129.34.61 SIP 847 Request: REGISTER sip:ims.hom
  8.789888 10.129.34.51 -> 10.129.34.61 SIP 904 [TCP Retransmission] Request: REGISTER sip:ims.hom
  8.789906 10.129.34.61 -> 10.129.34.51 TCP 78 [TCP Dup ACK 177#1] rlm-admin > 48569 [ACK] Seq=535 Ack=1676 Win=35 Len=0 TSval=255702083 TSecr=62104837 SLE=838 SRE=1676
  8.793733 10.129.34.51 -> 10.129.34.61 SIP 907 [TCP Retransmission] Request: REGISTER sip:ims.hom
  8.793752 10.129.34.61 -> 10.129.34.51 TCP 78 [TCP Dup ACK 175#1] rlm-admin > 36349 [ACK] Seq=536 Ack=1682 Win=61 Len=0 TSval=255702084 TSecr=62104838 SLE=841 SRE=1682
  8.799848 10.129.34.61 -> 10.129.34.51 SIP 599 Status: 401 Unauthorized    (0 bindings)
  8.800263 10.129.34.51 -> 10.129.34.61 TCP 66 48569 > rlm-admin [ACK] Seq=1676 Ack=1068 Win=33 Len=0 TSval=62104839 TSecr=255702085
  8.800585 10.129.34.61 -> 10.129.34.51 SIP 602 Status: 401 Unauthorized    (0 bindings)
  8.801491 10.129.34.61 -> 10.129.34.51 SIP 600 Status: 401 Unauthorized    (0 bindings)
  8.806528 10.129.34.51 -> 10.129.34.61 SIP 882 Request: REGISTER sip:ims.hom
  8.806552 10.129.34.61 -> 10.129.34.51 TCP 66 rlm-admin > 47494 [ACK] Seq=536 Ack=1657 Win=82 Len=0 TSval=255702087 TSecr=62104841
  8.806955 10.129.34.61 -> 10.129.34.51 SIP 602 Status: 401 Unauthorized    (0 bindings)
  8.807415 10.129.34.51 -> 10.129.34.61 SIP 880 Request: REGISTER sip:ims.hom
  8.807440 10.129.34.61 -> 10.129.34.51 TCP 66 rlm-admin > 48569 [ACK] Seq=1068 Ack=2490 Win=39 Len=0 TSval=255702087 TSecr=62104841
  8.807579 10.129.34.61 -> 10.129.34.51 SIP 602 Status: 401 Unauthorized    (0 bindings)
  8.808153 10.129.34.51 -> 10.129.34.61 SIP 880 Request: REGISTER sip:ims.hom
  8.808319 10.129.34.61 -> 10.129.34.51 SIP 601 Status: 401 Unauthorized    (0 bindings)
  8.811778 10.129.34.61 -> 10.129.34.51 SIP 754 Status: 200 OK    (1 bindings)
  8.812967 10.129.34.61 -> 10.129.34.51 SIP 753 Status: 200 OK    (1 bindings)
  8.820233 10.129.34.61 -> 10.129.34.51 SIP 753 [TCP Retransmission] Status: 200 OK    (1 bindings)
  8.825087 10.129.34.61 -> 10.129.34.51 SIP 753 Status: 200 OK    (1 bindings)
  8.825807 10.129.34.51 -> 10.129.34.61 TCP 66 35927 > rlm-admin [ACK] Seq=815 Ack=688 Win=48 Len=0 TSval=62104846 TSecr=255702092
  8.828279 10.129.34.61 -> 10.129.34.51 SIP 747 [TCP Retransmission] Status: 200 OK    (1 bindings)
  8.828356 10.129.34.61 -> 10.129.34.51 TCP 66 rlm-admin > 48162 [ACK] Seq=535 Ack=1621 Win=61 Len=0 TSval=255702093 TSecr=62104836
  8.841731 10.129.34.51 -> 10.129.34.61 SIP 907 [TCP Retransmission] Request: REGISTER sip:ims.hom
  8.841788 10.129.34.61 -> 10.129.34.51 TCP 78 [TCP Dup ACK 241#1] rlm-admin > 41541 [ACK] Seq=537 Ack=842 Win=81 Len=0 TSval=255702096 TSecr=62104850 SLE=1 SRE=842
  8.845753 10.129.34.51 -> 10.129.34.61 SIP 907 [TCP Retransmission] Request: REGISTER sip:ims.hom
  8.845790 10.129.34.61 -> 10.129.34.51 TCP 78 [TCP Dup ACK 237#1] rlm-admin > 53085 [ACK] Seq=537 Ack=842 Win=63 Len=0 TSval=255702097 TSecr=62104851 SLE=1 SRE=842
  9.004145 10.129.34.61 -> 10.129.34.51 SIP 749 [TCP Retransmission] Status: 200 OK    (1 bindings)
  9.004953 10.129.34.61 -> 10.129.34.51 SIP 601 Status: 401 Unauthorized    (0 bindings)
  9.006454 10.129.34.61 -> 10.129.34.51 SIP 755 Status: 200 OK    (1 bindings)
  9.008242 10.129.34.61 -> 10.129.34.51 SIP 749 [TCP Retransmission] Status: 200 OK    (1 bindings)
  9.008255 10.129.34.61 -> 10.129.34.51 SIP 602 [TCP Retransmission] Status: 401 Unauthorized    (0 bindings)
  9.012363 10.129.34.61 -> 10.129.34.51 SIP 600 [TCP Retransmission] Status: 401 Unauthorized    (0 bindings)
  9.012383 10.129.34.61 -> 10.129.34.51 SIP 602 [TCP Retransmission] Status: 401 Unauthorized    (0 bindings)
  9.016216 10.129.34.61 -> 10.129.34.51 SIP 754 [TCP Retransmission] Status: 200 OK    (1 bindings)
  9.016317 10.129.34.61 -> 10.129.34.51 SIP 602 [TCP Retransmission] Status: 401 Unauthorized    (0 bindings)
  9.016874 10.129.34.51 -> 10.129.34.61 TCP 66 54707 > rlm-admin [ACK] Seq=816 Ack=689 Win=58 Len=0 TSval=62104893 TSecr=255702140
  9.020252 10.129.34.61 -> 10.129.34.51 SIP 601 [TCP Retransmission] Status: 401 Unauthorized    (0 bindings)
  9.020356 10.129.34.61 -> 10.129.34.51 SIP 754 [TCP Retransmission] Status: 200 OK    (1 bindings)
  9.020365 10.129.34.61 -> 10.129.34.51 SIP 753 [TCP Retransmission] Status: 200 OK    (1 bindings)
  9.020869 10.129.34.51 -> 10.129.34.61 TCP 66 35505 > rlm-admin [ACK] Seq=841 Ack=536 Win=31 Len=0 TSval=62104894 TSecr=255702141
  9.021742 10.129.34.51 -> 10.129.34.61 SIP 881 [TCP Retransmission] Request: REGISTER sip:ims.hom
  9.021801 10.129.34.61 -> 10.129.34.51 TCP 78 [TCP Dup ACK 204#1] rlm-admin > 48667 [ACK] Seq=1072 Ack=2464 Win=19968 Len=0 TSval=255702141 TSecr=62104895 SLE=1649 SRE=2464
  9.029486 10.129.34.61 -> 10.129.34.51 SIP 755 Status: 200 OK    (1 bindings)
  9.033912 10.129.34.51 -> 10.129.34.61 SIP 881 Request: REGISTER sip:ims.hom
  9.033946 10.129.34.61 -> 10.129.34.51 TCP 66 rlm-admin > 36624 [ACK] Seq=1373 Ack=2442 Win=66 Len=0 TSval=255702144 TSecr=62104898
  9.037906 10.129.34.51 -> 10.129.34.61 SIP 880 [TCP Retransmission] Request: REGISTER sip:ims.hom
  9.037936 10.129.34.61 -> 10.129.34.51 TCP 78 [TCP Dup ACK 243#1] rlm-admin > 48569 [ACK] Seq=1068 Ack=2490 Win=39 Len=0 TSval=255702145 TSecr=62104899 SLE=1676 SRE=2490
  9.065850 10.129.34.51 -> 10.129.34.61 SIP 880 [TCP Retransmission] Request: REGISTER sip:ims.hom
  9.065877 10.129.34.61 -> 10.129.34.51 TCP 78 [TCP Dup ACK 149#2] rlm-admin > 53168 [ACK] Seq=1221 Ack=2465 Win=64 Len=0 TSval=255702152 TSecr=62104906 SLE=1651 SRE=2465
  9.069845 10.129.34.51 -> 10.129.34.61 TCP 66 47494 > rlm-admin [ACK] Seq=1657 Ack=1225 Win=76 Len=0 TSval=62104907 TSecr=255702143
  9.141958 10.129.34.51 -> 10.129.34.61 SIP 881 [TCP Retransmission] Request: REGISTER sip:ims.hom
  9.141989 10.129.34.61 -> 10.129.34.51 TCP 78 [TCP Dup ACK 269#1] rlm-admin > 37243 [ACK] Seq=689 Ack=816 Win=51 Len=0 TSval=255702171 TSecr=62104925 SLE=1 SRE=816
  9.161786 10.129.34.51 -> 10.129.34.61 SIP 877 [TCP Retransmission] Request: REGISTER sip:ims.hom
  9.161815 10.129.34.61 -> 10.129.34.51 TCP 78 [TCP Dup ACK 151#2] rlm-admin > 54167 [ACK] Seq=1 Ack=812 Win=60 Len=0 TSval=255702176 TSecr=62104930 SLE=1 SRE=812
  9.185907 10.129.34.51 -> 10.129.34.61 SIP 881 [TCP Retransmission] Request: REGISTER sip:ims.hom
  9.185937 10.129.34.61 -> 10.129.34.51 TCP 78 [TCP Dup ACK 140#1] rlm-admin > 59472 [ACK] Seq=1224 Ack=2438 Win=60 Len=0 TSval=255702182 TSecr=62104936 SLE=1623 SRE=2438
  9.186630 10.129.34.51 -> 10.129.34.61 SIP 872 Request: REGISTER sip:ims.hom
  9.186659 10.129.34.61 -> 10.129.34.51 TCP 66 rlm-admin > 59472 [ACK] Seq=1224 Ack=3244 Win=63 Len=0 TSval=255702182 TSecr=62104936
  9.192719 10.129.34.61 -> 10.129.34.51 SIP 600 Status: 401 Unauthorized    (0 bindings)
  9.208734 10.129.34.51 -> 10.129.34.61 SIP 848 Request: REGISTER sip:ims.hom
  9.212274 10.129.34.61 -> 10.129.34.51 SIP 601 [TCP Retransmission] Status: 401 Unauthorized    (0 bindings)
  9.216354 10.129.34.61 -> 10.129.34.51 SIP 755 [TCP Retransmission] Status: 200 OK    (1 bindings)
  9.216593 10.129.34.61 -> 10.129.34.51 SIP 479 Status: 403 Forbidden    (0 bindings)
  9.216918 10.129.34.51 -> 10.129.34.61 TCP 66 40727 > rlm-admin [ACK] Seq=1656 Ack=1224 Win=75 Len=0 TSval=62104943 TSecr=255702190
  9.216937 10.129.34.51 -> 10.129.34.61 TCP 66 47675 > rlm-admin [ACK] Seq=841 Ack=414 Win=53 Len=0 TSval=62104943 TSecr=255702190
  9.219817 10.129.34.61 -> 10.129.34.51 SIP 754 Status: 200 OK    (1 bindings)
  9.220435 10.129.34.51 -> 10.129.34.61 TCP 66 53948 > rlm-admin [ACK] Seq=783 Ack=689 Win=44 Len=0 TSval=62104944 TSecr=255702190
  9.229731 10.129.34.51 -> 10.129.34.61 SIP 874 [TCP Retransmission] Request: REGISTER sip:ims.hom
  9.229759 10.129.34.61 -> 10.129.34.51 TCP 78 [TCP Dup ACK 252#1] rlm-admin > 45641 [ACK] Seq=1216 Ack=2486 Win=51 Len=0 TSval=255702193 TSecr=62104947 SLE=1678 SRE=2486
  9.229875 10.129.34.51 -> 10.129.34.61 TCP 66 59472 > rlm-admin [ACK] Seq=3244 Ack=1758 Win=56 Len=0 TSval=62104947 TSecr=255702184
  9.230223 10.129.34.51 -> 10.129.34.61 SIP 881 Request: REGISTER sip:ims.hom
  9.230250 10.129.34.61 -> 10.129.34.51 TCP 66 rlm-admin > 45641 [ACK] Seq=1216 Ack=3301 Win=55 Len=0 TSval=255702193 TSecr=62104947
  9.230731 10.129.34.51 -> 10.129.34.61 SIP 880 Request: REGISTER sip:ims.hom
  9.230751 10.129.34.61 -> 10.129.34.51 TCP 66 rlm-admin > 54707 [ACK] Seq=689 Ack=1630 Win=67 Len=0 TSval=255702193 TSecr=62104947
  9.236346 10.129.34.61 -> 10.129.34.51 SIP 753 [TCP Retransmission] Status: 200 OK    (1 bindings)
  9.244224 10.129.34.61 -> 10.129.34.51 SIP 747 [TCP Retransmission] Status: 200 OK    (1 bindings)
  9.249986 10.129.34.51 -> 10.129.34.61 TCP 66 43239 > rlm-admin [ACK] Seq=1681 Ack=1071 Win=54 Len=0 TSval=62104952 TSecr=255702189
  9.273816 10.129.34.51 -> 10.129.34.61 SIP 847 [TCP Retransmission] Request: REGISTER sip:ims.hom
  9.273846 10.129.34.61 -> 10.129.34.51 TCP 78 [TCP Dup ACK 253#1] rlm-admin > 48162 [ACK] Seq=535 Ack=1621 Win=61 Len=0 TSval=255702204 TSecr=62104958 SLE=840 SRE=1621
  9.281882 10.129.34.51 -> 10.129.34.61 SIP 907 [TCP Retransmission] Request: REGISTER sip:ims.hom
  9.281916 10.129.34.61 -> 10.129.34.51 TCP 78 [TCP Dup ACK 266#1] rlm-admin > 36349 [ACK] Seq=1072 Ack=1682 Win=61 Len=0 TSval=255702206 TSecr=62104960 SLE=841 SRE=1682
  9.281991 10.129.34.51 -> 10.129.34.61 TCP 66 45641 > rlm-admin [ACK] Seq=3301 Ack=1216 Win=42 Len=0 TSval=62104960 TSecr=255702197
  9.282557 10.129.34.51 -> 10.129.34.61 SIP 907 Request: REGISTER sip:ims.hom
  9.282585 10.129.34.61 -> 10.129.34.51 TCP 66 rlm-admin > 36349 [ACK] Seq=1072 Ack=2523 Win=64 Len=0 TSval=255702206 TSecr=62104960
  9.424299 10.129.34.61 -> 10.129.34.51 SIP 602 [TCP Retransmission] Status: 401 Unauthorized    (0 bindings)
  9.425067 10.129.34.51 -> 10.129.34.61 TCP 66 53085 > rlm-admin [ACK] Seq=842 Ack=537 Win=58 Len=0 TSval=62104995 TSecr=255702242
  9.428414 10.129.34.61 -> 10.129.34.51 SIP 602 [TCP Retransmission] Status: 401 Unauthorized    (0 bindings)
  9.436279 10.129.34.61 -> 10.129.34.51 SIP 600 [TCP Retransmission] Status: 401 Unauthorized    (0 bindings)
  9.436390 10.129.34.61 -> 10.129.34.51 SIP 754 [TCP Retransmission] Status: 200 OK    (1 bindings)
  9.436400 10.129.34.61 -> 10.129.34.51 SIP 753 [TCP Retransmission] Status: 200 OK    (1 bindings)
  9.436967 10.129.34.51 -> 10.129.34.61 TCP 66 59051 > rlm-admin [ACK] Seq=2462 Ack=1758 Win=18432 Len=0 TSval=62104998 TSecr=255702245
  9.438467 10.129.34.51 -> 10.129.34.61 SIP 880 Request: REGISTER sip:ims.hom
  9.438501 10.129.34.61 -> 10.129.34.51 TCP 66 rlm-admin > 41836 [ACK] Seq=1 Ack=815 Win=32 Len=0 TSval=255702245 TSecr=62104999
  9.440151 10.129.34.61 -> 10.129.34.51 SIP 602 [TCP Retransmission] Status: 401 Unauthorized    (0 bindings)
  9.449162 10.129.34.51 -> 10.129.34.61 SIP 880 Request: REGISTER sip:ims.hom
  9.449204 10.129.34.61 -> 10.129.34.51 TCP 66 rlm-admin > 40727 [ACK] Seq=1224 Ack=2470 Win=82 Len=0 TSval=255702248 TSecr=62105001
  9.452678 10.129.34.61 -> 10.129.34.51 SIP 753 Status: 200 OK    (1 bindings)
  9.473968 10.129.34.51 -> 10.129.34.61 SIP 880 [TCP Retransmission] Request: REGISTER sip:ims.hom
  9.474025 10.129.34.61 -> 10.129.34.51 TCP 78 [TCP Dup ACK 328#1] rlm-admin > 54707 [ACK] Seq=1376 Ack=1630 Win=67 Len=0 TSval=255702254 TSecr=62105008 SLE=816 SRE=1630
  9.501885 10.129.34.51 -> 10.129.34.61 SIP 880 [TCP Retransmission] Request: REGISTER sip:ims.hom
  9.501915 10.129.34.61 -> 10.129.34.51 TCP 78 [TCP Dup ACK 243#2] rlm-admin > 48569 [ACK] Seq=1068 Ack=2490 Win=39 Len=0 TSval=255702261 TSecr=62105015 SLE=1676 SRE=2490
  9.544222 10.129.34.51 -> 10.129.34.61 SIP 907 Request: REGISTER sip:ims.hom
  9.544922 10.129.34.51 -> 10.129.34.61 SIP 905 Request: REGISTER sip:ims.hom
  9.544955 10.129.34.61 -> 10.129.34.51 TCP 66 rlm-admin > 47494 [ACK] Seq=1225 Ack=2496 Win=82 Len=0 TSval=255702272 TSecr=62105025
  9.545824 10.129.34.51 -> 10.129.34.61 SIP 907 Request: REGISTER sip:ims.hom
  9.545855 10.129.34.61 -> 10.129.34.51 TCP 66 rlm-admin > 60181 [ACK] Seq=689 Ack=1624 Win=57 Len=0 TSval=255702272 TSecr=62105026
  9.546529 10.129.34.51 -> 10.129.34.61 SIP 907 Request: REGISTER sip:ims.hom
  9.546549 10.129.34.61 -> 10.129.34.51 TCP 66 rlm-admin > 35505 [ACK] Seq=536 Ack=1682 Win=35 Len=0 TSval=255702272 TSecr=62105026
  9.547202 10.129.34.51 -> 10.129.34.61 SIP 906 Request: REGISTER sip:ims.hom
  9.547808 10.129.34.51 -> 10.129.34.61 SIP 875 Request: REGISTER sip:ims.hom
  9.547827 10.129.34.61 -> 10.129.34.51 TCP 66 rlm-admin > 54707 [ACK] Seq=1376 Ack=2439 Win=70 Len=0 TSval=255702272 TSecr=62105026
  9.548481 10.129.34.51 -> 10.129.34.61 SIP 873 Request: REGISTER sip:ims.hom
  9.548497 10.129.34.61 -> 10.129.34.51 TCP 66 rlm-admin > 40727 [ACK] Seq=1224 Ack=3277 Win=81 Len=0 TSval=255702273 TSecr=62105026
  9.550159 10.129.34.51 -> 10.129.34.61 SIP 872 Request: REGISTER sip:ims.hom
  9.550186 10.129.34.61 -> 10.129.34.51 TCP 66 rlm-admin > 45187 [ACK] Seq=534 Ack=2457 Win=81 Len=0 TSval=255702273 TSecr=62105026
  9.550194 10.129.34.51 -> 10.129.34.61 SIP 906 Request: REGISTER sip:ims.hom
  9.550898 10.129.34.51 -> 10.129.34.61 SIP 906 Request: REGISTER sip:ims.hom
  9.550923 10.129.34.61 -> 10.129.34.51 TCP 66 rlm-admin > 40727 [ACK] Seq=1224 Ack=4117 Win=80 Len=0 TSval=255702273 TSecr=62105027
  9.551675 10.129.34.51 -> 10.129.34.61 SIP 906 Request: REGISTER sip:ims.hom
  9.551694 10.129.34.61 -> 10.129.34.51 TCP 66 rlm-admin > 35505 [ACK] Seq=536 Ack=2522 Win=39 Len=0 TSval=255702273 TSecr=62105027
  9.552241 10.129.34.51 -> 10.129.34.61 SIP 907 Request: REGISTER sip:ims.hom
  9.552263 10.129.34.61 -> 10.129.34.51 TCP 66 rlm-admin > 34491 [ACK] Seq=536 Ack=1680 Win=57 Len=0 TSval=255702274 TSecr=62105027
  9.552729 10.129.34.51 -> 10.129.34.61 SIP 907 Request: REGISTER sip:ims.hom
  9.552746 10.129.34.61 -> 10.129.34.51 TCP 66 rlm-admin > 53085 [ACK] Seq=537 Ack=1683 Win=67 Len=0 TSval=255702274 TSecr=62105027
  9.553473 10.129.34.51 -> 10.129.34.61 SIP 907 Request: REGISTER sip:ims.hom
  9.553497 10.129.34.61 -> 10.129.34.51 TCP 66 rlm-admin > 47494 [ACK] Seq=1225 Ack=3337 Win=81 Len=0 TSval=255702274 TSecr=62105027
  9.554064 10.129.34.51 -> 10.129.34.61 SIP 873 Request: REGISTER sip:ims.hom
  9.554595 10.129.34.61 -> 10.129.34.51 SIP 602 Status: 401 Unauthorized    (0 bindings)
  9.554711 10.129.34.51 -> 10.129.34.61 SIP 908 Request: REGISTER sip:ims.hom
  9.555645 10.129.34.61 -> 10.129.34.51 TCP 66 rlm-admin > 34491 [ACK] Seq=536 Ack=2522 Win=61 Len=0 TSval=255702274 TSecr=62105028
  9.555852 10.129.34.51 -> 10.129.34.61 SIP 872 Request: REGISTER sip:ims.hom
  9.555874 10.129.34.61 -> 10.129.34.51 TCP 66 rlm-admin > 54167 [ACK] Seq=1 Ack=1618 Win=64 Len=0 TSval=255702274 TSecr=62105028
  9.556324 10.129.34.51 -> 10.129.34.61 SIP 873 Request: REGISTER sip:ims.hom
  9.556455 10.129.34.61 -> 10.129.34.51 TCP 66 rlm-admin > 60181 [ACK] Seq=689 Ack=2431 Win=61 Len=0 TSval=255702275 TSecr=62105028
  9.556859 10.129.34.51 -> 10.129.34.61 SIP 874 Request: REGISTER sip:ims.hom
  9.556880 10.129.34.61 -> 10.129.34.51 TCP 66 rlm-admin > 45187 [ACK] Seq=534 Ack=3265 Win=80 Len=0 TSval=255702275 TSecr=62105028
