  0.000000 10.129.34.51 -> 10.129.34.61 SIP 901 Request: REGISTER sip:ims.hom
  0.001518 10.129.34.51 -> 10.129.34.61 SIP 901 Request: REGISTER sip:ims.hom
  0.002004 10.129.34.51 -> 10.129.34.61 SIP 902 Request: REGISTER sip:ims.hom
  0.005940 10.129.34.51 -> 10.129.34.61 SIP 903 Request: REGISTER sip:ims.hom
  0.007464 10.129.34.51 -> 10.129.34.61 SIP 903 Request: REGISTER sip:ims.hom
  0.007505 10.129.34.61 -> 10.129.34.51 TCP 66 rlm-admin > 48324 [ACK] Seq=1 Ack=838 Win=32 Len=0 TSval=255737748 TSecr=62140502
  0.009150 10.129.34.51 -> 10.129.34.61 SIP 904 Request: REGISTER sip:ims.hom
  0.009273 10.129.34.51 -> 10.129.34.61 SIP 901 Request: REGISTER sip:ims.hom
  0.009949 10.129.34.51 -> 10.129.34.61 SIP 904 Request: REGISTER sip:ims.hom
  0.010897 10.129.34.51 -> 10.129.34.61 SIP 906 Request: REGISTER sip:ims.hom
  0.010934 10.129.34.61 -> 10.129.34.51 TCP 66 rlm-admin > 48324 [ACK] Seq=1 Ack=1678 Win=35 Len=0 TSval=255737749 TSecr=62140503
  0.011838 10.129.34.51 -> 10.129.34.61 SIP 906 Request: REGISTER sip:ims.hom
  0.011868 10.129.34.61 -> 10.129.34.51 TCP 66 rlm-admin > 35822 [ACK] Seq=1 Ack=841 Win=32 Len=0 TSval=255737750 TSecr=62140503
  0.012642 10.129.34.51 -> 10.129.34.61 SIP 906 Request: REGISTER sip:ims.hom
  0.013706 10.129.34.51 -> 10.129.34.61 SIP 906 Request: REGISTER sip:ims.hom
  0.013735 10.129.34.61 -> 10.129.34.51 TCP 66 rlm-admin > 35505 [ACK] Seq=1 Ack=841 Win=81 Len=0 TSval=255737750 TSecr=62140504
  0.014717 10.129.34.51 -> 10.129.34.61 SIP 874 Request: REGISTER sip:ims.hom
  0.015391 10.129.34.51 -> 10.129.34.61 SIP 907 Request: REGISTER sip:ims.hom
  0.016256 10.129.34.51 -> 10.129.34.61 SIP 906 Request: REGISTER sip:ims.hom
  0.017136 10.129.34.51 -> 10.129.34.61 SIP 907 Request: REGISTER sip:ims.hom
  0.017159 10.129.34.61 -> 10.129.34.51 TCP 66 rlm-admin > 35822 [ACK] Seq=1 Ack=1682 Win=35 Len=0 TSval=255737751 TSecr=62140504
  0.017961 10.129.34.51 -> 10.129.34.61 SIP 906 Request: REGISTER sip:ims.hom
  0.018375 10.129.34.51 -> 10.129.34.61 SIP 908 Request: REGISTER sip:ims.hom
  0.018395 10.129.34.61 -> 10.129.34.51 TCP 66 rlm-admin > 35822 [ACK] Seq=1 Ack=2524 Win=39 Len=0 TSval=255737751 TSecr=62140505
  0.019024 10.129.34.51 -> 10.129.34.61 SIP 906 Request: REGISTER sip:ims.hom
  0.020024 10.129.34.51 -> 10.129.34.61 SIP 1514 Request: REGISTER sip:ims.hom
  0.020046 10.129.34.61 -> 10.129.34.51 TCP 66 rlm-admin > 40502 [ACK] Seq=1 Ack=2287 Win=75 Len=0 TSval=255737752 TSecr=62140503
  0.020382 10.129.34.51 -> 10.129.34.61 SIP 301 Request: REGISTER sip:ims.hom
  0.020733 10.129.34.51 -> 10.129.34.61 SIP 906 Request: REGISTER sip:ims.hom
  0.020754 10.129.34.61 -> 10.129.34.51 TCP 66 rlm-admin > 48725 [ACK] Seq=1 Ack=841 Win=32 Len=0 TSval=255737752 TSecr=62140505
  0.022007 10.129.34.51 -> 10.129.34.61 SIP 907 Request: REGISTER sip:ims.hom
  0.022035 10.129.34.61 -> 10.129.34.51 TCP 66 rlm-admin > 48725 [ACK] Seq=1 Ack=1682 Win=35 Len=0 TSval=255737752 TSecr=62140506
  0.023449 10.129.34.51 -> 10.129.34.61 SIP 906 Request: REGISTER sip:ims.hom
  0.023473 10.129.34.51 -> 10.129.34.61 SIP 906 Request: REGISTER sip:ims.hom
  0.039822 10.129.34.61 -> 10.129.34.51 TCP 66 rlm-admin > 55862 [ACK] Seq=1 Ack=836 Win=83 Len=0 TSval=255737757 TSecr=62140500
  0.039905 10.129.34.61 -> 10.129.34.51 TCP 66 rlm-admin > 43239 [ACK] Seq=1 Ack=836 Win=83 Len=0 TSval=255737757 TSecr=62140500
  0.039913 10.129.34.61 -> 10.129.34.51 TCP 66 rlm-admin > 44657 [ACK] Seq=1 Ack=837 Win=82 Len=0 TSval=255737757 TSecr=62140501
  0.040536 10.129.34.51 -> 10.129.34.61 SIP 907 Request: REGISTER sip:ims.hom
  0.040567 10.129.34.61 -> 10.129.34.51 TCP 66 rlm-admin > 55862 [ACK] Seq=1 Ack=1677 Win=82 Len=0 TSval=255737757 TSecr=62140510
  0.040677 10.129.34.51 -> 10.129.34.61 SIP 903 Request: REGISTER sip:ims.hom
  0.040686 10.129.34.61 -> 10.129.34.51 TCP 66 rlm-admin > 44657 [ACK] Seq=1 Ack=1674 Win=81 Len=0 TSval=255737757 TSecr=62140510
  0.043882 10.129.34.61 -> 10.129.34.51 TCP 66 rlm-admin > 48667 [ACK] Seq=1 Ack=838 Win=68 Len=0 TSval=255737758 TSecr=62140502
  0.047987 10.129.34.61 -> 10.129.34.51 TCP 66 rlm-admin > 54707 [ACK] Seq=1 Ack=839 Win=82 Len=0 TSval=255737759 TSecr=62140502
  0.048074 10.129.34.61 -> 10.129.34.51 TCP 66 rlm-admin > 49048 [ACK] Seq=1 Ack=836 Win=61 Len=0 TSval=255737759 TSecr=62140502
  0.048759 10.129.34.51 -> 10.129.34.61 SIP 906 Request: REGISTER sip:ims.hom
  0.048795 10.129.34.61 -> 10.129.34.51 TCP 66 rlm-admin > 49048 [ACK] Seq=1 Ack=1676 Win=65 Len=0 TSval=255737759 TSecr=62140512
  0.051825 10.129.34.61 -> 10.129.34.51 TCP 66 rlm-admin > 55525 [ACK] Seq=1 Ack=841 Win=81 Len=0 TSval=255737760 TSecr=62140503
  0.052405 10.129.34.61 -> 10.129.34.51 TCP 66 rlm-admin > 38927 [ACK] Seq=1 Ack=809 Win=55 Len=0 TSval=255737760 TSecr=62140504
  0.052417 10.129.34.61 -> 10.129.34.51 TCP 66 rlm-admin > 48162 [ACK] Seq=1 Ack=842 Win=82 Len=0 TSval=255737760 TSecr=62140504
  0.053094 10.129.34.51 -> 10.129.34.61 SIP 907 Request: REGISTER sip:ims.hom
  0.053122 10.129.34.61 -> 10.129.34.51 TCP 66 rlm-admin > 55525 [ACK] Seq=1 Ack=1682 Win=80 Len=0 TSval=255737760 TSecr=62140513
  0.055807 10.129.34.61 -> 10.129.34.51 TCP 66 rlm-admin > 37243 [ACK] Seq=1 Ack=841 Win=81 Len=0 TSval=255737761 TSecr=62140504
  0.056349 10.129.34.61 -> 10.129.34.51 TCP 66 rlm-admin > 51496 [ACK] Seq=1 Ack=841 Win=77 Len=0 TSval=255737761 TSecr=62140505
  0.056359 10.129.34.61 -> 10.129.34.51 TCP 66 rlm-admin > 35927 [ACK] Seq=1 Ack=841 Win=82 Len=0 TSval=255737761 TSecr=62140505
  0.059811 10.129.34.61 -> 10.129.34.51 TCP 66 rlm-admin > 40502 [ACK] Seq=1 Ack=2522 Win=75 Len=0 TSval=255737762 TSecr=62140505
  0.059895 10.129.34.61 -> 10.129.34.51 TCP 66 rlm-admin > 38168 [ACK] Seq=1 Ack=841 Win=77 Len=0 TSval=255737762 TSecr=62140506
  0.059902 10.129.34.61 -> 10.129.34.51 TCP 66 rlm-admin > 59051 [ACK] Seq=1 Ack=841 Win=74 Len=0 TSval=255737762 TSecr=62140506
  0.060508 10.129.34.51 -> 10.129.34.61 SIP 908 Request: REGISTER sip:ims.hom
  0.060535 10.129.34.61 -> 10.129.34.51 TCP 66 rlm-admin > 40502 [ACK] Seq=1 Ack=3364 Win=74 Len=0 TSval=255737762 TSecr=62140515
  0.184995 10.129.34.61 -> 10.129.34.51 SIP 505 Status: 503 Service Unavailable    (0 bindings)
  0.185592 10.129.34.51 -> 10.129.34.61 TCP 66 48725 > rlm-admin [ACK] Seq=1682 Ack=440 Win=31 Len=0 TSval=62140547 TSecr=255737793
  0.186196 10.129.34.61 -> 10.129.34.51 SIP 506 Status: 503 Service Unavailable    (0 bindings)
  0.186534 10.129.34.61 -> 10.129.34.51 SIP 505 Status: 503 Service Unavailable    (0 bindings)
  0.186756 10.129.34.51 -> 10.129.34.61 TCP 66 48725 > rlm-admin [ACK] Seq=1682 Ack=880 Win=33 Len=0 TSval=62140547 TSecr=255737793
  0.187037 10.129.34.61 -> 10.129.34.51 SIP 505 Status: 503 Service Unavailable    (0 bindings)
  0.187109 10.129.34.51 -> 10.129.34.61 TCP 66 38168 > rlm-admin [ACK] Seq=841 Ack=440 Win=68 Len=0 TSval=62140547 TSecr=255737793
  0.187417 10.129.34.61 -> 10.129.34.51 SIP 506 Status: 503 Service Unavailable    (0 bindings)
  0.187478 10.129.34.51 -> 10.129.34.61 TCP 66 59051 > rlm-admin [ACK] Seq=841 Ack=440 Win=78 Len=0 TSval=62140547 TSecr=255737793
  0.187815 10.129.34.51 -> 10.129.34.61 TCP 66 55862 > rlm-admin [ACK] Seq=1677 Ack=441 Win=83 Len=0 TSval=62140547 TSecr=255737793
  0.505953 10.129.34.61 -> 10.129.34.51 SIP 598 Status: 401 Unauthorized    (0 bindings)
  0.506587 10.129.34.51 -> 10.129.34.61 TCP 66 55862 > rlm-admin [ACK] Seq=1677 Ack=973 Win=82 Len=0 TSval=62140627 TSecr=255737873
  0.512548 10.129.34.61 -> 10.129.34.51 SIP 603 Status: 401 Unauthorized    (0 bindings)
  0.513586 10.129.34.51 -> 10.129.34.61 TCP 66 40502 > rlm-admin [ACK] Seq=3364 Ack=538 Win=63 Len=0 TSval=62140629 TSecr=255737875
  0.514075 10.129.34.61 -> 10.129.34.51 SIP 601 Status: 401 Unauthorized    (0 bindings)
  0.514530 10.129.34.51 -> 10.129.34.61 TCP 66 49048 > rlm-admin [ACK] Seq=1676 Ack=536 Win=55 Len=0 TSval=62140629 TSecr=255737875
  0.528867 10.129.34.51 -> 10.129.34.61 SIP 877 Request: REGISTER sip:ims.hom
  0.528908 10.129.34.61 -> 10.129.34.51 TCP 66 rlm-admin > 53558 [ACK] Seq=1 Ack=812 Win=32 Len=0 TSval=255737879 TSecr=62140632
  0.529623 10.129.34.51 -> 10.129.34.61 SIP 881 Request: REGISTER sip:ims.hom
  0.529644 10.129.34.61 -> 10.129.34.51 TCP 66 rlm-admin > 35505 [ACK] Seq=1 Ack=1656 Win=81 Len=0 TSval=255737879 TSecr=62140633
  0.531004 10.129.34.51 -> 10.129.34.61 SIP 880 Request: REGISTER sip:ims.hom
  0.567968 10.129.34.61 -> 10.129.34.51 TCP 66 rlm-admin > 45641 [ACK] Seq=1 Ack=815 Win=81 Len=0 TSval=255737889 TSecr=62140633
  0.595147 10.129.34.61 -> 10.129.34.51 SIP 601 Status: 401 Unauthorized    (0 bindings)
  0.595762 10.129.34.51 -> 10.129.34.61 TCP 66 54707 > rlm-admin [ACK] Seq=839 Ack=536 Win=82 Len=0 TSval=62140649 TSecr=255737895
  0.596250 10.129.34.61 -> 10.129.34.51 SIP 600 Status: 401 Unauthorized    (0 bindings)
  0.596752 10.129.34.51 -> 10.129.34.61 TCP 66 48324 > rlm-admin [ACK] Seq=1678 Ack=535 Win=31 Len=0 TSval=62140649 TSecr=255737896
  0.597739 10.129.34.61 -> 10.129.34.51 SIP 600 Status: 401 Unauthorized    (0 bindings)
  0.598308 10.129.34.51 -> 10.129.34.61 TCP 66 48667 > rlm-admin [ACK] Seq=838 Ack=535 Win=60 Len=0 TSval=62140650 TSecr=255737896
  0.598466 10.129.34.61 -> 10.129.34.51 SIP 598 Status: 401 Unauthorized    (0 bindings)
  0.598678 10.129.34.61 -> 10.129.34.51 SIP 601 Status: 401 Unauthorized    (0 bindings)
  0.598980 10.129.34.51 -> 10.129.34.61 TCP 66 49048 > rlm-admin [ACK] Seq=1676 Ack=1068 Win=58 Len=0 TSval=62140650 TSecr=255737896
  0.599024 10.129.34.51 -> 10.129.34.61 TCP 66 48324 > rlm-admin [ACK] Seq=1678 Ack=1070 Win=33 Len=0 TSval=62140650 TSecr=255737896
  0.612411 10.129.34.51 -> 10.129.34.61 SIP 876 Request: REGISTER sip:ims.hom
  0.613003 10.129.34.51 -> 10.129.34.61 SIP 875 Request: REGISTER sip:ims.hom
  0.613027 10.129.34.61 -> 10.129.34.51 TCP 66 rlm-admin > 43239 [ACK] Seq=1 Ack=1645 Win=82 Len=0 TSval=255737900 TSecr=62140653
  0.613984 10.129.34.51 -> 10.129.34.61 SIP 880 Request: REGISTER sip:ims.hom
  0.614008 10.129.34.61 -> 10.129.34.51 TCP 66 rlm-admin > 48725 [ACK] Seq=880 Ack=2496 Win=39 Len=0 TSval=255737900 TSecr=62140654
  0.614789 10.129.34.51 -> 10.129.34.61 SIP 877 Request: REGISTER sip:ims.hom
  0.615394 10.129.34.51 -> 10.129.34.61 SIP 878 Request: REGISTER sip:ims.hom
  0.618814 10.129.34.61 -> 10.129.34.51 SIP 602 Status: 401 Unauthorized    (0 bindings)
  0.619381 10.129.34.51 -> 10.129.34.61 TCP 66 35822 > rlm-admin [ACK] Seq=2524 Ack=537 Win=31 Len=0 TSval=62140655 TSecr=255737901
  0.633353 10.129.34.51 -> 10.129.34.61 SIP 878 Request: REGISTER sip:ims.hom
  0.651987 10.129.34.61 -> 10.129.34.51 TCP 66 rlm-admin > 49736 [ACK] Seq=1 Ack=811 Win=65 Len=0 TSval=255737910 TSecr=62140653
  0.652079 10.129.34.61 -> 10.129.34.51 TCP 66 rlm-admin > 53948 [ACK] Seq=1 Ack=812 Win=81 Len=0 TSval=255737910 TSecr=62140654
  0.652087 10.129.34.61 -> 10.129.34.51 TCP 66 rlm-admin > 35823 [ACK] Seq=1 Ack=813 Win=83 Len=0 TSval=255737910 TSecr=62140654
  0.671877 10.129.34.61 -> 10.129.34.51 TCP 66 rlm-admin > 53085 [ACK] Seq=1 Ack=813 Win=83 Len=0 TSval=255737915 TSecr=62140658
  0.679384 10.129.34.61 -> 10.129.34.51 SIP 601 Status: 401 Unauthorized    (0 bindings)
  0.679866 10.129.34.51 -> 10.129.34.61 TCP 66 51496 > rlm-admin [ACK] Seq=841 Ack=536 Win=68 Len=0 TSval=62140670 TSecr=255737916
  0.682235 10.129.34.61 -> 10.129.34.51 SIP 602 Status: 401 Unauthorized    (0 bindings)
  0.682654 10.129.34.61 -> 10.129.34.51 SIP 601 Status: 401 Unauthorized    (0 bindings)
  0.682684 10.129.34.51 -> 10.129.34.61 TCP 66 38927 > rlm-admin [ACK] Seq=809 Ack=537 Win=46 Len=0 TSval=62140671 TSecr=255737917
  0.683078 10.129.34.51 -> 10.129.34.61 TCP 66 55525 > rlm-admin [ACK] Seq=1682 Ack=536 Win=82 Len=0 TSval=62140671 TSecr=255737917
  0.695877 10.129.34.51 -> 10.129.34.61 SIP 881 Request: REGISTER sip:ims.hom
  0.696706 10.129.34.51 -> 10.129.34.61 SIP 848 Request: REGISTER sip:ims.hom
  0.696732 10.129.34.61 -> 10.129.34.51 TCP 66 rlm-admin > 48725 [ACK] Seq=880 Ack=3278 Win=42 Len=0 TSval=255737921 TSecr=62140674
  0.697569 10.129.34.51 -> 10.129.34.61 SIP 882 Request: REGISTER sip:ims.hom
  0.704691 10.129.34.61 -> 10.129.34.51 SIP 598 Status: 401 Unauthorized    (0 bindings)
  0.705232 10.129.34.51 -> 10.129.34.61 TCP 66 43239 > rlm-admin [ACK] Seq=1645 Ack=533 Win=82 Len=0 TSval=62140676 TSecr=255737923
  0.706272 10.129.34.61 -> 10.129.34.51 SIP 599 Status: 401 Unauthorized    (0 bindings)
  0.706882 10.129.34.51 -> 10.129.34.61 TCP 66 44657 > rlm-admin [ACK] Seq=1674 Ack=534 Win=82 Len=0 TSval=62140677 TSecr=255737923
  0.707294 10.129.34.61 -> 10.129.34.51 SIP 602 Status: 401 Unauthorized    (0 bindings)
  0.707680 10.129.34.51 -> 10.129.34.61 TCP 66 48162 > rlm-admin [ACK] Seq=842 Ack=537 Win=78 Len=0 TSval=62140677 TSecr=255737923
  0.717948 10.129.34.51 -> 10.129.34.61 SIP 875 Request: REGISTER sip:ims.hom
  0.717987 10.129.34.61 -> 10.129.34.51 TCP 66 rlm-admin > 35881 [ACK] Seq=1 Ack=810 Win=32 Len=0 TSval=255737926 TSecr=62140680
  0.728254 10.129.34.51 -> 10.129.34.61 SIP 876 Request: REGISTER sip:ims.hom
  0.728296 10.129.34.61 -> 10.129.34.51 TCP 66 rlm-admin > 35822 [ACK] Seq=537 Ack=3334 Win=42 Len=0 TSval=255737929 TSecr=62140682
  0.728914 10.129.34.51 -> 10.129.34.61 SIP 881 Request: REGISTER sip:ims.hom
  0.728934 10.129.34.61 -> 10.129.34.51 TCP 66 rlm-admin > 56476 [ACK] Seq=1 Ack=816 Win=32 Len=0 TSval=255737929 TSecr=62140682
  0.735924 10.129.34.61 -> 10.129.34.51 TCP 66 rlm-admin > 35180 [ACK] Seq=1 Ack=816 Win=83 Len=0 TSval=255737931 TSecr=62140674
  0.735990 10.129.34.61 -> 10.129.34.51 TCP 66 rlm-admin > 48540 [ACK] Seq=1 Ack=817 Win=83 Len=0 TSval=255737931 TSecr=62140675
  0.770274 10.129.34.61 -> 10.129.34.51 SIP 601 Status: 401 Unauthorized    (0 bindings)
  0.770472 10.129.34.61 -> 10.129.34.51 SIP 601 Status: 401 Unauthorized    (0 bindings)
  0.770635 10.129.34.61 -> 10.129.34.51 SIP 601 Status: 401 Unauthorized    (0 bindings)
  0.771088 10.129.34.51 -> 10.129.34.61 TCP 66 37243 > rlm-admin [ACK] Seq=841 Ack=536 Win=74 Len=0 TSval=62140693 TSecr=255737939
  0.771105 10.129.34.51 -> 10.129.34.61 TCP 66 35822 > rlm-admin [ACK] Seq=3334 Ack=1072 Win=33 Len=0 TSval=62140693 TSecr=255737939
  0.774511 10.129.34.61 -> 10.129.34.51 SIP 603 Status: 401 Unauthorized    (0 bindings)
  0.778079 10.129.34.61 -> 10.129.34.51 SIP 753 Status: 200 OK    (1 bindings)
  0.778753 10.129.34.61 -> 10.129.34.51 SIP 751 Status: 200 OK    (1 bindings)
  0.779180 10.129.34.61 -> 10.129.34.51 SIP 751 Status: 200 OK    (1 bindings)
  0.779424 10.129.34.61 -> 10.129.34.51 SIP 750 Status: 200 OK    (1 bindings)
  0.781732 10.129.34.61 -> 10.129.34.51 SIP 748 Status: 200 OK    (1 bindings)
  0.783000 10.129.34.61 -> 10.129.34.51 SIP 753 Status: 200 OK    (1 bindings)
  0.783425 10.129.34.61 -> 10.129.34.51 SIP 750 Status: 200 OK    (1 bindings)
  0.783681 10.129.34.61 -> 10.129.34.51 SIP 754 Status: 200 OK    (1 bindings)
  0.784414 10.129.34.61 -> 10.129.34.51 SIP 600 Status: 401 Unauthorized    (0 bindings)
  0.785805 10.129.34.61 -> 10.129.34.51 SIP 749 Status: 200 OK    (1 bindings)
  0.790598 10.129.34.51 -> 10.129.34.61 SIP 881 Request: REGISTER sip:ims.hom
  0.791306 10.129.34.51 -> 10.129.34.61 SIP 880 Request: REGISTER sip:ims.hom
  0.827950 10.129.34.61 -> 10.129.34.51 TCP 66 rlm-admin > 39746 [ACK] Seq=1 Ack=816 Win=83 Len=0 TSval=255737954 TSecr=62140698
  0.828042 10.129.34.61 -> 10.129.34.51 TCP 66 rlm-admin > 41836 [ACK] Seq=1 Ack=815 Win=78 Len=0 TSval=255737954 TSecr=62140698
  0.975935 10.129.34.61 -> 10.129.34.51 SIP 601 [TCP Retransmission] Status: 401 Unauthorized    (0 bindings)
  0.976622 10.129.34.51 -> 10.129.34.61 TCP 66 40502 > rlm-admin [ACK] Seq=3364 Ack=1073 Win=65 Len=0 TSval=62140744 TSecr=255737991
  0.976647 10.129.34.61 -> 10.129.34.51 SIP 1139 Status: 401 Unauthorized    (0 bindings)
  0.980015 10.129.34.61 -> 10.129.34.51 SIP 751 [TCP Retransmission] Status: 200 OK    (1 bindings)
  0.980026 10.129.34.61 -> 10.129.34.51 SIP 750 [TCP Retransmission] Status: 200 OK    (1 bindings)
  0.983805 10.129.34.61 -> 10.129.34.51 SIP 603 [TCP Retransmission] Status: 401 Unauthorized    (0 bindings)
  0.983923 10.129.34.61 -> 10.129.34.51 SIP 748 [TCP Retransmission] Status: 200 OK    (1 bindings)
  0.984161 10.129.34.51 -> 10.129.34.61 TCP 66 35822 > rlm-admin [ACK] Seq=3334 Ack=1609 Win=35 Len=0 TSval=62140746 TSecr=255737993
  0.984192 10.129.34.61 -> 10.129.34.51 SIP 749 Status: 200 OK    (1 bindings)
  0.987801 10.129.34.61 -> 10.129.34.51 SIP 753 [TCP Retransmission] Status: 200 OK    (1 bindings)
  0.987836 10.129.34.61 -> 10.129.34.51 SIP 754 [TCP Retransmission] Status: 200 OK    (1 bindings)
  0.988350 10.129.34.51 -> 10.129.34.61 TCP 66 48725 > rlm-admin [ACK] Seq=3278 Ack=1567 Win=36 Len=0 TSval=62140747 TSecr=255737994
  0.988388 10.129.34.61 -> 10.129.34.51 SIP 754 Status: 200 OK    (1 bindings)
  0.992075 10.129.34.61 -> 10.129.34.51 SIP 753 [TCP Retransmission] Status: 200 OK    (1 bindings)
  0.992107 10.129.34.61 -> 10.129.34.51 SIP 750 [TCP Retransmission] Status: 200 OK    (1 bindings)
  0.992115 10.129.34.61 -> 10.129.34.51 SIP 600 [TCP Retransmission] Status: 401 Unauthorized    (0 bindings)
  0.992260 10.129.34.51 -> 10.129.34.61 TCP 66 45641 > rlm-admin [ACK] Seq=815 Ack=688 Win=74 Len=0 TSval=62140748 TSecr=255737995
  0.995927 10.129.34.61 -> 10.129.34.51 SIP 751 [TCP Retransmission] Status: 200 OK    (1 bindings)
  0.995965 10.129.34.61 -> 10.129.34.51 SIP 749 [TCP Retransmission] Status: 200 OK    (1 bindings)
  0.996397 10.129.34.51 -> 10.129.34.61 TCP 66 53085 > rlm-admin [ACK] Seq=813 Ack=686 Win=82 Len=0 TSval=62140749 TSecr=255737996
  0.998856 10.129.34.51 -> 10.129.34.61 SIP 877 Request: REGISTER sip:ims.hom
  0.998882 10.129.34.61 -> 10.129.34.51 TCP 66 rlm-admin > 48725 [ACK] Seq=2255 Ack=4089 Win=45 Len=0 TSval=255737996 TSecr=62140750
  0.999484 10.129.34.51 -> 10.129.34.61 SIP 905 Request: REGISTER sip:ims.hom
  0.999505 10.129.34.61 -> 10.129.34.51 TCP 66 rlm-admin > 55525 [ACK] Seq=536 Ack=2521 Win=81 Len=0 TSval=255737996 TSecr=62140750
  1.000122 10.129.34.51 -> 10.129.34.61 SIP 873 Request: REGISTER sip:ims.hom
  1.000144 10.129.34.61 -> 10.129.34.51 TCP 66 rlm-admin > 48324 [ACK] Seq=1070 Ack=2485 Win=39 Len=0 TSval=255737997 TSecr=62140750
  1.000667 10.129.34.51 -> 10.129.34.61 SIP 908 Request: REGISTER sip:ims.hom
  1.000688 10.129.34.61 -> 10.129.34.51 TCP 66 rlm-admin > 36308 [ACK] Seq=1 Ack=843 Win=32 Len=0 TSval=255737997 TSecr=62140750
  1.001566 10.129.34.51 -> 10.129.34.61 SIP 906 Request: REGISTER sip:ims.hom
  1.001590 10.129.34.61 -> 10.129.34.51 TCP 66 rlm-admin > 35505 [ACK] Seq=689 Ack=2496 Win=81 Len=0 TSval=255737997 TSecr=62140751
  1.001971 10.129.34.51 -> 10.129.34.61 SIP 905 Request: REGISTER sip:ims.hom
  1.002558 10.129.34.51 -> 10.129.34.61 SIP 907 Request: REGISTER sip:ims.hom
  1.002581 10.129.34.61 -> 10.129.34.51 TCP 66 rlm-admin > 49048 [ACK] Seq=1068 Ack=2517 Win=68 Len=0 TSval=255737997 TSecr=62140751
  1.003067 10.129.34.51 -> 10.129.34.61 SIP 906 Request: REGISTER sip:ims.hom
  1.003090 10.129.34.61 -> 10.129.34.51 TCP 66 rlm-admin > 48667 [ACK] Seq=535 Ack=1678 Win=71 Len=0 TSval=255737997 TSecr=62140751
  1.004230 10.129.34.51 -> 10.129.34.61 SIP 906 Request: REGISTER sip:ims.hom
  1.004253 10.129.34.61 -> 10.129.34.51 TCP 66 rlm-admin > 44657 [ACK] Seq=1068 Ack=2514 Win=82 Len=0 TSval=255737998 TSecr=62140751
  1.006105 10.129.34.51 -> 10.129.34.61 SIP 907 Request: REGISTER sip:ims.hom
  1.006134 10.129.34.61 -> 10.129.34.51 TCP 66 rlm-admin > 53948 [ACK] Seq=685 Ack=1653 Win=81 Len=0 TSval=255737998 TSecr=62140752
  1.006765 10.129.34.51 -> 10.129.34.61 SIP 906 Request: REGISTER sip:ims.hom
  1.006794 10.129.34.61 -> 10.129.34.51 TCP 66 rlm-admin > 49736 [ACK] Seq=684 Ack=1651 Win=68 Len=0 TSval=255737998 TSecr=62140752
  1.007742 10.129.34.51 -> 10.129.34.61 SIP 907 Request: REGISTER sip:ims.hom
  1.008722 10.129.34.51 -> 10.129.34.61 SIP 908 Request: REGISTER sip:ims.hom
  1.008749 10.129.34.61 -> 10.129.34.51 TCP 66 rlm-admin > 35927 [ACK] Seq=1 Ack=1683 Win=81 Len=0 TSval=255737999 TSecr=62140752
  1.009094 10.129.34.61 -> 10.129.34.51 SIP 506 Status: 503 Service Unavailable    (0 bindings)
  1.009501 10.129.34.61 -> 10.129.34.51 SIP 507 Status: 503 Service Unavailable    (0 bindings)
  1.010311 10.129.34.51 -> 10.129.34.61 SIP 907 Request: REGISTER sip:ims.hom
  1.010340 10.129.34.61 -> 10.129.34.51 TCP 66 rlm-admin > 59051 [ACK] Seq=440 Ack=1682 Win=77 Len=0 TSval=255737999 TSecr=62140753
  1.010631 10.129.34.61 -> 10.129.34.51 SIP 506 Status: 503 Service Unavailable    (0 bindings)
  1.010721 10.129.34.51 -> 10.129.34.61 SIP 904 Request: REGISTER sip:ims.hom
  1.010742 10.129.34.61 -> 10.129.34.51 TCP 66 rlm-admin > 39746 [ACK] Seq=1 Ack=1654 Win=82 Len=0 TSval=255737999 TSecr=62140753
  1.010960 10.129.34.61 -> 10.129.34.51 SIP 503 Status: 503 Service Unavailable    (0 bindings)
  1.011994 10.129.34.51 -> 10.129.34.61 SIP 906 Request: REGISTER sip:ims.hom
  1.012023 10.129.34.61 -> 10.129.34.51 TCP 66 rlm-admin > 35822 [ACK] Seq=2292 Ack=4174 Win=45 Len=0 TSval=255738000 TSecr=62140753
  1.012527 10.129.34.51 -> 10.129.34.61 SIP 906 Request: REGISTER sip:ims.hom
  1.012550 10.129.34.61 -> 10.129.34.51 TCP 66 rlm-admin > 48727 [ACK] Seq=1 Ack=841 Win=48 Len=0 TSval=255738000 TSecr=62140753
  1.012768 10.129.34.61 -> 10.129.34.51 SIP 505 Status: 503 Service Unavailable    (0 bindings)
  1.013138 10.129.34.51 -> 10.129.34.61 SIP 1514 Request: REGISTER sip:ims.hom
  1.013157 10.129.34.61 -> 10.129.34.51 TCP 66 rlm-admin > 48725 [ACK] Seq=2255 Ack=5537 Win=51 Len=0 TSval=255738000 TSecr=62140753
  1.013866 10.129.34.51 -> 10.129.34.61 SIP 908 Request: REGISTER sip:ims.hom
  1.014083 10.129.34.61 -> 10.129.34.51 SIP 507 Status: 503 Service Unavailable    (0 bindings)
  1.014474 10.129.34.51 -> 10.129.34.61 SIP 906 Request: REGISTER sip:ims.hom
  1.014716 10.129.34.61 -> 10.129.34.51 SIP 505 Status: 503 Service Unavailable    (0 bindings)
  1.015631 10.129.34.51 -> 10.129.34.61 SIP 906 Request: REGISTER sip:ims.hom
  1.015652 10.129.34.61 -> 10.129.34.51 TCP 66 rlm-admin > 41836 [ACK] Seq=1 Ack=1655 Win=81 Len=0 TSval=255738000 TSecr=62140754
  1.015886 10.129.34.61 -> 10.129.34.51 SIP 505 Status: 503 Service Unavailable    (0 bindings)
  1.016220 10.129.34.51 -> 10.129.34.61 SIP 906 Request: REGISTER sip:ims.hom
  1.016245 10.129.34.61 -> 10.129.34.51 TCP 66 rlm-admin > 38168 [ACK] Seq=440 Ack=1681 Win=80 Len=0 TSval=255738001 TSecr=62140754
  1.016534 10.129.34.61 -> 10.129.34.51 SIP 505 Status: 503 Service Unavailable    (0 bindings)
  1.018047 10.129.34.51 -> 10.129.34.61 SIP 906 Request: REGISTER sip:ims.hom
  1.018075 10.129.34.61 -> 10.129.34.51 TCP 66 rlm-admin > 33442 [ACK] Seq=1 Ack=841 Win=32 Len=0 TSval=255738001 TSecr=62140755
  1.018326 10.129.34.61 -> 10.129.34.51 SIP 505 Status: 503 Service Unavailable    (0 bindings)
  1.019722 10.129.34.51 -> 10.129.34.61 SIP 882 Request: REGISTER sip:ims.hom
  1.019759 10.129.34.61 -> 10.129.34.51 TCP 66 rlm-admin > 54707 [ACK] Seq=536 Ack=1655 Win=82 Len=0 TSval=255738001 TSecr=62140755
  1.020040 10.129.34.61 -> 10.129.34.51 SIP 507 Status: 503 Service Unavailable    (0 bindings)
  1.033532 10.129.34.51 -> 10.129.34.61 SIP 882 [TCP Retransmission] Request: REGISTER sip:ims.hom
  1.033563 10.129.34.61 -> 10.129.34.51 TCP 78 [TCP Dup ACK 129#1] rlm-admin > 48540 [ACK] Seq=1 Ack=817 Win=83 Len=0 TSval=255738005 TSecr=62140759 SLE=1 SRE=817
  1.039831 10.129.34.61 -> 10.129.34.51 TCP 66 rlm-admin > 45187 [ACK] Seq=1 Ack=840 Win=83 Len=0 TSval=255738007 TSecr=62140751
  1.096816 10.129.34.61 -> 10.129.34.51 SIP 748 Status: 200 OK    (1 bindings)
  1.097388 10.129.34.51 -> 10.129.34.61 TCP 66 35881 > rlm-admin [ACK] Seq=810 Ack=683 Win=32 Len=0 TSval=62140775 TSecr=255738021
  1.183821 10.129.34.61 -> 10.129.34.51 SIP 1139 [TCP Retransmission] Status: 401 Unauthorized    (0 bindings)
  1.184654 10.129.34.51 -> 10.129.34.61 TCP 66 40502 > rlm-admin [ACK] Seq=3364 Ack=2146 Win=70 Len=0 TSval=62140796 TSecr=255738043
  1.191924 10.129.34.61 -> 10.129.34.51 SIP 749 [TCP Retransmission] Status: 200 OK    (1 bindings)
  1.196036 10.129.34.61 -> 10.129.34.51 SIP 754 [TCP Retransmission] Status: 200 OK    (1 bindings)
  1.196521 10.129.34.51 -> 10.129.34.61 SIP 301 Request: REGISTER sip:ims.hom
  1.196555 10.129.34.61 -> 10.129.34.51 SIP 507 Status: 503 Service Unavailable    (0 bindings)
  1.208022 10.129.34.51 -> 10.129.34.61 SIP 880 Request: REGISTER sip:ims.hom
  1.208073 10.129.34.61 -> 10.129.34.51 TCP 66 rlm-admin > 35823 [ACK] Seq=686 Ack=1627 Win=82 Len=0 TSval=255738049 TSecr=62140802
  1.208633 10.129.34.51 -> 10.129.34.61 SIP 1514 Request: REGISTER sip:ims.hom
  1.211978 10.129.34.61 -> 10.129.34.51 SIP 507 [TCP Retransmission] Status: 503 Service Unavailable    (0 bindings)
  1.211992 10.129.34.61 -> 10.129.34.51 SIP 503 [TCP Retransmission] Status: 503 Service Unavailable    (0 bindings)
  1.212473 10.129.34.51 -> 10.129.34.61 SIP 272 Request: REGISTER sip:ims.hom
  1.212492 10.129.34.51 -> 10.129.34.61 TCP 66 39746 > rlm-admin [ACK] Seq=1654 Ack=438 Win=83 Len=0 TSval=62140803 TSecr=255738050
  1.217384 10.129.34.51 -> 10.129.34.61 SIP 907 [TCP Retransmission] Request: REGISTER sip:ims.hom
  1.217413 10.129.34.61 -> 10.129.34.51 TCP 78 [TCP Dup ACK 182#1] rlm-admin > 49048 [ACK] Seq=1068 Ack=2517 Win=68 Len=0 TSval=255738051 TSecr=62140805 SLE=1676 SRE=2517
  1.217941 10.129.34.51 -> 10.129.34.61 SIP 907 Request: REGISTER sip:ims.hom
  1.217967 10.129.34.61 -> 10.129.34.51 TCP 66 rlm-admin > 49048 [ACK] Seq=1068 Ack=3358 Win=71 Len=0 TSval=255738051 TSecr=62140805
  1.219841 10.129.34.61 -> 10.129.34.51 SIP 506 [TCP Retransmission] Status: 503 Service Unavailable    (0 bindings)
  1.219855 10.129.34.61 -> 10.129.34.51 SIP 506 [TCP Retransmission] Status: 503 Service Unavailable    (0 bindings)
  1.219863 10.129.34.61 -> 10.129.34.51 SIP 505 [TCP Retransmission] Status: 503 Service Unavailable    (0 bindings)
  1.219872 10.129.34.61 -> 10.129.34.51 SIP 505 [TCP Retransmission] Status: 503 Service Unavailable    (0 bindings)
  1.219878 10.129.34.61 -> 10.129.34.51 SIP 505 [TCP Retransmission] Status: 503 Service Unavailable    (0 bindings)
  1.220335 10.129.34.51 -> 10.129.34.61 TCP 66 34967 > rlm-admin [ACK] Seq=842 Ack=441 Win=72 Len=0 TSval=62140805 TSecr=255738052
  1.220351 10.129.34.51 -> 10.129.34.61 TCP 66 59051 > rlm-admin [ACK] Seq=1682 Ack=880 Win=83 Len=0 TSval=62140805 TSecr=255738052
  1.220359 10.129.34.51 -> 10.129.34.61 TCP 66 48727 > rlm-admin [ACK] Seq=841 Ack=440 Win=45 Len=0 TSval=62140805 TSecr=255738052
  1.220366 10.129.34.51 -> 10.129.34.61 TCP 66 57618 > rlm-admin [ACK] Seq=841 Ack=440 Win=82 Len=0 TSval=62140805 TSecr=255738052
  1.220372 10.129.34.51 -> 10.129.34.61 TCP 66 38168 > rlm-admin [ACK] Seq=1681 Ack=879 Win=71 Len=0 TSval=62140805 TSecr=255738052
  1.224060 10.129.34.61 -> 10.129.34.51 SIP 507 [TCP Retransmission] Status: 503 Service Unavailable    (0 bindings)
  1.224104 10.129.34.61 -> 10.129.34.51 SIP 505 [TCP Retransmission] Status: 503 Service Unavailable    (0 bindings)
  1.224594 10.129.34.51 -> 10.129.34.61 TCP 66 57258 > rlm-admin [ACK] Seq=843 Ack=442 Win=83 Len=0 TSval=62140806 TSecr=255738053
  1.224615 10.129.34.51 -> 10.129.34.61 TCP 66 41836 > rlm-admin [ACK] Seq=1655 Ack=440 Win=74 Len=0 TSval=62140806 TSecr=255738053
  1.225347 10.129.34.51 -> 10.129.34.61 SIP 906 [TCP Retransmission] Request: REGISTER sip:ims.hom
  1.225377 10.129.34.61 -> 10.129.34.51 TCP 78 [TCP Dup ACK 190#1] rlm-admin > 49736 [ACK] Seq=684 Ack=1651 Win=68 Len=0 TSval=255738053 TSecr=62140807 SLE=811 SRE=1651
  1.227892 10.129.34.61 -> 10.129.34.51 SIP 505 [TCP Retransmission] Status: 503 Service Unavailable    (0 bindings)
  1.228372 10.129.34.51 -> 10.129.34.61 TCP 66 33442 > rlm-admin [ACK] Seq=841 Ack=440 Win=31 Len=0 TSval=62140807 TSecr=255738054
  1.229277 10.129.34.51 -> 10.129.34.61 TCP 66 35822 > rlm-admin [ACK] Seq=4174 Ack=2292 Win=38 Len=0 TSval=62140808 TSecr=255738045
  1.229305 10.129.34.61 -> 10.129.34.51 SIP 505 Status: 503 Service Unavailable    (0 bindings)
  1.231800 10.129.34.61 -> 10.129.34.51 SIP 507 [TCP Retransmission] Status: 503 Service Unavailable    (0 bindings)
  1.232250 10.129.34.51 -> 10.129.34.61 TCP 66 54707 > rlm-admin [ACK] Seq=1655 Ack=977 Win=83 Len=0 TSval=62140808 TSecr=255738055
  1.233540 10.129.34.51 -> 10.129.34.61 TCP 66 48725 > rlm-admin [ACK] Seq=5772 Ack=2696 Win=41 Len=0 TSval=62140809 TSecr=255738046
  1.233561 10.129.34.61 -> 10.129.34.51 SIP 602 Status: 401 Unauthorized    (0 bindings)
  1.241512 10.129.34.51 -> 10.129.34.61 SIP 906 [TCP Retransmission] Request: REGISTER sip:ims.hom
  1.241555 10.129.34.61 -> 10.129.34.51 TCP 78 [TCP Window Update] rlm-admin > 44657 [ACK] Seq=1068 Ack=2514 Win=83 Len=0 TSval=255738057 TSecr=62140811 SLE=1674 SRE=2514
  1.242350 10.129.34.51 -> 10.129.34.61 SIP 906 Request: REGISTER sip:ims.hom
  1.242381 10.129.34.61 -> 10.129.34.51 TCP 66 rlm-admin > 44657 [ACK] Seq=1068 Ack=3354 Win=82 Len=0 TSval=255738057 TSecr=62140811
  1.251895 10.129.34.61 -> 10.129.34.51 TCP 66 rlm-admin > 35927 [ACK] Seq=442 Ack=3337 Win=83 Len=0 TSval=255738060 TSecr=62140803
  1.265483 10.129.34.51 -> 10.129.34.61 SIP 906 [TCP Retransmission] Request: REGISTER sip:ims.hom
  1.265528 10.129.34.61 -> 10.129.34.51 TCP 78 [TCP Dup ACK 179#1] rlm-admin > 35505 [ACK] Seq=689 Ack=2496 Win=81 Len=0 TSval=255738063 TSecr=62140817 SLE=1656 SRE=2496
  1.277414 10.129.34.51 -> 10.129.34.61 SIP 905 [TCP Retransmission] Request: REGISTER sip:ims.hom
  1.277469 10.129.34.61 -> 10.129.34.51 TCP 78 [TCP Window Update] rlm-admin > 55525 [ACK] Seq=536 Ack=2521 Win=82 Len=0 TSval=255738066 TSecr=62140820 SLE=1682 SRE=2521
  1.278133 10.129.34.51 -> 10.129.34.61 SIP 873 Request: REGISTER sip:ims.hom
  1.278158 10.129.34.61 -> 10.129.34.51 TCP 66 rlm-admin > 55525 [ACK] Seq=536 Ack=3328 Win=81 Len=0 TSval=255738066 TSecr=62140820
  1.293709 10.129.34.51 -> 10.129.34.61 SIP 881 [TCP Retransmission] Request: REGISTER sip:ims.hom
  1.293740 10.129.34.61 -> 10.129.34.51 TCP 78 [TCP Dup ACK 127#1] rlm-admin > 56476 [ACK] Seq=1 Ack=816 Win=32 Len=0 TSval=255738070 TSecr=62140824 SLE=1 SRE=816
  1.294465 10.129.34.51 -> 10.129.34.61 SIP 873 Request: REGISTER sip:ims.hom
  1.294493 10.129.34.61 -> 10.129.34.51 TCP 66 rlm-admin > 56476 [ACK] Seq=1 Ack=1623 Win=35 Len=0 TSval=255738070 TSecr=62140824
  1.297530 10.129.34.51 -> 10.129.34.61 SIP 906 [TCP Retransmission] Request: REGISTER sip:ims.hom
  1.297559 10.129.34.61 -> 10.129.34.51 TCP 78 [TCP Dup ACK 184#1] rlm-admin > 48667 [ACK] Seq=535 Ack=1678 Win=71 Len=0 TSval=255738071 TSecr=62140825 SLE=838 SRE=1678
  1.387897 10.129.34.61 -> 10.129.34.51 SIP 751 [TCP Retransmission] Status: 200 OK    (1 bindings)
  1.388050 10.129.34.61 -> 10.129.34.51 SIP 750 [TCP Retransmission] Status: 200 OK    (1 bindings)
  1.388520 10.129.34.51 -> 10.129.34.61 TCP 66 35823 > rlm-admin [ACK] Seq=1627 Ack=686 Win=82 Len=0 TSval=62140847 TSecr=255738094
  1.388544 10.129.34.61 -> 10.129.34.51 SIP 753 Status: 200 OK    (1 bindings)
  1.388586 10.129.34.51 -> 10.129.34.61 TCP 66 53948 > rlm-admin [ACK] Seq=1653 Ack=685 Win=71 Len=0 TSval=62140847 TSecr=255738094
  1.388600 10.129.34.61 -> 10.129.34.51 SIP 506 Status: 503 Service Unavailable    (0 bindings)
  1.388952 10.129.34.51 -> 10.129.34.61 TCP 66 35823 > rlm-admin [ACK] Seq=1627 Ack=1373 Win=81 Len=0 TSval=62140847 TSecr=255738094
  1.388967 10.129.34.51 -> 10.129.34.61 TCP 66 53948 > rlm-admin [ACK] Seq=1653 Ack=1125 Win=74 Len=0 TSval=62140847 TSecr=255738094
  1.389236 10.129.34.51 -> 10.129.34.61 SIP 908 [TCP Retransmission] Request: REGISTER sip:ims.hom
  1.389252 10.129.34.61 -> 10.129.34.51 TCP 78 [TCP Dup ACK 177#1] rlm-admin > 36308 [ACK] Seq=1 Ack=843 Win=32 Len=0 TSval=255738094 TSecr=62140848 SLE=1 SRE=843
  1.389873 10.129.34.51 -> 10.129.34.61 SIP 908 Request: REGISTER sip:ims.hom
  1.389887 10.129.34.61 -> 10.129.34.51 TCP 66 rlm-admin > 36308 [ACK] Seq=1 Ack=1685 Win=35 Len=0 TSval=255738094 TSecr=62140848
  1.391926 10.129.34.61 -> 10.129.34.51 SIP 748 [TCP Retransmission] Status: 200 OK    (1 bindings)
  1.392623 10.129.34.51 -> 10.129.34.61 TCP 66 43239 > rlm-admin [ACK] Seq=1645 Ack=1215 Win=81 Len=0 TSval=62140848 TSecr=255738095
  1.403871 10.129.34.61 -> 10.129.34.51 SIP 754 [TCP Retransmission] Status: 200 OK    (1 bindings)
  1.404510 10.129.34.51 -> 10.129.34.61 TCP 66 35505 > rlm-admin [ACK] Seq=2496 Ack=689 Win=76 Len=0 TSval=62140851 TSecr=255738098
  1.404534 10.129.34.61 -> 10.129.34.51 SIP 601 Status: 401 Unauthorized    (0 bindings)
  1.407938 10.129.34.61 -> 10.129.34.51 SIP 600 [TCP Retransmission] Status: 401 Unauthorized    (0 bindings)
  1.408522 10.129.34.51 -> 10.129.34.61 TCP 66 44657 > rlm-admin [ACK] Seq=3354 Ack=1068 Win=82 Len=0 TSval=62140852 TSecr=255738099
  1.408551 10.129.34.61 -> 10.129.34.51 SIP 601 Status: 401 Unauthorized    (0 bindings)
  1.415814 10.129.34.61 -> 10.129.34.51 SIP 750 [TCP Retransmission] Status: 200 OK    (1 bindings)
  1.416684 10.129.34.51 -> 10.129.34.61 TCP 66 53558 > rlm-admin [ACK] Seq=812 Ack=685 Win=32 Len=0 TSval=62140854 TSecr=255738101
  1.419818 10.129.34.61 -> 10.129.34.51 SIP 749 [TCP Retransmission] Status: 200 OK    (1 bindings)
  1.425470 10.129.34.51 -> 10.129.34.61 SIP 873 [TCP Retransmission] Request: REGISTER sip:ims.hom
  1.425496 10.129.34.61 -> 10.129.34.51 TCP 78 [TCP Dup ACK 175#1] rlm-admin > 48324 [ACK] Seq=1070 Ack=2485 Win=39 Len=0 TSval=255738103 TSecr=62140857 SLE=1678 SRE=2485
  1.426013 10.129.34.51 -> 10.129.34.61 SIP 906 Request: REGISTER sip:ims.hom
  1.426034 10.129.34.61 -> 10.129.34.51 TCP 66 rlm-admin > 48324 [ACK] Seq=1070 Ack=3325 Win=42 Len=0 TSval=255738103 TSecr=62140857
  1.429738 10.129.34.51 -> 10.129.34.61 SIP 877 Request: REGISTER sip:ims.hom
  1.439814 10.129.34.61 -> 10.129.34.51 SIP 505 [TCP Retransmission] Status: 503 Service Unavailable    (0 bindings)
  1.443953 10.129.34.61 -> 10.129.34.51 SIP 602 [TCP Retransmission] Status: 401 Unauthorized    (0 bindings)
  1.444654 10.129.34.51 -> 10.129.34.61 TCP 66 48725 > rlm-admin [ACK] Seq=5772 Ack=3232 Win=44 Len=0 TSval=62140861 TSecr=255738108
  1.458704 10.129.34.51 -> 10.129.34.61 SIP 880 Request: REGISTER sip:ims.hom
  1.458762 10.129.34.61 -> 10.129.34.51 TCP 66 rlm-admin > 48540 [ACK] Seq=1 Ack=1631 Win=82 Len=0 TSval=255738111 TSecr=62140865
  1.467828 10.129.34.61 -> 10.129.34.51 TCP 66 rlm-admin > 57258 [ACK] Seq=442 Ack=1654 Win=81 Len=0 TSval=255738114 TSecr=62140857
  1.611889 10.129.34.61 -> 10.129.34.51 SIP 601 [TCP Retransmission] Status: 401 Unauthorized    (0 bindings)
  1.612732 10.129.34.51 -> 10.129.34.61 TCP 66 35505 > rlm-admin [ACK] Seq=2496 Ack=1224 Win=79 Len=0 TSval=62140903 TSecr=255738150
  1.616089 10.129.34.61 -> 10.129.34.51 SIP 601 [TCP Retransmission] Status: 401 Unauthorized    (0 bindings)
  1.616746 10.129.34.51 -> 10.129.34.61 TCP 66 44657 > rlm-admin [ACK] Seq=3354 Ack=1603 Win=81 Len=0 TSval=62140904 TSecr=255738151
  1.632841 10.129.34.51 -> 10.129.34.61 SIP 879 Request: REGISTER sip:ims.hom
  1.633254 10.129.34.51 -> 10.129.34.61 SIP 880 Request: REGISTER sip:ims.hom
  1.671967 10.129.34.61 -> 10.129.34.51 TCP 66 rlm-admin > 54707 [ACK] Seq=977 Ack=2468 Win=83 Len=0 TSval=255738165 TSecr=62140908
  1.672110 10.129.34.61 -> 10.129.34.51 TCP 66 rlm-admin > 48569 [ACK] Seq=1 Ack=815 Win=68 Len=0 TSval=255738165 TSecr=62140908
  1.682571 10.129.34.61 -> 10.129.34.51 SIP 601 Status: 401 Unauthorized    (0 bindings)
  1.683127 10.129.34.51 -> 10.129.34.61 TCP 66 56476 > rlm-admin [ACK] Seq=1623 Ack=536 Win=31 Len=0 TSval=62140921 TSecr=255738167
  1.683438 10.129.34.61 -> 10.129.34.51 SIP 603 Status: 401 Unauthorized    (0 bindings)
  1.683796 10.129.34.51 -> 10.129.34.61 TCP 66 36308 > rlm-admin [ACK] Seq=1685 Ack=538 Win=31 Len=0 TSval=62140921 TSecr=255738167
  1.684134 10.129.34.61 -> 10.129.34.51 SIP 601 Status: 401 Unauthorized    (0 bindings)
  1.684674 10.129.34.51 -> 10.129.34.61 TCP 66 44657 > rlm-admin [ACK] Seq=3354 Ack=2138 Win=81 Len=0 TSval=62140921 TSecr=255738168
  1.687415 10.129.34.61 -> 10.129.34.51 SIP 601 Status: 401 Unauthorized    (0 bindings)
  1.687965 10.129.34.51 -> 10.129.34.61 TCP 66 55525 > rlm-admin [ACK] Seq=3328 Ack=1071 Win=82 Len=0 TSval=62140922 TSecr=255738168
  1.689603 10.129.34.61 -> 10.129.34.51 SIP 754 Status: 200 OK    (1 bindings)
  1.689969 10.129.34.61 -> 10.129.34.51 SIP 750 Status: 200 OK    (1 bindings)
  1.690578 10.129.34.51 -> 10.129.34.61 TCP 66 57258 > rlm-admin [ACK] Seq=1654 Ack=1126 Win=82 Len=0 TSval=62140923 TSecr=255738169
  1.692230 10.129.34.61 -> 10.129.34.51 SIP 601 Status: 401 Unauthorized    (0 bindings)
  1.692745 10.129.34.51 -> 10.129.34.61 TCP 66 48324 > rlm-admin [ACK] Seq=3325 Ack=1605 Win=35 Len=0 TSval=62140923 TSecr=255738170
  1.694488 10.129.34.61 -> 10.129.34.51 SIP 753 Status: 200 OK    (1 bindings)
  1.695943 10.129.34.51 -> 10.129.34.61 SIP 848 Request: REGISTER sip:ims.hom
  1.695964 10.129.34.61 -> 10.129.34.51 TCP 66 rlm-admin > 56476 [ACK] Seq=536 Ack=2405 Win=38 Len=0 TSval=255738171 TSecr=62140924
  1.696792 10.129.34.61 -> 10.129.34.51 SIP 602 Status: 401 Unauthorized    (0 bindings)
  1.705224 10.129.34.61 -> 10.129.34.51 SIP 600 Status: 401 Unauthorized    (0 bindings)
  1.705838 10.129.34.61 -> 10.129.34.51 SIP 753 Status: 200 OK    (1 bindings)
  1.707196 10.129.34.51 -> 10.129.34.61 SIP 879 Request: REGISTER sip:ims.hom
  1.707235 10.129.34.61 -> 10.129.34.51 TCP 66 rlm-admin > 55862 [ACK] Seq=973 Ack=2490 Win=82 Len=0 TSval=255738173 TSecr=62140927
  1.707748 10.129.34.51 -> 10.129.34.61 SIP 879 Request: REGISTER sip:ims.hom
  1.707768 10.129.34.61 -> 10.129.34.51 TCP 66 rlm-admin > 35180 [ACK] Seq=1 Ack=1629 Win=82 Len=0 TSval=255738173 TSecr=62140927
  1.708018 10.129.34.61 -> 10.129.34.51 SIP 752 Status: 200 OK    (1 bindings)
  1.708543 10.129.34.51 -> 10.129.34.61 SIP 848 Request: REGISTER sip:ims.hom
  1.708578 10.129.34.61 -> 10.129.34.51 TCP 66 rlm-admin > 55525 [ACK] Seq=1605 Ack=4110 Win=81 Len=0 TSval=255738174 TSecr=62140927
  1.709285 10.129.34.51 -> 10.129.34.61 SIP 879 Request: REGISTER sip:ims.hom
  1.721122 10.129.34.61 -> 10.129.34.51 SIP 752 Status: 200 OK    (1 bindings)
  1.729650 10.129.34.51 -> 10.129.34.61 TCP 66 35927 > rlm-admin [ACK] Seq=3337 Ack=1130 Win=83 Len=0 TSval=62140933 TSecr=255738169
  1.729691 10.129.34.61 -> 10.129.34.51 SIP 600 Status: 401 Unauthorized    (0 bindings)
  1.730259 10.129.34.51 -> 10.129.34.61 TCP 66 35927 > rlm-admin [ACK] Seq=3337 Ack=1664 Win=82 Len=0 TSval=62140933 TSecr=255738179
  1.747857 10.129.34.61 -> 10.129.34.51 TCP 66 rlm-admin > 34491 [ACK] Seq=1 Ack=814 Win=83 Len=0 TSval=255738184 TSecr=62140927
  1.748480 10.129.34.51 -> 10.129.34.61 SIP 880 Request: REGISTER sip:ims.hom
  1.748517 10.129.34.61 -> 10.129.34.51 TCP 66 rlm-admin > 49048 [ACK] Seq=1604 Ack=4172 Win=74 Len=0 TSval=255738184 TSecr=62140937
  1.773105 10.129.34.61 -> 10.129.34.51 SIP 479 Status: 403 Forbidden    (0 bindings)
  1.863887 10.129.34.61 -> 10.129.34.51 SIP 505 [TCP Retransmission] Status: 503 Service Unavailable    (0 bindings)
  1.864703 10.129.34.51 -> 10.129.34.61 TCP 66 35822 > rlm-admin [ACK] Seq=4174 Ack=2731 Win=41 Len=0 TSval=62140966 TSecr=255738213
  1.899915 10.129.34.61 -> 10.129.34.51 SIP 753 [TCP Retransmission] Status: 200 OK    (1 bindings)
  1.900719 10.129.34.51 -> 10.129.34.61 TCP 66 48540 > rlm-admin [ACK] Seq=1631 Ack=688 Win=82 Len=0 TSval=62140975 TSecr=255738222
  1.904005 10.129.34.61 -> 10.129.34.51 SIP 602 [TCP Retransmission] Status: 401 Unauthorized    (0 bindings)
  1.912025 10.129.34.61 -> 10.129.34.51 SIP 753 [TCP Retransmission] Status: 200 OK    (1 bindings)
  1.915893 10.129.34.61 -> 10.129.34.51 SIP 600 [TCP Retransmission] Status: 401 Unauthorized    (0 bindings)
  1.919931 10.129.34.61 -> 10.129.34.51 SIP 752 [TCP Retransmission] Status: 200 OK    (1 bindings)
